"year","title","abstract","journal","doi"
"2012","Performing and undoing identity online: Social networking, identity theories and the incompatibility of online profiles and friendship regimes"," This article aims to expand the critical frameworks by which online social networking can be contextualised and understood within the broader cultural practices of identity and selfhood. Utilising Judith Butler’s theories of performative identity, it is argued that the use of social networking sites are performative acts in and of themselves. Two facets of social networking are examined from theoretical and critical perspectives: (1) the use of social networking profiles (Info pages, taste selections, biographies) as a tool for performing, developing and stabilising identity as a narrative in line with cultural demands for coherence, intelligibility and recognition; (2) identity performances that occur through relationality among online friends through list maintenance and communication (wall posts, tagging, commentary), and how identity is reconfigured within a network morphology. Finally, the article aims to open discussion around the broad cultural practices and implications of online social networking by developing some theoretical approaches to understanding the incompatibilities between these two facets which compete and risk the ‘undoing’ of online identity coherence. Within the framework of the growing use of social networking sites as one area in which our selfhood and subjectivity are performed, this incompatibility and undoing has both risks and benefits for future the cultural production of identity. ","",""
"2012","Social media discussion forums and product innovation - The way forward?","The purpose of this paper is to examine the potential use of social media discussion forums in product innovation. The literature shows the value of sport addicts and hobbyists as innovators in product innovation; hence this study is related to sports. This is an empirical study based on substantial data collected from 28 discussion forums. Altogether 2,178 discussions related to heart rate monitors have been evaluated for this paper.&#x0D; &#x0D; Discussion forums can be regarded as a source of product innovation. However, due to the excessive amount of information in these forums, a planned approach in order to utilize these remarks is necessary. Sport addicts and hobbyists are very interested in product improvements and usage possibilities, forming a considerable resource. Social media discussion forums can replace focus groups, online surveys and panels, and it is easy to reach large groups, test ideas and secure feedback. However, the rapid speed in conversations and excessive need for interaction between individuals set high demands for organizations, as they should clearly decide how to participate, when and how to direct discussions, and how to effectively be present.","",""
"2012","A Networked Self: Identity, Community and Culture on Social Network Sites","a networked self identity community and culture on a networked self identity community and culture on social network sites zizi papacharissi on amazon com free shipping on qualifying offers a networked self examines self presentation and social connection in the digital age this collection brings together new work on online social networks by leading scholars from a variety of disciplines, research on social network sites danah boyd bibliography of research on social network sites aaltonen s kakderi c hausmann v and heinze a 2013 social media in europe lessons from an online survey, american teen sociality in networked publics danah boyd taken out of context american teen sociality in networked publics by danah michele boyd b a brown university 2001 m s massachusetts institute of technology 2002, social networking service wikipedia a social networking service also social networking site or sns or social media is an online platform which people use to build social networks or social relations with other people who share similar personal or career interests activities backgrounds or real life connections the social networks are distributed across various computer networks the social networks are inherently computer, human knowledge foundations and limits fideisms judaism is the semitic monotheistic fideist religion based on the old testament s 1000 600 bce rules for the worship of yahweh by his chosen people the children of abraham s son isaac c1800 bce zoroastrianism is the persian monotheistic fideist religion founded by zarathustra c628 c551 bce and which teaches that good must be chosen over evil in order to achieve salvation, social media communication oxford bibliographies social media sm research is a relatively new area of academic inquiry thus it finds itself in constant flux researchers have primarily centered their efforts on learning more about what sm is as a phenomenon researchers have also aimed to understand the specific features and characteristics sm, informationweek serving the information needs of the informationweek com news analysis and commentary on information technology trends including cloud computing devops data analytics it leadership cybersecurity and it infrastructure, social intelligence social studies basic knowledge 101 social intelligence social studies society relates to human society and its members people living together enjoying life in communities or organized groups composed of sociable people or formed for the purpose of sociability tending to move together or live together in groups or colonies of the same kind, instagram motives for its use and relationship to","",""
"2012","Facebook as a Tool for Producing Sociality and Connectivity"," This article investigates whether social media in general—using Facebook as an example—warrant identification of a new public sphere, another private sphere, or a different corporate sphere, as some scholars have argued. It is argued that social media platforms neither warrant a recalibration of Habermas’ public sphere, nor a conscious blending of spheres. Rather, social media platforms form a contested space where private, public and corporate interests compete to produce new norms of sociality and connectivity. In order to understand the dynamics of social media, it is not enough to revamp existing social theory of networks, to polish up legal frames, or to reintroduce political-economic schemes. We need to connect these theories and come up with an analytical model that accounts for the complexities of the various interests interpenetrating the new space of mediated communication. ","",""
"2013","‘You have one identity’: performing the self on Facebook and LinkedIn"," Social media are popular stages for self-expression, communication and self-promotion. Rather than facilitating online identity formation, they are sites of struggle between users, employers and platform owners to control online identities – a struggle played out at the level of the interface. This article offers a comparative interface analysis between Facebook and LinkedIn. While Facebook is particularly focused on facilitating personal self-presentation, LinkedIn’s interface caters towards the need for professional self-promotion. And yet, both platforms deploy similar principles of connectivity and narrative – strategies that can be succinctly revealed in recent interface changes. These changing digital architectures form the necessary backdrop for asking critical questions about online self-presentation: How are public identities shaped through platform interfaces? How do these features enable and constrain the sculpting of personal and professional persona? And what are the consequences of imposed connectivity and narrative uniformity on people’s online identities? ","",""
"2013","Social media and debates in 3D cinema","Through its three research articles, this issue focuses on social media and its use in identity creation, professional communication and civic participation. Leading this section, Lee Farquar has undertaken a one-year Cyber-ethnographic study to examine identity presentations and interpretations of 346 Facebook users. He has observed that Facebookers sought social acceptance with their presentations and display an over-simplified imagery to reduce ambiguity and align with specific social groups. Farquar’s analysis is particularly interesting in its insight into the use of Facebook and the creation of identity within the platform’s construction of the social sphere. Following on from this, Lily Canter’s article takes up the use of social media in the professional context. Canter was the winner of the Convergence prize for best article by a research student at the Media, Communications and Cultural Studies Association (MeCCSA) 2012 conference held at the University of Bedfordshire. In her article ‘The interactive spectrum: the use of social media in UK regional newspapers’, she analyses the content of multiple social media profiles at two daily regional newspapers in the United Kingdom to determine how interactivity between journalists and readers is being shaped. Her study identifies a spectrum of interactivity which indicates that individual journalists are engaging with their readers in an informal, personal and reciprocal manner via social media platforms. It raises questions about whether journalists are particularly adept in their use of social media by comparison with other professionals’ engagement with this form of communication. Canter","",""
"2013","Performing and interpreting identity through Facebook imagery"," This one-year cyber-ethnography examines identity presentations and interpretations of 346 Facebook users. The social–psychological theoretical framework used drew specifically from symbolic interaction, Goffman’s performance of self, and schema theory. Generally, Facebookers sought social acceptance with their presentations. Primary findings indicate that the Facebookers present over-simplified imagery to reduce ambiguity and align with specific social groups. This study asked Facebookers to respond to strangers’ Facebook profiles, and the responses showed that due to the glut of identity-related information on the site, interpretations are heavily reliant on schemas. Online interview participants indicated several basic categories of identity performance that were used to assess others. Furthermore, online interview participants felt confident giving detailed descriptions of strangers’ personalities based on only a few minutes of viewing their profiles. ","",""
"2013","Facebook and the engineering of connectivity"," This article aims to explain how Web 2.0 platforms in general, and Facebook in particular, engineers online connections. Connectivity has become the material and metaphorical wiring of our culture, a culture in which technologies shape and are shaped not only by economic and legal frames, but also by users and content. The emergence of social media platforms is at the heart of a shifting dynamic, where various actors (technology, users, content, legal and economic actors) are building a connective space for communication and information. In order to comprehend this interwovenness, Bruno Latour’s actor-network theory will be invoked to explore how social media platforms can be analysed as techno-socio-cultural artefacts; this theoretical framework will be complemented by Castells’ political-economy approach to arrive at a fuller understanding of how social media operate. The documentary Catfish (2010) serves as an illustration to explore social media platforms in their multiple dimensions. ","",""
"2013","Facebook.com text: Industrialising personal data production","This article examines Facebook.com as a cultural text. It casts a critical eye on the stories told by the Facebook monopoly interphase, focusing on how these intergrate commerce with communications. It struggles with the text’s key abstractions arguing that Facebook industrialises personalised data production by demanding the constant production on customised communcation objects.","",""
"2013","Introduction: Understanding social media monopolies","The ubiquitous presence of social media in everyday life has not been met by equally pervasive research efforts for their critical understanding, due mostly to the increasing specialization and fragmentation of academic research. Unlike Us: Understanding Social Media Monopolies attempts to set out a research platform that overcomes both the dominant quantitative analyses and the privacy paradigm in current social media research.","",""
"2013","Society doesn't exist","This paper considers three versions of the claim that society doesn’t existence in order to investigate the problem of the idea of the social in social media. It identifies a convergence between the claims that society doesn’t exist and the social media we have. Yet it notes a disjunction between the media we have and the arguments of net critics and activists who say the problem is centralization and that what we need is individual control. Against this position, the paper argues for the relation between dispersion and centralization and the political potential manifest in centralization insofar as it makes apparent the social relations between people at the core of production.","",""
"2013","What's on your mind? Social media monopolies and noopower","This paper explores the age–old tension between the radical possibilities of thought and the institutions seeking to constrain thought as this tension plays out in social media sites such as Facebook, Twitter, and Google. I argue that these social media sites are becoming key institutions of noopower, or the power to modulate thoughts. Older institutions of power, such as states, militaries, and marketers, have begun to exercise noopower through and at social media in an effort to always be on our minds.","",""
"2013","Tales from Facebook","","",""
"2013","Participatory Culture and the New Governance of Communication"," This article develops a critical alternative to the common equation between participatory culture and democratic communication and argues that power on online participatory platforms should be understood as the governance of semiotic open-endedness. This article argues that the concept of cultural expression cannot be understood solely by looking at users’ cultural practices, but should be revisited to pay attention to the networked conditions that enable it. This involves tracing the governance of disparate processes such as protocols, software, linguistic processes, and cultural practices that make the production and circulation of meaning possible. Thus, communication on participatory platforms should be understood as the management of flows of meaning, that is, as the processes of codification of the informational, technical, cultural, and semiotic dynamics through which meanings are expressed. This makes it possible to understand the logics through which software platforms transform information into cultural signs and shape users’ perceptions and agencies. ","",""
