"year","title","abstract","journal","doi"
"2017","Small C-Patch Antenna for Portable Digital Television Receivers","In this paper a small c-patch antenna is designed and simulated. The antenna is compatible with Digital High-Definition Television frequency assignment in North America and it is able to be used in portable cellular units. The size of the designed antenna is less than the corresponding rectangular or circular patches. Besides, the c-patch antenna can be easily tunable in order to select the resonant frequency, and the matching impedance of the antenna can be changed by setting the feeding position. The performance of the antenna and its electrical features were evaluated using the HFSS software and, the results are presented here; where antenna gain, radiation patterns and other parameters were employed.","",""
"2017","Performance Evaluation of Limited Feedback Schemes for 3D Beamforming in LTE-Advanced System","The three-dimension (3D) multiple input and multiple output (MIMO) system is one of the key technologies studied for some advanced wireless communication systems such as Long Term Evolution-Advanced (LTE-A) In the 3D MIMO systems, uniform planar array (UPA) is equipped at BS. It enable elevation beamforming as well as azimuth beamforming. This paper investigates two limited feedback schemes for 3D beamforming. The spectral efficiency is evaluated for two limited feedback schemes in various antenna configurations.","",""
"2018","Analysis of Ratio of One and Product of Two Rayleigh Random Variables and its Application in Telecommunications","In this paper, the ratio of product of two Rayleigh random variables and Rayleigh random variable (RV) is considered. The level crossing rate (LCR) of ratio of product of two Rayleigh random variables and Rayleigh random variable is evaluated. Using this result, the average fade duration (AFD) of wireless relay communication system with two sections operating over multipath fading channel in the presence of co-channel interference can be calculated. Then, the LCR of the ratio of Rayleigh RV and product of two Rayleigh RVs is determined. The formula is obtained in the closed form. The influence of Rayleigh fading average power on the LCR is analyzed. By using this formula, the AFD of wireless relay system with two sections working over Rayleigh multipath fading channel in the presence of two Rayleigh co-channel interferences could be evaluated.","",""
"2018","Effects of Communication Channel on AODV performance within UAANETs","Many Modern researches are interested in UAVs because of their importance in a wide range of applications. The most important aspect of these researches is routing protocols due to their significant effect in their performance. One of the most popular protocols used in this type of network is AODV, which belongs to reactive protocols family. The major problem with this routing protocol and others is that they do not take into account the state of the channel and they assume it is always AWGN. This paper demonstrates the channel model as an important factor which affects the overall network performance. The paper also shows the great difference in performance between the case of AWGN channel and a shadowed fading channel which exists in real channel. The simulation was done in Optimized Network Engineering Tool (OPNET) 14.5 modeler.","",""
"2018","Coverage Mapping with UTD Model","Coverage prediction is vital for reliable digital communication and broadcasting systems. In order to increase QoS of these systems, the threshold field strength has to be provided and coverage map extracted before installation. In urban areas, direct fields are not allowed to reach the receiver point due to diffraction from high buildings. To calculate diffracted fields Uniform Theory of diffraction (UTD) model is proposed and this model is used to extract the coverage map. In this study, a scenario including 441 buildings is generated randomly and electric field is calculated at the top of all buildings. Finally, according to these electric fields coverage map is generated.","",""
"2018","Enhancement of MIMO QoS Using RNS Coding over Various Channels","The performance of wireless communication systems is affected mainly by the environment of its associated channel, which is characterized by a dynamic and unpredictable behaviour. In this paper different statistical satellite channel models are studied with emphasize on two main models, first is the Rice-Log normal model, due to its close representation for the satellite channel environment including shadowing and multi-path components that affect the propagated signal along its path, and second a three state model that take into account different fading conditions (clear area, moderate shadow and heavy shadowing). The communication system is enhanced through the usage of Residue-Number-System coding making benefit of its inherent features that is highlighted in the paper. The transmission system Bit Error Rate (BER), Peak-Average-Power Ratio (PAPR), and the channel capacity for each fading models are measured and analysed. These simulations are implemented using MATLAB tool and the results had shown the performance of transmission system over different channel models.","",""
"2018","Base Station Location Optimization with UTD and GO Models","Providing threshold signal quality is the most important problem in wireless communication for indoor and outdoor applications. Coverage mapping is required to deploy the base station to optimum place in order to ensure threshold value. Optimization of base station location is very important to communicate reliably, efficiently and healthy. Coverage is predicted by Uniform Theory of Diffraction (UTD) and geometrical optic (GO) models. By optimization, less number and power base station will be used. In this study, coverage maps are generated in all transmitter position and then optimum base station location is determined with using this coverage maps.","",""
"2019","Circular Polarization Antenna with Truncated Feed-and Reactance-Elements using GlassEpoxy Substrates","This paper presents a circular polarization plane antenna using linearly truncated triplate stripline resonator. Glass epoxy substrate is used in place of Teflon substrate for low cost fabrication. In spite the electrical dimension differs only √3 (root three), the dimensions of circular disk, its truncation, and feeding lines have to be chosen precisely and accurately to get better characteristics comparable to Teflon substrate.","",""
"2019","Optimizing the Data Transmission Using Point to Multipoint Network in Radio Communication","Minimizing the cost to transfer large data in radio communication by using point to multipoint network as Central Primary and Secondary stations, which is very useful in remote areas. It can be implemented as one primary station to many Secondary stations: It is the simplest solution, but active area of Primacy Station must cover whole area where the Secondary Stations are placed. The Secondary Stations can be simple because all of them can communicate at one frequency. The communication between Primary Station and the Control Unit will be simple as well and it can be either wired or wireless. To cover whole area it is necessary to transmit with relatively high power for both Primary Station and Secondary Station to enable low error rate. Also the transmission speed will be smaller due to greater distances. The other disadvantage of this solution is the danger that the Primary Station can be broken and therefore no possibility of the data delivery to any Secondary Station.  Because of a single Primary Station, it is not necessary to have logical addressing for the Primary Station at the side of the network between the Central Unit and the Primary Station. The other advantage of this solution is simpler communication software in the Central Unit.","",""
"2020","Using Covariance Matrix and Fast Fourier Transform for Estimating Spectrum Hole Location in Cognitive Radio Network","This paper worked on Using Covariance Matrix and Fast Fourier Transform for Estimating Spectrum Hole Location in Cognitive Radio Network, Fast Fourier Transform (FFT) was used to split the Spectrum into sub-band channels. The paper adopted the use of Covariance Matrix in determining the actual range for the bounds. From the result it can be deduce that the areas where there are no signals at all are point where noise is prevalent, while thee point between 0 and 20 on the principal component axis are the point where you have high possibility of spectrum hole availability, the point between 20 and 30 on the principal axis is the point with high possibility of error false alarm.. Fast Fourier Transform was used to decompose the wideband spectrum to 64 Sub-band channels. the result of this shows that there exists a relationship between the covariance matrix and the sub-band energy. Two important properties of any square matrix are its trace, and its determinant. Analysis of Results obtained from Simulations shows that at signal-to-noise ratio (SNR) value of -10dB, spectrum holes were identified in 2 sub-band channels 13 and 53.","",""
"2024","Mitigating information asymmetry in 5G networks","","",""
"2024","Destructive polarization in digital communication contexts: a critical review and conceptual framework","","",""
