"year","title","abstract","journal","doi"
"2020","The Wearable Past: Integrating a Physical Museum Collection of Wearables into a Database of Born-Digital Artifacts","This paper describes the collaborative process involved in the novel creation of The Wearable Past: a collection of physical museum artifacts, presently on display at the Canada Science and Technology Museum in Ottawa, digitally re-presented in the context of the Fabric of Digital Life (or Fabric), a database of born-digital objects run by the Decimal Lab at Ontario Tech University. We discuss the multiple stages involved in integrating a physical exhibit of wearables within a database of born-digital artifacts. We argue that the inclusion of historic artifacts in Fabric effectively connects the past to the future, creating a dialogic relationship between digital artifacts rather than a hierarchical schema, facilitated by Fabric’s metadata. Fabric provides a means to explore the cultural turn in wearable technology adoption, contextualized through a complex range of artifact representations. Following Bakhtin’s notion of “dialogic interaction,” we argue that the historic artifacts become dialogically entangled, and weave “in and out of complex interrelationships” (Bakhtin 1981, 276–277). We use Carole L. Palmer’s thematic research collections framework to explain the overarching structure and intent for Fabric’s born-digital collections. We then proceed to explain how The Wearable Past weaves historical cultural narratives from material artifacts into Fabric. We argue that they persist amid technologies that are proposed for future bodies to wear, reframing the conceptualization of wearables as lived phenomena. We draw on the work of several writers, including Lai Tze Fan (2018), Moynihan and Putra (2019), and Johanna Drucker (2009) to interpret The Wearable Past’s contribution to Fabric’s content, metadata, and ontology. Resume Cet article decrit le processus collaboratif qui a donne naissance a La technologie pret-a-porter (The Wearable Past) : une collection d’artefacts physiques de musees, ce qui est actuellement presentee au Musee des sciences et de la technologie du Canada a Ottawa. Cela est represente dans le contexte du Tissu de la vie numerique (Fabric of Digital Life; appele Fabric), une base de donnees qui est geree par La laboratoire decimale (Decimal Lab) a l’Institut universitaire de technologie de l’Ontario et qui se compose d’objets qui n’existent qu’au format numerique. Dans cet article, nous discutons des etapes multiples impliquees dans l’integration d’une exposition physique de technologies portables dans le cadre d’une base de donnees d’artefacts n’existant qu’au format numerique. Nous avancons que l’inclusion d’artefacts historiques dans Fabric lie efficacement le passe a l’avenir, ce qui cree une relation dialogique entre des artefacts numeriques, au lieu de creer un schema hierarchique, et ce que facilitent les metadonnees de Fabric. Fabric fournit un moyen d’explorer le tournant culturel qui est l’adoption de la technologie portable, contextualise par une gamme complexe de representations d’artefacts. Suivant la notion de Bakhtin d’≪ interaction dialogique ≫, nous avancons que les artefacts historiques deviennent empetres de facon dialogique et s’imbriquent ≪ les uns dans les autres dans des interrelations complexes ≫ (Bakhtin 1981, 276–277). Nous nous servons du cadre de recherche de collections thematique de Carole L. Palmer afin d’expliquer la structure principale et l’intention concernant les collections d’objets n’existant qu’au format numerique de Fabric. Ensuite, nous presentons comment La technologie pret-a-porter produit des narrations culturelles historiques a partir des artefacts materiels dans Fabric. Nous avancons que ces narrations persistent avec des technologies qui sont proposees pour le port de corps futurs, recadrant la conceptualisation des portables comme des phenomenes vecus. Nous nous appuyons sur les travaux de plusieurs auteurs, y compris Lai Tze Fan (2018), Moynihan et Putra (2019) et Johanna Drucker (2009), pour interpreter la contribution de La technologie pret-a-porter au contenu, aux metadonnees et a l’ontologie de Fabric. Mots-cles: humanites numeriques; etudes museales; histoire; sciences archivists; metadonnees; ordinateurs portables","",""
"2020","Paradata in Documentation Standards and Recommendations for Digital Archaeological Visualisations","Abstract                 Digitalisation of research data and massive efforts to make it findable, accessible, interoperable, and reusable has revealed that in addition to an eventual lack of description of the data itself (metadata), data reuse is often obstructed by the lack of information about the datamaking and interpretation (i.e. paradata). In search of the extent and composition of categories for describing processes, this article reviews a selection of standards and recommendations frequently referred to as useful for documenting archaeological visualisations. It provides insight into 1) how current standards can be employed to document provenance and processing history (i.e. paradata), and 2) what aspects of the processing history can be made transparent using current standards and which aspects are pushed back or hidden. The findings show that processes are often either completely absent or only partially addressed in the standards. However, instead of criticising standards for bias and omissions as if a perfect description of everything would be attainable, the findings point to the need for a comprehensive consideration of the space a standard is operating in (e.g. national heritage administration or international harmonisation of data). When a standard is used in a specific space it makes particular processes, methods, or tools transparent. Given these premises, if the standard helps to document what needs to be documented (e.g. paradata), and if it provides a type of transparency required in a certain space, it is reasonable to deem the standard good enough for that purpose.","",""
"2020","Europeana, EDM, and the Europeanisation of Cultural Heritage Institutions","Abstract                 Over the past two decades, the European Commission has mobilised cultural heritage to bolster a European identity. One of the main flagship initiatives promoted to this end has been Europeana, the most extensive digital cultural project financed by the EU. At the core of the project stands europeana.eu, a digital cultural portal aggregating metadata provided by national and local heritage institutions. Central in our analysis is the Europeana Data Model (EDM). Using standardised thesauri and vocabularies, EDM offers the possibility to create a semantic contextualisation for objects, allowing semantic operations on the metadata and their enrichment with Linked Open Data on the web. Due to its overarching nature, EDM cannot deliver the granularity that cultural heritage institutions need when documenting their resources. Nonetheless, heritage institutions accept to sacrifice accuracy to have their information represented in a Europewide collection. We study how this digital heritage infrastructure was designed to enact a sense of Europeanness amongst national and local institutions. Policy documents, ethnographic research and a systematic survey amongst the European heritage institutions enabled us to trace how a standardised European metadata structure plays a role in governing local and national heritage institutions. The EDM might enable heritage stakeholders to benefit from Europeana’s online exposure while enacting a European mindset. Ultimately, this study of the metadata model enriches the debate on the EU’s cultural heritage politics, which has not fully explored the role of the digital. At the same time, it also taps into debates about infrastructure and digital governmentality.","",""
"2020","Man, Woman, Child","Abstract                 This paper is concerned with the ethical aspects of museum metadata. These are not always immediately evident when working with the metadata related to museum objects, although, I will argue, they are embedded in the object, accumulated at each phase of its journey into the institution; and continue to accumulate while it is part of a collection. This takes place against a backdrop of new development and possibilities afforded by digital technologies for building connections between and across heritage collections online, which can result in these complicated metadata potentially entering the data ecosystem. This eventuality, I will argue, has ethical and technical implications which need to be considered and understood through the theoretical lenses of critical data studies, museum informatics and the growing calls from museum scholars and others to decolonisation of museum collections. Using a small collection of drawings from the Pitt Rivers Museum of Anthropology and World Archaeology at the University of Oxford, I will demonstrate how difficult museum metadata can be buried deep in museum documentation, and how this data, once brought to the surface by digitisation, can expose the trauma of a collection’s origins. I will go on to ask whether the current models used to share heritage data online are appropriate mechanisms for materials with such sensitive histories, and ask how best to handle them in the increasingly digital future.","",""
"2020","Archiving the Leftovers of Science","Abstract                 In this article, I focus on digital scientific archives which are made up of the leftovers of science, such as drafts, obsolete instruments, photographs, documentation, etc. The artifacts exhibited in such collections were neither meant to be representations, nor objects of gaze, but means used to achieve scientific results. As they lose functionality, they acquire aesthetic and historical value and emerge as clues, traces of past scientific practices and institutional histories. Therefore, the ways in which institutions situate these objects within the archive, the vocabularies and metadata they use, bear testimony on the manner they present and depict their past. How do the digital archives of the scientific institutions represent their histories? To address this question, I analyse the subject metadata of twenty-five institutional archives, turning them into objects of distant reading. Quantitative methods offer a way to discern the discursive frameworks that scientific institutions tend to adopt: Do they frame their collections as cultural heritage? represent them as corporate histories? emphasise technical specifications? scientific value? big names? A closer look at the metadata sets reveals that, in fact, these very different perspectives intermingle and clash with each other within the archive structures: the logic of heritage is juxtaposed with scientific classifications, institutional categories stand side by side with natural objects, and minority histories with celebrity narratives. Discussing this interplay of discourses, the article frames the digital archive of science as a specific mode of historical representation, which gives rise to a new (and still political) order of things.","",""
"2020","The Diversity Paradox","Abstract                 At the core of museum practice is the notion of diversity. However, as this analysis of different types of metadata production shows, contradictory ideas and ideals pervade both metadata production among information specialists (i.e. archivists, metadata managers, curators working in the heritage institutions), and the systems for, and practices of, participatory metadata production. While the discourse on metadata standards is permeated by ideas of objectivity and interoperability the field is, in practice, far from coherent, being marked by a great variety as regards templates, formats and vocabularies. Conversely, the discourse on digital participation in the cultural heritage is permeated with notions of diversity, as means to increase democracy and support variety. In practice, however, the available crowdsourcing platforms are often formulaic offering few possibilities for the crowd to add individual interpretations and their own agenda. This analysis of the practice of producing descriptive metadata reveals the complex, multifaceted implications of notions of diversity for the cultural heritage. Diversity, meaning great variety, is then not solely a positive end in itself but can in fact hinder the distribution and linkability of information and thereby the creation and building of new knowledge. Likewise, participatory activities where heritage institutions reach out to the crowd do not automatically generate diversity as there is no direct correlation between the magnitude of the group and variability. To understand this complexity and acknowledge the, sometimes, contradictory demands and effects related to the notion and norms of diversity is at the core of the making and preservation of our cultural heritage.","",""
"2020","One-Eyed Archive","Abstract                 During 2016, the Royal Danish Library digitized more than 200.000 pages from the library’s, collections all of which related to the former colonies in the Caribbean. This included books and other printed matter, but also sheet music, manuscripts, personal documents, photographs and drawings. Images were published in Digital Collections, the library’s platform for digitized materials, and were accompanied by limited metadata, thereby posing challenges in terms of accessibility and important historical contextualisation. This essay therefore reflects on the gaps and the silences that haunt indexing and descriptive practices in the migration online. Mette Kia Krabbe Meyer is Senior Research Fellow at the Royal Danish Library and has been project-managing the digitisation. Temi Odumosu is Senior Lecturer in Cultural Studies at Malmö University and has worked intensively with the collection as user and collaborator in the project What Lies Unspoken. As the Library embarks on initiatives to address the limited metadata associated with its digital collections, the authors come together to unfold key questions about approaches and process. They describe the characteristics of Digital Collections and the metadata currently provided, and ask what is left out and why; thereby engaging cultural biases that uneasily mirror the colonial project. The authors also explore how more inclusive user involvement, particularly in the United States Virgin Islands (USVI), could shift language and epistemology. The leading inquiry question is: In the one-eyed colonial archive, what is it possible for metadata to do?","",""
"2020","The sale of heritage on eBay: Market trends and cultural value"," The marketisation of heritage has been a major topic of interest among heritage specialists studying how the online marketplace shapes sales. Missing from that debate is a large-scale analysis seeking to understand market trends on popular selling platforms such as eBay. Sites such as eBay can inform what heritage items are of interest to the wider public, and thus what is potentially of greater cultural value, while also demonstrating monetary value trends. To better understand the sale of heritage on eBay’s international site, this work applies named entity recognition using conditional random fields, a method within natural language processing, and word dictionaries that inform on market trends. The methods demonstrate how Western markets, particularly the US and UK, have dominated sales for different cultures. Roman, Egyptian, Viking (Norse/Dane) and Near East objects are sold the most. Surprisingly, Cyprus and Egypt, two countries with relatively strict prohibition against the sale of heritage items, make the top 10 selling countries on eBay. Objects such as jewellery, statues and figurines, and religious items sell in relatively greater numbers, while masks and vessels (e.g. vases) sell at generally higher prices. Metal, stone and terracotta are commonly sold materials. More rare materials, such as those made of ivory, papyrus or wood, have relatively higher prices. Few sellers dominate the market, where in some months 40% of sales are controlled by the top 10 sellers. The tool used for the study is freely provided, demonstrating benefits in an automated approach to understanding sale trends. ","",""
"2020","Strokes of serendipity: Community co-curation and engagement with digital heritage"," This article explores the potential that community-led digital engagement with heritage holds for stimulating active citizenship through taking responsibility for shared cultural heritage and for fostering long-lasting relationships between local community heritage groups and national museums. Through the lens of a pilot project titled Science Museum: Community-in-Residence, we discovered that – despite working with community groups that were already loyal to and enjoyed existing working ties with the Science Museum in London, United Kingdom – this undertaking proved challenging owing to a range of structural and logistical issues even before the application of digital devices and tools had been considered. These challenges notwithstanding, the pilot found that the creation of time and space for face-to-face dialogue and interactions between the Science Museum and the participating community heritage groups helped to establish the parameters within which digital co-curation can effectively occur. This, in turn, informed the development of a digital prototype with huge potential to enable remote, virtual connectivity to, and interactivity with, conversations about shared heritage. The ultimate goal was twofold: (a) to help facilitate collaborative sense-making of our shared past and (b) to aid the building of sustainable institutional and community/public working ties around emerging affinities, agendas and research questions in relation to public history and heritage. ","",""
"2020","UX design in online catalogs: Practical issues with implementing traditional knowledge (TK) labels","At the center of the evolving debates of open access and intellectual property in memory institutions is a long history of excluding Indigenous Peoples from conversations concerning the access and use rights to their belongings. In recent decades many memory institutions challenged prevalent historical and current classifications of Indigenous Peoples in online catalog records. Most recently the Library of Congress (LC) adopted a new cataloging practice called Traditional Knowledge (TK) labeling as a way to return control over access and use of Indigenous materials to their rightful Indigenous owners. The advent of this emergent digital rights tool disrupts previously held assumptions about the purpose of rights statements in catalog records as well as challenges the existing balance between the rights of Indigenous communities and the interests of public access. The adoption of TK Labels in the LC’s “Ancestral Voices” digital collection brings serious practical implementation issues to light that deserve further consideration before memory institutions invest in this new digital access rights metadata standard. Although TK Labels are a technological opportunity that provide more space for community-based relationships within memory institutions, this paper suggests that the practical implementation of TK Labels in Ancestral Voices falls short of its promise to return authority to the Passamaquoddy people. Rather, TK Labels raise more logistical and technical questions about the effectiveness of the TK labeling framework and purpose of re-cataloging records describing Indigenous materials.","",""
"2021","‘Place a book and walk away’: archival digitization as a socio-technical practice","ABSTRACT Over the last couple of decades, libraries, archives, museums and other cultural institutions have begun to scan archival documents and develop digital collections of analog-born materials. Theories of the archive politicize archival practices and highlight the mediating role of both archivists and preservation technologies, and recent accounts of the digital archive underscore both its pervasiveness and its algorithmic post-humanism. Both strands, however, ignore scanning – a human–computer interaction that shapes the ways in which archival sources will be preserved. Drawing on STS, HCI and HMC scholarship, this ethnography opens the black box of scanning at the National Library of Israel. The analysis focuses on three """"breakdowns"""" that involve the handling of a torn photo, an ancient map and a scan robot. We show that instead of an automated process in which machines convert materials into copies, archival scanning is a symbolic human–computer interaction that produces digital objects with varying relationships to the analog originals. We discuss the ramifications of these insights to the social study of archival technology and future memory.","",""
"2021","The value of mass-digitised cultural heritage content in creative contexts"," How can digitised assets of Galleries, Libraries, Archives and Museums be reused to unlock new value? What are the implications of viewing large-scale cultural heritage data as an economic resource, to build new products and services upon? Drawing upon valuation studies, we reflect on both the theory and practicalities of using mass-digitised heritage content as an economic driver, stressing the need to consider the complexity of commercial-based outcomes within the context of cultural and creative industries. However, we also problematise the act of considering such heritage content as a resource to be exploited for economic growth, in order to inform how we consider, develop, deliver and value mass-digitisation. Our research will be of interest to those wishing to understand a rapidly changing research and innovation landscape, those considering how to engage memory institutions in data-driven activities and those critically evaluating years of mass-digitisation across the heritage sector. ","",""
"2021","Interfacing with the past: Archival digitization and the construction of digital depository"," This article examines the construction of a digital collection. Using a theoretical framework adapted from digital history and historiography, it will investigate the implications of archival digitization. Through an empirical study of the National Library of Israel’s digital depository of ephemera entitled ‘Time Travel’, the article demonstrates how the selection of archival records for digital preservation, the design of the search interface, and the crowdsourcing of metadata collection are all directing archive users toward certain narratives about Israeli history and away from others. Drawing on interviews with professionals, analysis of reports, and investigations of user experience, I will unearth the political, religious, and cultural tensions that lie beneath the surface of ‘Time Travel’. This research demonstrates that digitization of archival documents is not just a technical process but a cultural, social, and political one as well. ","",""
"2021","The archive and the scene: On the cultural techniques of retrocomputing databases"," Several digital spaces are now archiving artifacts from the first 1980s home computer boom. These spaces are not only storages but also social venues and “memory banks,” and thereby depend on several concurrent practices: software and hardware developed to read, run, and preserve computer code; archiving of old software, magazines, and personal stories; contemporary conferences dedicated to retrocomputing; and making artifacts, which used to be private, publicly available. The article argues that retrocomputing can be seen as a foreshadowing in terms of managing collective digital archives, memories, and relationships to digital material. Taking the Commodore 64 Scene Database as a case, this article (1) engages with both users and cultural techniques in order to (2) theorize collective digital archives as “performative in-betweens” and (3) discuss how retrocomputing may become a default mode for people seeking access to their digital pasts in a time when planned obsolescence is rampant. ","",""
