"year","title","abstract","journal","doi"
"2001","Internet radio: a case study in medium specificity","","",""
"2013","Performance Analysis of OCDMA System with Unipolar Walsh Coding","The success of a radiofrequency in CDMA depends on well designed bipolar codes with good correlation properties. These sequences of (+1, -1) values exist in the RF domain because the phase of the electromagnetic field can be detected directly. The unipolar optical coding is studied as optical system is nonnegative and unipolar in nature and detects and processes the signal intensity. The strict orthogonality of bipolar Walsh codes shows cross correlations to be equal to zero while auto correlations have large magnitudes. Unipolar Walsh coding have been studied and constructed in the previous published papers. In this work, the performance of the proposed codes has been analyzed and it has been observed that performance is better than modified frequency hopping & Hadamard code, Random Diagonal codes. Theoretical results for SNR and BER and Simulation results are shown.","",""
"2013","A Novel MAI Reduction Method Using Longer M-sequences for Multiuser Detection in DS/CDMA Communication Systems","","",""
"2014","Throughput, Stability and Fairness of Carrier- Sense Multiple Access with Cooperative Diversity","Cooperative diversity has been identified as a potential candidate for boosting the physical (PHY) layer performance of future wireless networks. However, several issues remain open today in the design of an appropriate medium access control (MAC) layer for this type of system. This paper attempts to partially fill this gap by addressing the MACPHY cross-layer design of a class of carrier-sense multiple access protocols where collision-free transmissions are assisted by the potential cooperative retransmission of the remaining silent terminals in the network. Unlike previous works, the analysis is focused on full asymmetrical settings, where terminals experience different channel and queuing statistics. To achieve this goal, a packet reception model is here proposed for cooperative schemes where the relaying phase is activated only when the reception of previous (re)transmissions has failed. Closed-form expressions of correct reception probability are derived for Rayleigh fading channels assuming that correct reception occurs only when the instantaneous signal-to-noise ratio (SNR) exceeds a reception threshold. This reception model allows for a MAC-layer design aware of PHY-layer information, and vice versa, PHY-layer enhancement and activation using MAClayer information. The boundary of the throughput region (i.e., the set of all achievable throughput values) is derived in a parametric closed-form expression using a multi-objective optimization approach. A method for deriving a nonparametric form was further proposed, which allows for a geometric interpretation of the two-user case. Stability features such as backlog user distribution and backlog delay are evaluated by using a novel Markov model for asymmetrical systems. Fairness is evaluated by means of the Gini index, which is a metric commonly used in the field of economics to measure income inequality. The protocol is shown to outperform its non-cooperative counterparts under diverse network conditions that are here discussed.","",""
"2014","Effects of Backscattering and Atmospheric Scintillation on OFDM Based Optical Wireless Communication","","",""
"2014","Performance Evaluation of Relay Selection Schemes in Two-Way AF Relay Networks","In this paper, five relay selection schemes, Non Selection (NS), Optimal Selection (OS), Max-Min Selection (MMS), Max Sum rate Selection (MSS) and Hybrid Selection (HS) are considered. At first, for different number of relays and transmission rates, the outage probability of five relay selection schemes are compared in two-way Amplify and Forward (AF) relay networks. Simulation results show that the performance of MMS, OS and HS schemes are approximately equal and their performances are higher than two other schemes, MSS and NS. These results show the effect of relay selection scheme on two-way AF case which is not exactly the same as results obtained from Decode and Forward (DF) case. As the second part of this research, different power allocation scenarios are examined. Simulation results show that the best power allocation scenario for both AF abd DF relays which offer lower outage probability can be achieved when half of the total power is assigned to the selected relay node and the other half is equally divided between the two transceivers.","",""
"2016","Outage Probability Comparison of MRC, EGC and SC Receivers over Short Term Fading Channels","In this paper, wireless communication systems with maximal ratio combining (MRC) receiver, equal gain combining (EGC) receiver and selection combining (SC) receiver operating over short term fading channels are considered. In analyzed channels, received signal experiences Rayleigh multipath fading. Probability density functions (PDF), cumulative distribution functions (CDF) and level crossing rate (LCR) of output signals are efficiently evaluated and obtained expressions are in closed form. Results for the outage probability are graphically shown to present the influence of diversity techniques on system performance. It is shown that MRC has the best performance and SC technique gives lower performance than MRC and EGC diversity techniques.","",""
"2016","The performance enhancement of OCDMA System based on New Zero Cross Correlation (ZCC) Code with OFDM Modulation","In order to increase the number of users and data rate, and to reduce the impact of multi access interference (MAI), this study propose the optical code division multiple access (OCDMA) systems with orthogonal frequency division multiplexing modulation (OFDM) based on new zero cross correlation (ZCC) code .The system proposed (OCDMA- new ZCC-OFDM) is compared to the (OCDMA-FCC (Flexible Cross Correlation)-OFDM) in term of SNR and BER. The results showed that the proposed system with the new ZCC code displayed improved performance with an increased number of users up to 120%. The system adopted saved around -3 dBm of power at the receiver. In comparison to (OCDMA-FCC-OFDM) system, this improvement is due to the effect of the good auto/cross correlation properties of new ZCC code.","",""
"2016","PAPR Reduction for OFDM System using DCT Based Modified PTS Technique","Though the OFDM provides high data rate due to its high spectral efficiency, it has high PAPR which results in performance degradation and high out of band radiation due to nonlinearity of the high power amplifier. Partial Transmit sequence is one of the distortions-less PAPR reduction techniques which obtain the minimum PAPR signal by multiplying suitable phase factors with subsequenced subcarriers. In order to reduce PAPR even more, autocorrelation among data should be less. So DCT is applied along with PTS technique which has the property of reduction of autocorrelation. In the proposed method DCT is applied before PTS technique and after the PTS technique. The simulation results show that DCT preceding PTS technique has better performance compared to DCT succeeding PTS technique. The analysis of the both the proposed method is carried out with different subcarriers and sub-blocks are discussed.","",""
"2016","Study of Microstrip Antenna Behavior with Metamaterial Substrate of SRR Type Combined with TW","This work aims to characterize microstrip antennas working on microwave band, especially their behavior in frequency band from 6 GHz to 16 GHz, when they are on metamaterial substrate. These microstrip antennas allow their structure miniaturization, which is important to the equipment that uses those antennas. The main characteristic of the metamaterials shows special features of permissiveness and permeability, which are not found in natural state materials, whose main effect is the refraction negative index. Due to these characteristics, the application is allowed in several electromagnetism and optical means.","",""
"2016","Outage Probability of Wireless Relay Communication System with Three Sections in the Presence of Nakagami-m Short Term Fading","","",""
"2016","Performance Analysis of Wireless Communication System in the Presence of Gamma Shadowing, Nakagami-m Multipath Fading and Cochannel Interference","Wireless communication system working over Gamma shadowed Nakagami-m multipath fading channel in the presence of cochannel interference exposed to Nakagami-m short term fading and Gamma long term fading is investigated in this work. In interference limited channel, the ratio of desired signal envelope and interference is important performance measure. For considered model signal to interference ratio can be calculated as the ratio of two products of square rooted Gamma random variable and Nakagami-m random variable. In this paper, the closed form expression for probability density function (PDF), moments and moment generating function (MGF) of output SIR will be calculated. The influences of Nakagami-m short term fading severity parameter and Gamma long term fading severity parameter on moments of the first and the second order will be discussed.","",""
"2016","Novel Ku Band Reflect array Antenna for Satellite Communication","This paper focuses on the design and analysis of Ku band reflect array antenna using a novel crossed dumbbell(clover) patch unit cell. The reflect array proposed is to pave way for a new generation miniaturized satellite communication, finding an important application in the Satellite newsgathering (12.5 GHz-13.75 GHz) .The clover shaped unit cell is designed for 13.07 GHz and the suitability of the unit cell is validated using the phase characteristics analysis. The effect of the elements on the performance represented by the range of the reflection phase is of prime importance. From the observation, Clover unit cell has large phase variation compared to minkowski and koch unit cells. Therefore, the main purpose of this paper is to investigate and validate the novel unit cell with a wide phase characteristics and the reflect array constructed.","",""
"2016","Possibility of Minimizing the Effect of Transfer Parameters on the Transmitted Signal in the Spiral Optical Fiber","","",""
"2016","On Optimal Signal Detection using Covariance shaping method","In this paper, a new class of linear multiuser detector, referred to as the Covariance Shaping Multiuser (CSMUD) detector has been designed for the suppression of Multi Access Interference (MAI) in multiuser wireless communication systems. We develop an algorithm using quantum constraints and some of its axioms to minimize the total variance of the weighted error between the receiver output and observed signal, subject to the limit that the covariance of the noise component in the receiver output proportional to a given covariance matrix, with the intention that we control the dynamic range and spectral shape of the output noise. We consider the problem of multiuser detection in which we seek to detect probability of bit error for some set of users with different noise levels. The exact and approximate expressions for the probability of bit error for some set of users with different noise level are illustrated. The performance of the CSMU receiver is characterized and finally through examples that the CSMU receiver can significantly increase the performance over the conventional multiuser receivers.","",""
"2016","Enhanced Reliability Using Adaptive Modulation Coding in the Cooperative Communication","","",""
"2016","Narrowband Interference Suppression in Wavelet Packet Multirate Multicarrier Multicode CDMA System","","",""
"2016","Error free transmission of mc CDMA signals through multiple antennas.","The MIMO MC-CDMA is the promising technique for the future wireless communications, because of being effective in mitigating fading and increasing data rate. The usage of the same codes over the Multiple Transmission antennas causes IAI (Inter antenna interference). And also, when the correlation between the waveforms are very low which produces MAI (Multi access interference) to all other users apart from the corresponding user. In this paper we proposed a new error free transmission of MC CDMA signal through multiple antennas using MIIR algorithm, Which increases the data rate by removing the MUI and IAI. The proposed algorithm is justified by MATLAB simulation.","",""
"2016","Spatial Phase Coding in Uplink Coordinated Multiple-Point System for Improve Wireless Communication Performance","","",""
"2016","A Novel Chaotic MIMO-OFDM System for Improved Performance in Future Cellular Wireless Networks","In recent years, the explosive growth of new generation wireless networks has spurred lot of research thrust particularly looking for a bandwidth efficient modulation and coding scheme. In this connection, researchers have recently turned up their attention towards chaotic communication systems and golden codes for its attractive benefits. This consequently had motivated us for two new proposals namely: code shiftedquadrature chaos shift keying (CS-QCSK) and modified golden codes with low complex decoder. The Code Shifted-Quadrature Chaos shift Keying (CS-QCSK) modulation technique with its code domain approach has proven to be the best among the conventional chaotic modulation schemes [4]. Similarly, in the coding scenario, modified Golden codes had been proven to exhibit better error performance than any other space time block codes through our earlier investigation in [14]. The aforementioned modulation scheme (CS-QCSK) and coding scheme (modified golden code) can be concatenated in an OFDM system to harvest an enhanced performance. The suitability of the proposed chaos based logic is tested in a multiple input multiple outputorthogonal frequency division multiplexing (MIMO-OFDM) system. The performance parameters like spectral efficiency, capacity and BER analysis is computed through simulation analysis. The obtained results were found very satisfactory, of course with a marginal increase in the process complexity","",""
"2016","SFO Estimation Scheme in OFDM-Based Power Line Communication System","This paper proposes a efficient blind sampling frequency offset (SFO) estimation technique for an orthogonal frequency division multiplexing (OFDM) based power line communication (PLC) system. The main drawback of the conventional estimators is their limited estimation range and their high sensitivity to effect of SFO. To remedy these, this paper proposes two-step correlation scheme that exploits the structure of a transmission data symbol. This paper considers the high-speed ROBO mode of PLC system and focus on OFDM sequences copied by the ROBO interleaver. Computer simulations are employed to assess the performance of the proposed scheme and to make comparison with the conventional scheme.","",""
"2016","Design of Microstrip Antennas Arrays for Applications in Wireless Communications","This paper analyses the influence of microstrip antenna arrays designed for a frequency of 2.5 GHz, aiming at applications in wireless communications, in special, 4G Technology. From a standard antenna with circular patch, elements are introduced to obtain linear and circular array, since arrays are interesting, whenever it want high gains. While the linear arrays are simple and practical, circular arrays can provide better symmetry. All prototypes are built and measured data are compared with the simulated data showing a good agreement.","",""
"2016","Linear Interference Cancellation Method for Relay Systems","","",""
"2016","Adaptive Transmission Scheme with Precoding for Improved Performance in the Wireless Communication","","",""
"2017","On-Body Adhesive Microstrip Antenna for Wearable Application","Modern communication systems are driven by the concept of being connected anywhere and at any time. Fuelled by the idea of a body-centric approach to modern communication technology, many research projects have been initiated to integrate antennas and radio frequency (RF) systems into clothes with regard to size reduction and cost-effectiveness; so that the wearer may not notice the existence of these subsystems. Integrating antennas with electronics is a vital role for supporting many applications, biomedical, military and commercial fields. The antenna designed for these applications should be wideband, not sensitive to human body. The antenna structure is simple and looks like an adhesive bandage, and can be placed on human tissue. This paper presents a novel planar, via-free, printed antenna which looks like an adhesive bandage is designed on RT Duroid 5880 dielectric substrate. Later in order to design a flexible antenna, the antenna is designed on flexible substrates such as fabrics for wearable application. The proposed antenna characteristics are analyzed in both printed flat and curved structure, to support all real time applications. Antenna parameters, such as return loss, radiation patterns, VSWR and gain plot were evaluated in various scenarios to validate the proposed design. The proposed antenna is designed and simulated using High Frequency Structure Simulator (HFSS version 13) software tool.","",""
"2017","Reduced Length Chirp Pilots for Estimation of Linear Time-Varying Communication Channels","In wireless communication multipath fading causes significant performance degradation and necessitates channel estimation. Transmission of two consecutive chirps with different rates as a pilot sequence is a method that has been used in the estimation of linear time-varying (LTV) channel parameters. In this paper, we propose an improvement on the chirp based channel estimation method for LTV model. We show that combination of a chirp with its complex conjugate, in particular a frequency modulated sinusoid, provides us an efficient pilot sequence. Besides reducing the length of the pilot sequence by half, the length and the rate of our proposed pilot sequence can be adjusted to comply with a-priori information on the channel. We implement the proposed method for an orthogonal frequency division multiplexing (OFDM) communication system and compare with conventional two chirps method.","",""
"2017","Performance improvement in Multistage Multiuser DS-CDMA system over Rayleigh fading channel","Direct Sequence Code Division Multiple Access (DS-CDMA) system is well known wireless technology. Multiple Access Interference (MAI) is a major problem in DS-CDMA system caused by its users. When the number of users increases the system performance gradually decreases especially in fading environment. In this paper, multistage multiuser detection techniques were introduced to detect the users data in presence of MAI. Multistage Multiuser Parallel Interference Cancellation (PIC) technique gives good performance but biased decision statistic problem is raised due to imperfect estimation of MAI as number of stages increases. To overcome biased decision statistic problem by Multistage Multiuser Partial Parallel Interference Cancellation (PPIC) technique is used to reduce the MAI partially stage by stage. But the problem is in PIC and PPIC computational complexity is very high when the number of stages increases. The computational complexity is minimized by using Multistage Difference PIC (DPIC) detection technique is based on the convergence nature of interference cancellation. Multistage Multiuser Partial Differencing Parallel Interference Cancellation (PDPIC) Technique is the combination of Difference PIC and Partial PIC. By using technique, Performance improved and computational complexity is minimized both are performed at a time. Simulation results shows that the partial difference PIC better performed (in terms of Bit Error Rate (BER)) than PIC and PPIC in fading environment.","",""
"2017","The Second Order Performance of Macrodiversity Reception in the Presence of Weibull Fading, Gamma Fading and α-κ-μ Co-channel Interference","In this paper, the wireless system consisting of macrodiversity selection combining (SC) receiver and two microdiversity SC receivers under the influence of small scale fading and large scale fading, as well as co-channel interference is observed. Small scale fading has Weibull distribution. Correlated large scale fading is described by Gamma distribution. Co-channel interference is disturbed by α-κ-μ fading and Gamma large scale fading. Probability density function (PDF) and cumulative distribution function (CDF) of the ratio of Weibull random variable and α-κ-μ random variable are given. The formula for CDF of macrodiversity SC receiver output signal to interference ratio (SIR) is also presented. Level crossing rates at the outputs of microdiversity SC receivers are determined. Then, the level crossing rate (LCR) of wireless system output signal to interference ratio is derived and shown in some figures. Based on them, the influence of Weibull fading nonlinearity parameter, α-κ-μ fading severity parameter, α-κ-μ fading nonlinearity parameter, Rician factor, Gamma long term fading severity parameter and Gamma long term fading correlation coefficient is studied.","",""
"2017","Quality Analysis in Phase Modulated Radio over Fiber in WDM/DWDM Network","There has been increasing demand for connection setup with a higher quality of service (QoS) in WDM/DWDM networks, especially in fields like radio over fibres, where phase modulation affects the link quality. Hence to meet guaranteed QoS in a phase modulated link, the effects of phase modulation on link quality is very much needed. The link quality is termed as quality factor (Q-factor). The primary objective is to use effectively the connections available to optimize the computed number of connections and reduce the blocked connections but at the same time guarantying QoS as per client’s need. The analysis has been done by taking care of routing and wavelength assignment (RWA) techniques. The performance analysis is presented in terms of blocking probability.","",""
"2017","Curved Linear Antennas as Quantum Traps","Curved linear antennas of arbitrary shape can be considered as a special case of quantum thin conducting wire traps of their free electrons and a numerical method is proposed for the calculation of their current distribution. In a case of low energy excitation with a proper frequency, only the fundamental mode with its lowest Eigen-value appears and the respective Eigen-function is its current distribution along it. In a previous paper Papageorgiou et al., proposed a numerical method of calculating the radiation pattern of any arbitrary shape linear thin antenna, with a known current distribution of its free electrons along with it. Also in a recent paper Papageorgiou et al., introduced the Resonant Transmission Line (RTL) method for numerically tackling the problem of linear quantum wires with arbitrary curvature. This method is also applied here in order to calculate the fundamental Eigenvalue and its respective Eigenfunction of any arbitrary shape curved linear thin antenna. The analysis reveals a strict dependency of the energy Eigen-values to the curvature magnitude with significant lowering of the first harmonic beyond a threshold value which severely affects excitability of the respective Eigen-function. The proposed method is applied in the study of a very sensitive antenna made of constant curvature circular arcs.","",""
"2017","Outage P?rformance of Wireless System in the Presence of KG Short Term Fading and Co-channel Interference","In this paper, wireless mobile communication radio system in the presence of long term fading, short term fading and co-channel interference will be analyzed. Desired signal and cochannel interference experiences Nakagami-m short term fading and Gamma long term fading. Probability density function and cumulative distribution function of the ratio of two KG random variable are obtained as the closed form expressions. Probability density function can be used for calculation the bit error probability and cumulative distribution function can be used for evaluation the outage probability. In interference limited environment, signal to interference ratio is important performance measure of wireless system. The influence of Nakagami-m short term fading severity parameter and Gamma long term fading severity parameter on the outage probability will be examined.","",""
"2017","Microstrip Bowtie Antenna with Patch and Ground-Plane Defects for WLAN Applications","In this paper, a fractal-based bowtie microstrip antenna with defected ground structure for Wireless Local Area Network (WLAN) applications is proposed and studied. To achieve a dual band operation (i.e., 2.4 GHz and 5.2 GHz unlicensed bands), the initial design of the proposed antenna is based on the Sierpinsky gasket (triangular) fractal geometry. However, it is well known that, at the fundamental resonant frequency of the Sierpinsky gasket, the input impedance match is too poor. To overcome this problem, a circular split ring resonator (CSRR) is used as a defected ground structure to achieve efficient coupling at the fundamental resonant frequency. The proposed antenna is designed and analyzed using the finite element method. To this end, the High Frequency Structural Simulator (HFSS) of ANSYS is employed. The proposed fractal bowtie antenna with CSRR features low profile, high return losses, dual band operation, and moderate coupling bandwidth (around 4 %). Simulation results show that the antenna presents return losses of -19 dB and a coupling bandwidth of 120 MHz at the first resonant frequency (i.e. 2.4 GHz) , while the corresponding values at the second resonant frequency  (i.e., 5.2 GHz) are -46 dB and 190 MHz, respectively. These results show that the proposed antenna is suitable for WLAN applications.","",""
