"year","title","abstract","journal","doi"
"2017","Conflict in a digital place","This paper discusses the issue of conflict over the Internet. It focuses on situations where disagreements between users connect with specific choices in the design of a digital infrastructure, and it argues that engagement in design activities can be used as a tool to analyse and probe such issues. It presents an ethnographic study of VOCI, a community of students based in Syria that witnessed a major conflict between its core members during the early 2010s. This conflict evolved around issues of control and governance, and eventually translated into a shared concern of how access and ownership of digital places are configured. This article introduces the design of Modus, a platform for shared proprietary rights over the Internet, as an alternative way to manage digital ownership.","",""
"2017","Have we finally bridged the digital divide? Smart phone and Internet use patterns by race and ethnicity","Two decades ago an influential article documented the alarming disparities that existed in access to computers and the Internet between African-Americans and whites (Hoffman and Novak, 1998). Using the latest U.S. Census Bureau/Bureau of Labor Statistics data on computer and Internet access, I find that the “digital divide” has not been bridged and remains as large as it was two decades ago. African-Americans and Latino-Americans are less likely to use the Internet on smart phones, computer, tablets or other devices than are whites. A statistical decomposition analysis reveals that income and education inequalities are the leading causes of the disparities in access to technology. The findings have implications for policies that subsidize broadband to low-income families.","",""
"2017","Internet (non-)use types and motivational access: Implications for digital inequalities research"," Research into digital inequalities has shifted from a binary view of Internet use versus non-use to studying gradations in Internet use. However, this research has mostly compared categories of users only. In addition, the role of attitudes in digital inequalities has been largely overlooked. This article addresses these limitations by performing a systematic analysis of factors that distinguish low Internet users from non-users, regular users, and broad users. In addition to socio-demographic characteristics, we examine attitudinal variables. Results drawn from multinomial regressions indicate that attitudes play at least as large a role as socio-economic factors in determining the likelihood of belonging to specific (non-)user categories. This identifies positive attitudes toward technologies and the Internet as a crucial step toward Internet adoption. Hence, digital inequality research needs to consider factors other than traditional socio-economic ones to draw a complete picture. ","",""
"2017","The emergence of a “digital underclass” in Great Britain and Sweden: Changing reasons for digital exclusion"," Research into reasons for Internet non-use has been mostly based on one-off cohort studies and focused on single-country contexts. This article shows that motivations for being offline changed between 2005 and 2013 among non- and ex-users in two high-diffusion European countries. Analyses of Swedish and British data demonstrate that non-user populations have become more concentrated in vulnerable groups. While traditional digital divide reasons related to a lack of access and skills remain important, motivational reasons increased in importance over time. The ways in which these reasons gain importance for non- and ex-user groups vary, as do explanations for digital exclusion in the different countries. Effective interventions aimed at tackling digital exclusion need to take into consideration national contexts, changing non-user characteristics, and individual experience with the Internet. What worked a decade ago in a particular country might not work currently in a different or even the same country. ","",""
"2018","Inequality in mobilizing online help after a negative life event: the role of education, digital skills, and capital-enhancing Internet use","ABSTRACT Many studies have investigated inequalities in coping with stressful life events and often education is found to play a role in this (the higher educated are usually more successful in dealing with their problems in terms of well-being consequences). We examine whether something similar occurs on the Internet, whether the higher educated are more successful in mobilizing help online, and whether this is related to their digital skills and the way in which they use the Internet. With the latter, we link online coping to digital inequality research. Researchers have investigated digital inequalities with regard to skills and types of Internet use. However, we know little about the extent to which these factors translate into inequalities in resources mobilized from the Internet. This latter type of inequality is highly relevant, since it is an intermediary step between Internet use and (improved) well-being and life chances. Using a large sample of individuals living in the Netherlands, we find educational differences in the mobilization of online problem-focused coping resources, but no differences with regard to online socioemotional or disengagement coping resources. The educational inequalities in online coping are somewhat smaller than educational inequalities in offline coping, leading to remarkable consequences for social policy. Furthermore, we find a relatively complex pattern of interrelations between offline inequality (education) and different types of digital inequality (skills, usage, resources). In our conclusions we make a plea for more research on outcomes of Internet use and we discuss the implications of our findings for further research.","",""
"2018","Racial projections: cyberspace, public space, and the digital divide","ABSTRACT Scholars of critical race studies, urban history, and information and communications technologies (ICTs) share an interest in the relationship between spatial and racial disparities, including the quality of basic infrastructure, degrees of connectivity, and participatory culture. However, contemporary research on the digital divide struggles to link historical legacies of uneven development, as well as social justice strategies, with digital participation in urban spaces. By examining contemporary digital art that critiques the spatial inequalities encountered by U.S. racial minorities, this article illustrates how public intellectuals use ICTs in ways that draw upon past strategies to territorialize space for political ends. It focuses on digital pop-ups, open-air installations that cast images onto public space using projectors. Historicizing these new efforts illustrates a continuity of tactics engaged by communities of color in response to socio-spatial inequalities in the urban United States, such as the 1970s mural movement’s efforts to re-politicize spaces of exclusion. While existing literature finds that digital inequality results in differential digital human capital, this research indicates that place-based claims, such as digital pop-ups, are important sites for combatting racial injustice and creating more inclusionary spaces, especially among youth adults.","",""
"2018","Moving on up in the information society? A longitudinal analysis of the relationship between Internet use and social class mobility in Britain","Abstract Many universal access policies are based on the assumption that the removal of the digital divide will enhance social mobility. But this assumption is not supported by the available evidence. Using four waves of longitudinal data from Britain we show that Internet use has a positive effect on social class mobility, while controlling for age, gender, education, health, and previous social class membership between 1997 and 2013. In doing so, we contribute to a wider discussion of the relationships between social and digital inequalities and highlight the challenges and potential of this methodological approach for future research.","",""
"2018","First- and second-level digital divides in Cuba: Differences in Internet motivation, access, skills and usage","The digital divide is an important academic concern. Whereas the first generation of studies focused only on physical and material Internet access, more recent research has considered the importance of skills and usage gaps. This study seeks to bring to light meaningful insights into first and second levels of the digital divide in the special case of Cuba, which is characterized by a very restricted media environment. Results reveal that in an admittedly socialist country where inequality is very present, increased access to the Internet might particularly benefit those who are already in privileged positions.","",""
"2018","The social inequalities of Internet access, its use, and the impact on children’s academic performance: Evidence from a longitudinal study in Switzerland"," This longitudinal study explores differences in Internet access and use among school-aged children in Italian-speaking Switzerland and whether and how these differences contribute to inequalities in academic performance. Applying multilevel structural equation modeling with two-wave original survey data from 843 students, their parents, as well as students’ end-term school grades, we show that a family’s socio-economic status indirectly affects children’s school grades as lower parental income leads children to use the Internet more frequently for entertainment and online communication purposes. This form of Internet use also increases as children have more personal digital media devices. As children’s increased use of the Internet for entertainment and online communication worsens their academic performance, our results suggest that social inequalities due to children’s socio-economic status are reinforced by a second-order digital divide. We discuss potential reasons for our findings as well as their implications and recommendations for possible interventions. ","",""
"2018","Online protest participation and the digital divide: Modeling the effect of the digital divide on online petition-signing"," Scholars have long been concerned about the effect that digital inequalities might have on marginalized populations. Concern for the “digital divide” extends to social movement scholars, who worry that the digital divide will lead to social movements privileging the concerns of the middle class over those of disadvantaged groups. We argue for a novel way of testing for such effects—the use of a Heckman regression model to model participation in online activism. The Heckman model separately models selection effects (i.e. first-level digital divides that affect Internet access) and main effects (i.e. second-level digital divides and classic predictors of micro-mobilization). We find that the digital divide in access does not exert a selection effect and that the digital divide in usage exerts minimal effects in models predicting online petition-signing. ","",""
"2018","Learning to Google: Understanding classed and gendered practices when young people use the Internet for research"," This article builds on existing research by examining two groups of young people, one from an elite fee-paying school and the other from a vocational college, as they engage with information on the Web about, for example, conspiracies, climate change and immigration. The data include the results of group and individual interviews, digital search terms and web (http) traffic, videos of discussions and downloads of arguments on social media. This study’s contribution is to synthesise digital methods and sociological concepts of technology, information and youth with Bourdieu’s social theory. By capturing offline and online events and decisions as they are manifested online (and vice versa), this study challenges distinctions between ‘the virtual’ and ‘the real’. It reveals how young people’s class of conditions, including their relative position in the United Kingdom’s educational hierarchy are played out in the way they use digital technology to produce intersecting classed and gendered practices. ","",""
"2018","Is digital upskilling the next generation our ‘pipeline to prosperity’?"," The British government is claiming digital skills will deliver economic growth to the country and social mobility to young people: its ministers call it ‘a pipeline to prosperity’. While declaring this pipeline, the government assumes the needs of the economy and young people’s needs are (or should be) synchronised. We challenge this assumption and the policy it sustains with data from questionnaires, workshops and interviews with 50 young people from communities in South Wales (including a former mining town and a deprived inner city area) about digital technology’s role in their everyday life. We use a new typography to compare the reality of their socially and economically structured lives to the governmental policy discourse that makes them responsible for their country’s future economic success. To explain these young people’s creative and transgressive use of technology, we also make an empirically grounded contribution to the ongoing theoretical debates about structure and agency. ","",""
"2018","The significance of cultural capital and parental mediation for digital inequity"," A digital divide continues to be reported across and within nations, first as an access issue and second as an issue of effective usage. To address the latter issue, we argue that digital equity should not be conceptualized solely as a technical or resource related issue. We developed a conceptual framework based on cultural capital and parental mediation to investigate the complexity of digital inequity. Our in-depth case study of 22 Hong Kong students revealed that although information and communication technology (ICT) is thoroughly integrated with students’ everyday lives, some students lack the cultural or parenting resources required to build their capacity to effectively and meaningfully use ICT. Three salient clusters of users emerged: “celebrating” users, “coping” users, and “struggling” users. The results reveal the significance of parental mediation and cultural capital for students’ ICT use and thus digital equity. ","",""
"2019","The sequential and conditional nature of 21st-century digital skills","The importance of 21st-century digital skills has been well established. However, research often fails to examine how various skills relate to each other. Through a survey of a sample of 1,222 professionals working in the creative industries, we tested, by using path analysis, whether six 21st-century digital skills have a sequential and conditional nature. The sequence of the model starts with information and communication digital skills, followed by collaboration, critical thinking, and creative digital skills. All skills lead to problem-solving digital skills. The results confirm that the analyzed skills build on each other sequentially. To understand what interventions might be successful, the relations among various digital skills should be considered.","",""
"2019","The Digital Divide, social inclusion and health among persons with mental illness in Poland","Previous digital divide research has studied the Internet for empowerment of marginalized people such as ethnic and sexual minorities. This study focused on the digital divide among another minority group: persons with mental illness in the community. A nonprobability cross-sectional sampling survey was conducted in Poland. Cluster analysis was conducted to segment persons with mental illness into homogeneous clusters based on their Internet usage activities and motivations. Three clusters were identified: leisure-seeking omnivores (44.4%), gamers (18.8%), and passive selective users (36.9%). Leisure-seeking omnivores scored higher on satisfaction with and perception of opportunities to receive social resources (e.g., family activities, employment, community participation, and health services) than passive selective users. Gamers had better physical and mental health than leisure-seeking omnivores and passive selective users. Younger age and better physical health were the predictors for being leisure-seeking omnivores and gamers, respectively. Future predictions of the changes of clusters and future research directions are discussed.","",""
"2019","Does everyone have a price? Understanding people’s attitude towards online and offline price discrimination","Online shops can offer each website customer a different price. Such personalised pricing can lead to advanced forms of price discrimination based on individual characteristics – or assumed characteristics – of consumers. Shops can categorise consumers as price-sensitive or price-insensitive, and charge (presumed) price-insensitive people higher prices. In this paper, we analyse results from two consumer surveys conducted in the Netherlands, among a representative sample of the Dutch population (N = 1222 and N=1202). We analyse consumer attitudes towards different sorts of price discrimination to gain a better understanding of the drivers of people’s acceptance or rejection of price discrimination in different settings, and of the economic and demographic factors underlying people’s attitudes. To interpret the outcomes, we draw on insights from behavioural economics on the perceived fairness in transactions.","",""
"2019","The emotional costs of computers: an expectancy-value theory analysis of predominantly low-socioeconomic status minority students’ STEM attitudes","ABSTRACT There is a strong push to increase American students’ interest in Science, Technology, Engineering, and Mathematic (STEM) careers. However, minority and female students remain underrepresented in the STEM fields. Therefore, it is essential that we continue to examine the potential factors that both incite and dissuade STEM interest. We apply Expectancy-Value Theory (EVT) to examine STEM attitudes of predominantly low-socioeconomic status minority elementary school students over the course of a computing intervention. Furthermore, we integrate the digital inequality mental access conceptualization of ‘emotional costs’ into the EVT model in order to predict students’ negative STEM attitudes. Data are from a large-scale computing intervention that took place in a primarily minority, high poverty, urban elementary school district located in the southeastern USA. Results indicate that positive expectancies for success and subjective task values predict students’ positive STEM attitudes. Emotional costs toward technology primarily predict negative STEM attitudes. Students’ expectancies/values and emotional costs may have a ‘push-and-pull’ effect on the formation of STEM attitudes. This study successfully links digital disparities to STEM disparities by integrating the digital inequality concept of emotional costs. Practically, we conclude that future computing interventions should increase students’ academic-related expectancies and values while also minimizing their emotional costs in order to address both digital and STEM inequalities. Theoretically, we conclude that broad conceptualizations of emotional costs should be included in future studies to help explain negative attitudes/motivations toward STEM-related topics.","",""
"2019","Cultural divides and digital inequalities: attitudes shaping Internet and social media divides","ABSTRACT Researchers on digital divides have identified demographic and attitudinal factors associated with inequalities in access, skills, and patterns of Internet use, primarily around age, income, and education. While the attitudes and values of Internet users and non-users have been studied over the years, they have rarely been used to identify broader ‘cultures of the Internet’ and their role in shaping digital divides. This paper builds on research in Britain, which focused on patterns of attitudes underpinning Internet cultures, to explore the degree that similar or distinctive cultures have developed in the USA, and whether and how they are useful in explaining digital divides. This study utilizes original data drawn from a telephone survey of residents across the State of Michigan that adapted survey items and methods from the Oxford Internet Survey of Britain. Based on these survey responses, the paper identifies and describes the cultures of the Internet among Michigan residents, as an exploratory case of the US as a whole, and shows how these cultures shape digital divides in Internet access and social media use. The robustness and explanatory power of these explorations of Internet cultures argue for further research on the United States and for comparative research with other nations.","",""
"2019","Digital remediation: social support and online learning communities can help offset rural digital inequality","ABSTRACT While all students enter college with varying levels of digital skills, those from rural areas may face extra challenges because their own skills and those of their pre-college networks may be underdeveloped. Without some type of intervention, digital deficits can perpetuate further educational disadvantages. We developed an online learning community (OLC) in two sections of an introductory college course and integrated collaborative learning into students’ weekly activities. Regression analysis of survey data (N = 373) shows three impacts: access to social support is associated with higher skill assessment and improvements in digital skills; rural status is associated with a clear and significant disadvantage in digital skill assessment; and that involvement in an OLC contributed substantially to improvements in digital skills. We conclude with limitations and considerations for future research.","",""
"2019","Different statistical measures create different perceptions of the digital divide","Abstract Simultaneous two-dimensional comparisons of time series data—vertically (static difference) and horizontally (Sicherl-time-distance)—for numerous ITU and Eurostat datasets show that estimates of the magnitude of digital divide can differ substantially between conventional static measures and Sicherl-time-distance, a dynamic measure of disparity. Comparing digital divide indicators with other indicators of social inequality (life expectancy, infant mortality), the analysis shows that high ICT growth rate improved well-being in developing countries and reduced some world inequalities. This methodology enables researchers, policy makers, and business managers how to draw new insights from existing data, including monitoring the attainment of targets.","",""
"2019","Digital generations, but not as we know them"," The aim of this article is to see whether or not adolescents were the real leaders of the digital ‘revolution’ in the 1990s and whether they have sustained or even improved their position in the 2000s. The analysis is based on two surveys carried out in Italy, France, the United Kingdom, Germany, and Spain in 1996 ( N = 6609) and in 2009 ( N = 7255). The results show that the adolescents belonging to the first digital generation in 1996 were the most equipped with new technologies, although not the most intensive users. In 2009, the adolescents lost their position as the leading adopters and lagged behind youth and young adults regarding the use of new technologies and computer skills. ","",""
"2019","Twenty-first century digital skills for the creative industries workforce: Perspectives from industry experts","The creative industries workforce requires employees that use ICT applications to solve the knowledge related tasks at work. The aim of this research is twofold: (1) to see if previously cited twenty-first century digital skills are suited to the creative industries workforce and (2) to investigate the extent to which skill development get attention in current organizational practices. In-depth interviews were conducted with a sample of 24 managers and senior executives of creative organizations based in the Netherlands. As a guideline for the interviews, a conceptual twenty-first century digital skills framework was used. This framework presented the following seven core skills supported by the use of ICT: technical, information management, communication, collaboration, creativity, critical thinking, and problem solving. The following five contextual skills that play a role when using ICT were also presented: ethical awareness, cultural awareness, flexibility, self-direction, and lifelong learning. The results support the importance of twenty-first century digital skills, however, there seems to be insufficient attention to the levels of these skills; they play a minor role during the selection and evaluation procedures. Often it is assumed that existing digital skills are sufficient. Managers are encouraged to improve on developing requirements necessary for future employees as well as measurements to ensure current employees skill levels. The developed framework might be used as a management tool for indicating skills that need to be assessed among professionals working in the creative industries.","",""
