"year","title","abstract","journal","doi"
"2014","Doing well by doing good? Normative tensions underlying Twitter’s corporate social responsibility ethos"," This article examines the rhetoric of Twitter.com in order to gain insight into the company’s normative self-understanding, or ethos. From a business ethics perspective, we analyze Twitter’s ethos in relation to debates around democratic communication and corporate social responsibility (CSR). Partly thanks to its CSR strategy, Twitter has acquired the critical mass of users necessary to successfully establish a robust and financially viable social network. Despite its success, however, we argue that Twitter does not sufficiently address three ethical implications of its strategy: (1) from an ethical perspective, Twitter mainly seems to employ an ‘instrumental CSR’ ethos that fails to properly recognize the moral rights, responsibilities, and strategic challenges of corporate actors with regard to their stakeholders; (2) this issue becomes all the more pressing because online social networks to a certain extent have taken on the role of quasi-governmental bodies today, regulating what their users can and cannot do, thus raising questions of accountability and legitimacy; and (3) in Twitter’s case, this leads to normative tension between the site's rhetoric, which is centered around civic motives, and the way its Terms of Service and licensing policies seem to favor its commercial stakeholders over its noncommercial ones. ","",""
"2014","Brands and sociality"," Critical accounts of Facebook as a channel for marketing communication have predominantly focused on the social network's ability to provide marketers with free user-generated content and with detailed consumer data that allow them to target advertising to specific audiences. Although this article includes such activities, it extends the discussion to concentrate on the under-researched topic of how Facebook creates value for marketers by exploiting sociality in general. Taking the practices of Australian alcohol brands as an instructive case, this article critically examines how these brands strategically employ Facebook to manage their connections with consumers' identity making practices and engage with the mediation of everyday life. We argue that Facebook works not just as a platform to harvest data but also as a platform to manage the circulation of affect and creation of social connections around brands. This is particularly important in the case of alcohol brands since some social media engagement practices allow for circumventing regulatory regimes by prompting connections between mediations of drinking culture and the brand that would not be possible in other media channels. ","",""
"2014","Life on automatic: Facebook's archival subject","Facebook’s ideology rests on and results in a particular ontology: Mark Zuckerberg wants the site to help create an “open” and “connected” world.  This article explains the implications of this world-changing mission by examining services that map the Facebook user’s path across the Internet (like Connect) and archive the user’s life (like Timeline).  Reading these services through the psycho-ontological claims of Baudrillard and Derrida suggests that Facebook’s open, connected individual – the archival subject – is bent towards convenience and interest.  Pairing these readings with a reinterpretation of Heidegger’s philosophy of technology in terms specific to Facebook, the article argues that the archival subject provides evidence of a view of the world characterized predominantly by an orientation toward browsing rather than use or control.  Facebook should be analyzed in terms of this pre-theoretical understanding of the world – one that it both symptomatizes and institutes.  In advancing this argument, the article calls attention to the broader (ontological) and more intensive (subjective) correlates of more traditional (politico-economic or ideological) criticisms of social media.","",""
"2014","Facebook and dramauthentic identity: A post-Goffmanian theory of identity performance on SNS","Early and persistent scholarly concerns with online identity emphasized the ways that computer–mediated communications have allowed new, inventive, and creative presentations of self, and the lack of connection between online identity and the facts of off–line life. After the ascendency and following ubiquity of Facebook, we find our online lives transformed. We have not only seen online identity reconnected to off–line life, but we have seen, through the particular structures of social networking sites, our online lives subjected to newfound pressures to unify self–presentations from various constitutive communities; pressures different from and in some ways greater than those of off–line life. After describing identity in computer–mediated communications prior to Facebook, and investigating the kinds of changed conditions brought about in social networking sites, I put forth a dramauthentic model of post–Facebook online identity. This model is comprised of three methods of exposure through multiply anchored self–presentation (mixed, agonistic, and lowest–common–denominator) and four strategies of interaction (spectacular, untidy, distributed, and minimized), each of which are employed non–exclusively and at different moments by most social networking site users.","",""
"2014","Different spaces: Exploring Facebook as heterotopia","In this paper we explore the space of Facebook, and use Michel Foucault’s concept of heterotopia to describe it. We show that the heterotopic nature of Facebook explains not only much of its attraction, but even more the discomfort that many people, users as well as non–users, experience in it. Analysing Facebook as a heterotopia brings its relation to other spaces into focus: it is a world in the world, that juxtaposes and merges other spaces into ‘une espace autre’.","",""
"2014","Social media as leisure culture","The purpose of this paper is to situate the everyday use of social media in the broader cultural practice of leisure. Whereas the use of social media has many different aims and contexts, our main idea is to emphasize how social media practices associated with leisure and playfulness rather than functionality and tasks — therefore seemingly “useless” in a strictly utilitarian sense — are practices which are meaningful. We point to certain dynamics in social media practices which we connect to the culture of twentieth century mass tourism, using observations of central touristic practices to motivate an analysis of social media use as leisure culture. This gives us a nuanced understanding of the activities connecting everyday life and social media. Further, our analysis provides new insights into the basic motivation for engaging in online sociality despite concerns about privacy, time-waste and exploitation.","",""
"2014","10 years of Facebook","In early 2014, Facebook had been online for 10 years. On the social network’s 10th birthday, creator Mark Zuckerberg posted a message on the site reflecting on what he referred to as the ‘Facebook journey’, where he considers why the site has not only lasted so long, but has become integral to the lives of so many. How was it possible, he asked, that a group of students could create a global phenomenon?","",""
"2014","‘What’s on your mind?’ Writing on Facebook as a tool for self-formation"," In the context of modern western psychologised, techno-social hybrid realities, where individuals are incited constantly to work on themselves and perform their self-development in public, the use of online social networking sites (SNSs) can be conceptualised as what Foucault has described as a ‘technique of self’. This article explores examples of status updates on Facebook to reveal that writing on Facebook is a tool for self-formation with historical roots. Exploring examples of self-writing from the past, and considering some of the continuities and discontinuities between these age-old practices and their modern translations, provides a non-technologically deterministic and historically aware way of thinking about the use of new media technologies in modern societies that understands them to be more than mere tools for communication. ","",""
"2015","An education in Facebook","","",""
"2015","Social media: a critical introduction","","",""
"2015","Social media analytics: a survey of techniques, tools and platforms","","",""
"2015","A brief history of Facebook as a media text: The development of an empty structure","This paper tells a history of Facebook from 2004 to 2013. It presents the big picture by focusing on Facebook as it presented itself to a user, that is the available semiotic and interactional elements (e.g., profile, wall, feed, commercials, etc.) as well as the functions and useforms which these elements made possible for a variety of actor types (profile owners, groups, companies, software developers, etc.). In addition, Facebook’s development is inscribed in a longer Web historical perspective with a view to identifying a general mechanism for Internet development.","",""
"2015","Meaning in the age of social media","Make more knowledge even in less time every day. You may not always spend your time and money to go abroad and get the experience and knowledge by yourself. Reading is a good alternative to do in getting this desirable knowledge and experience. You may gain many things from experiencing directly, but of course it will spend much money. So here, by reading meaning in the age of social media, you can take more advantages with limited budget.","",""
"2015","Social Media Governance"," This short article proposes an institutional framework for understanding questions of social media governance, based around the four axes of formal and informal institutions, national and supranational governance, public and private, and large-scale and smaller scale governance. ","",""
"2015","Comparing to Prepare: Suggesting Ways to Study Social Media Today—and Tomorrow"," While the two currently most popular social media services – Twitter and Facebook – are different in terms of technical and end-user details, this paper suggests that a series of similarities can also be found regarding different modes of communication offered by both services. These modes are labeled as Broadcasting, Redistributing, Interacting and Acknowledging. The argument is put forward that such synthesis of communication modes across platform could prove useful for longitudinal and comparative research efforts. ","",""
"2015","The Limits of Social Media: What Social Media Can Be, and What We Should Hope They Never Become"," Social media are among many tools that people use to articulate culture. However, it must be remembered that social media are websites that afford community building regardless of the morality, social benefit, or social detriment of the communities that get built. At their core, social media sites are products created by their respective corporations with the intent of monetizing the labor of their users. The values that these sites might offer are dependent on the users and the users’ ability to claim some social benefit. In this regard, the author argues that social media can be beneficial spaces where society articulates and records culture “only if” users can maintain that use despite corporate actors’ efforts to monetize users’ labor. ","",""
"2015","Why I Joined Facebook and Still Regret It"," This article argues for a particular understanding of identity and sociality in social media. While there is considerable insightful research about the sociality and subjectivity produced in social media, it is also important to see that such identity and sociality is about creating and maintaining public-private boundaries online that can be different to those divisions of public and private that are lived offline. ","",""
"2015","Social Media and the Struggle for Society"," This piece argues that all communication media are inherently social. The term “social media” emerged at the time that companies began harnessing what people were already doing online, turning socializing into revenue streams for venture capitalists and the people who run internet companies. The paper critiques the conversion of social interaction into wealth for the few and argues that we need to fight for media that help build better societies rather than those that view people as data profiles to be sold to advertisers. ","",""
"2015","Which Social Media? A Call for Contextualization"," This essay briefly reflects upon digital social media in the mid-1990s in order to encourage: first, investigation of pre-twenty first century social media, towards the identification of lessons and resources for present-day research, practice, policy, and activism; and, second, the discursive and socio-historical contextualization of today’s social media. ","",""
"2015","Networking, or What the Social Means in Social Media"," This article questions the meaning of the social in social media. It does this by revisiting boyd and Ellison’s seminal paper and definition of social network sites. The article argues that social media are not so much about articulating or making an existing network visible. Rather, being social in the context of social media simply means creating connections within the boundaries of adaptive algorithmic architectures. Every click, share, like, and post creates a connection, initiates a relation. The network dynamically grows, evolves, becomes. The network networks. The social in social media is not a fact but a doing. ","",""
"2015","Can Social Media be a Space for Democratic Inclusivity?"," This think piece invites readers to imagine what it might be like to seek a technological solution regarding the problems inherent within participatory democracy. The piece suggests that such a process must begin by first identifying the constraints to participation that are structured into society in relation to privilege, and then imagining how social media could be designed to play a role in addressing these constraints in order to work toward a more equitable and participatory future. ","",""
"2015","Social Media: The Unbearable Lightness of Meaning"," Milan Kundera, in his classic The Unbearable Lightness of Being undertook a consideration of the ephemeral. So I use it as a springboard for a brief consideration of social media and what is fixed and what is passing about its meaning to us as a self-aware species. Paradoxically that application of the concept slips into a conceptual tesseract as we attempt to hold social media to mean yet another contrivance for fixing our life experiences and then realize that who we were yesterday is not necessarily who we are today nor who we will be tomorrow, nor how we will be remembered once we’re gone. To hold its meaning still is to enter a self-referential paradox where the meaning of the thing contradicts the nature of that which it represents and vice versa. All that to say that while it is impossible to confirm whether social media are simulation or simulacra, it is possible to orient their meaning, through how we use them and design them, toward our better natures. If we succeed, it will fix not individuals but our common humanity, which may be the one thing about us that has never been ephemeral. ","",""
"2015","Social Media Is"," A crap poem. ","",""
"2015","Researching Social Media as if the Social Mattered"," The institutions we have come to call “media” have been involved for over a century in providing an infrastructure for social life and have invested in a quite particular and privileged way of re-presenting the world as “social.” The dialectic between “media” and “social” has become more urgent to understand in an era when media and information infrastructures have expanded, converged, and become embedded more deeply in the texture of everyday life, while at the same time the claims of “media” to be social have become explicit, indeed insistent. This article asks what it would mean to address this new social/media dialectic head on—as if the social mattered. The word “social” is our necessary term for thinking about the complex interdependencies out of which human life really is made and the claims to represent that interdependent reality made from particular positions of power. All forms of power have invested in certain representations of the social. This battle matters, and now “social media”—the infrastructures of web 2.0—are at the heart of that battle. The article seeks to offer a plausible agenda for a collaborative program of research to address this struggle over the definition of “the social.” ","",""
"2015","Social Media, Delinguistification and Colonization of Lifeworld"," The article critically investigates, from an interdisciplinary perspective, how the current evolution of social media—like social network sites—interferes with the balance between private, commercial, and public space. We build on the concepts of lifeworld and systems, developed in Habermas’ theory of communicative action. The discussion is supported and enriched by the work of Feenberg and van Dijck, integrating insights from Science and Technology Studies and media studies. Technology philosopher and critical Science and Technology Studies scholar Feenberg introduces technology as a steering “medium” that delinguistifies and possibly colonizes the lifeworld by reinterpreting media sociological perspectives of Habermas, Marcuse, Latour, and Callon. In a similar way, media scholar van Dijck analyses the transition from human connectedness to automated connectivity in the context of social media. We then illustrate the delinguistification and the colonization of lifeworld with a systematic analysis of the contingent evolution of Facebook as one particular case in social media. We focus on three specific artifacts in Facebook, framed as obligatory passage points: EdgeRank, Sponsored Stories, and Gatekeeper. Each of them gives an idea how the private space is subsumed under the commercial space and how the colonization reconfigures the public space in social media like Facebook. In this sense, we complement the political economy analysis of prosumer commodity with the action-theoretical autonomist approach of immaterial labor, highlighting new potential threats of the current social media development. ","",""
"2015","Going Public on Social Media"," This brief essay questions the disconnect between the financial goals of social media properties and the concerns of privacy advocates and other new media critics. It is argued that critics of social media often fail to recognize the financial imperative of social media companies, one that requires users to divulge and publicize ever more granular aspects of their daily lives, thoughts, and feelings. ","",""
"2015","Social Media and Distribution Studies"," Social media increasingly trouble our traditional distinctions between distribution concerns on the one hand and editorial concerns on the other. Sites like Facebook and reddit simultaneously serve as distribution platforms, circulating messages addressed to individuals and publics, and as mechanical editors, deciding algorithmically which posts and topics warrant inclusion in the continuous and often overwhelming feed of information delivered to each of our screens. Recent controversies surrounding the manner in which social media companies develop and test software and editorial strategies for curating content may have brought this editor–distributor duality into sharp relief in ways that feel new and at times uncomfortable. But as a number of critical scholars—most notably Michael Warner—have illustrated, the boundary between editorial and distribution concerns has always been highly porous. Framing social media as centers of reflexive distribution not only opens up sociologically interesting questions about how such distribution infrastructures are forged but also about how they affect the “concatenation of texts through time” and the sense of shared attention and imagined community that enable public discourse. This essay argues that the emerging field of “distribution studies” is a compelling lens for the considering social media and their place in society and public life. ","",""
"2015","“Meaning” in Social Media"," Researchers of social media struggle to stay up to speed: empirical findings are most often very context- and time-specific and quickly become outdated because the object of study changes. By extension, previously solid and well-tested methods and tools may be rendered obsolete, for instance, as social media services change their application programming interfaces (APIs). The stabilizing component in social media research is arguably good theory—about the communicative patterns and bit trails of use, the actions that social media channel and mobilize, the interplay between social and other media, and, of course, the implications of social media for sociality, privacy, and society at large. In this essay, the concept and study of meaning is proposed as a key concern for social media research. “Meaning” highlights the generative process by which users negotiate the communicative potentials and constraints of a text or a medium vis-a-vis the individuals’ preexisting mental models, expectations, and intentions in context. ","",""
"2015","Games Are Social/Media(ted)/Technology Too . . ."," In this manifesto, we argue that social media research needs to take the broader field of game studies in the exploration and understanding of social media. Many of the results, theories, and concepts developed in the study of games has significant implications for the study of all social media. Of course, game studies should be paying attention to social media research too. ","",""
"2015","My So-Called Social Media Life"," This short essay offers a personal reflection on social media and some of the challenges related to corporate ownership and policy issues of privacy and surveillance. ","",""
"2015","Mapping Controversies with Social Media: The Case for Symmetry"," This article assesses the usefulness for social media research of controversy analysis, an approach developed in Science and Technology Studies (STS) and related fields. We propose that this approach can help to address an important methodological problem in social media research, namely, the tension between social media as resource for social research and as an empirical object in its own right. Initially developed for analyzing interactions between science, technology, and society, controversy analysis has in recent decades been implemented digitally to study public debates and issues dynamics online. A key feature of controversy analysis as a digital method, we argue, is that it enables a symmetrical approach to the study of media-technological dynamics and issue dynamics. It allows us to pay equal attention to the ways in which a digital platform like Twitter mediates public issues, and to how controversies mediate “social media” as an object of public attention. To sketch the contours of such a symmetrical approach, the article discusses examples from a recent social media research project in which we mapped issues of “privacy” and “surveillance” in the wake of the National Security Agency (NSA) data leak by Edward Snowden in June 2013. Through a discussion of social media research practice, we then outline a symmetrical approach to analyzing controversy with social media. We conclude that the digital implementation of such an approach requires further exchanges between social media researchers and controversy analysts. ","",""
"2015","From Stripping Off to Holding Your Guns: Lessons Learned So Far"," This short essay will try to capture some of the lessons social media users have come to learn during the existence of social media era. I will highlight the need to take responsibility of the posts one makes and shares on social media and thus emphasize the importance of one’s critical thinking and digital literacy skills. ","",""
"2015","Power Plays on Social Media"," Authority and influence are negotiated through the interactions taking place in the sociotechnical architectures of social media. Established elites transfer their institutional power to social media. But they operate alongside emergent, networked-sourced nodes of influence as ad hoc publics elevate certain actors on specific issues at specific times, within specific contexts and domains. A greater understanding of what forms of power play out on social media is essential to illuminating processes of networked gatekeeping, networked framing, and networked sourcing. ","",""
