"year","title","abstract","journal","doi"
"2015","Digital Divide| Max Weber and Digital Divide Studies — Introduction","Seminal sociologist Max Weber rarely wrote about media dynamics; however, the Weberian perspective offers rich potential for the analysis of various media issues, including the study of digital divides. In particular, the contribution of a Weberian school of thought to the field seems to be the addition of noneconomic and nontechnical concerns to the study of digital inequalities, most notably the importance of status and legitimacy and group affiliations and political relations as areas of focus. This piece introduces the Special Section on Max Weber and digital divide studies and clarifies the inspiration behind it. It briefly presents the article contributions, while summarizing their arguments, and offers a broad discussion of Weber’s relevance to digital divide studies as a way of understanding the individual articles as a shared intellectual effort.","",""
"2015","Digital Divide| Authentication, Status, and Power in a Digitally Organized Society","This article explores Weber’s notions of status and power in societies that are increasingly organized via digital networks. It draws on a community study conducted in a former coal-mining town in the United Kingdom. The policy background is the UK’s Digital by Default agenda, which seeks to make online services the primary form of service access and transaction. In the context of a digitally organized society, a person’s status is created through his or her ability to provide certain status markers to authenticate who they are. Status is created through a person’s file, and those lacking an online profile become thin-filed and therefore excluded from many online services. The article argues that digital authentication is a feature of the formation of status in a digitally organized society. Without online system files, individuals lack the power to access public services, banks, credit unions, and e-commerce, and they feel a lack of social honor because of their low authentication status.","",""
"2015","Digital Divide| Middle Classes Undergoing Transformation in a Digitizing World","This article proposes a new approach to understanding the middle class by considering the role it plays in the   creation of life chances. Several ideal types are developed to better understand the transformations that middle classes have undergone in the digitizing sociality. When digital technologies are applied in the innovative process of fusing global market-related opportunities and individual resources, the middle classes set in motion a complex interplay of action and reverse action between contextual and personal potentials, thus digitally creating new life chances.","",""
"2015","Digital Divide| A Weberian Analysis of Global Digital Divides","Weber hardly wrote about media, but his comparative historical analysis of the social implications of technology can be used to understand how the relation between elites and people is shaped by media. To do this, we can examine four countries and their uses of traditional media and new or digital media—the United States, Sweden, India, and China—providing a wide range for comparison. A further distinction can be made, along Weberian lines, between the political and cultural uses of media—the first focusing on the relation between political and media elites and people and the second on how elites are drivers of a popular consumer culture. The essay examines both traditional media and new digital media, with the central question of whether—and, if so, how—new media have reshaped the relation between elites and people, perhaps in different ways across the four countries. The essay concludes by arguing that consumer culture is rather homogeneous across the four countries, even if this form of culture also contains a variety of plural contents. In terms of politics, on the other hand, elites continue to control content, even if this control has been somewhat reshaped by digital media, though asymmetries between elites and people in this respect are quite different in the four countries examined here.","",""
"2015","Content creation on the Internet: a social cognitive perspective on the participation divide","Sociodemographic variables are held to impact Internet users’ willingness and ability to productively use online media. This effect can create a ‘participation divide’ between distinct user groups. Recently, studies have enhanced our understanding of the participation divide by differentiating types of online content creation. They found that sociodemographics may only affect specific forms of online participation. We suggest that social cognitive theory (SCT) helps explain why and how sociodemographic variables influence different forms of online participation. Based on SCT, we analyze the mediating effect of two cognitive constructs, self-efficacy and privacy concerns, on different types of online content creation. We conduct a survey among German Internet users and apply structural equation modeling to compare three distinct theoretical models. We find that considering the mediating effects of cognitive constructs, based on SCT, improves our understanding of which sociodemographic variables affect which type of online content creation – and why.","",""
"2015","Internet skill levels increase, but gaps widen: a longitudinal cross-sectional analysis (2010–2013) among the Dutch population","In the current contribution, we investigated how (1) the levels of operational, formal, information, and strategic internet skills changed between 2010 and 2013, and how (2) the observed skill patterns differ across gender, age, and education. All internet skills are measured among representative samples of the Dutch population in 2010, 2011, 2012, and 2013. Cross-sectional data are repeated to consider patterns of change at the aggregate level. The levels of operational and formal internet skills increased most. Information internet skill remained more or less consistent, and strategic internet skills only revealed a very small increase. Policies related to internet skills are largely aimed at improving basic skills among specific target groups. Future policies should shift towards improving information and strategic skills, which will be a more difficult challenge. Gender, age, and educational background are all important variables related to skill inequalities. As age increases, internet skill levels decrease. Information internet skills only increased for people aged over 65 years between 2010 and 2013. It seems that the gain in operational and formal internet skills among older people results in a better performance on information internet skills. The higher educated, the higher the levels of all four internet skills. The skills gap between the higher educated, on the one hand, and lower and middle educated, on the other hand, increased, while the gap between low and middle educated decreased. We expect that a particular share of inequality concerning information and strategic internet skills will remain and that these inequalities are long lasting.","",""
"2015","Digital Divide and Caste in Rural Pakistan","This study examined how caste influences adoption of information and communication technologies. It entailed a survey of 2750 farmers, who were interviewed in person, in rural Punjab (Pakistan), and two different methods for data analysis—data mining and indices-based statistical analysis. The analysis shows digital divides at the caste level. Furthermore, it shows that old and new technologies diffuse differently among castes.","",""
"2015","Measuring Internet Users' Online Activity: An Application of the Superefficiency Data Envelopment Analysis Model","The second-level digital divide, which focuses on skills and usage, calls for a rethink of conventional indices developed for measuring access to technology. We propose a superefficiency data envelopment analysis (DEA) framework to investigate Internet users’ online activity at an individual level by considering their access to information and communication technology (ICT), Internet literacy, and level of usage, and we offer a standard basis for measuring and comparing ICT users. We apply an ordinary least squares regression to explore the factors that influence users’ online activities. Our results show that Internet users who are female, older, less educated, not in white-collar positions, earning a higher monthly income, and living in nonurban areas are more active online when all online activities are considered at the same time. However, the factors that influence individual online activities are different.","",""
"2015","Toward a Multifaceted Model of Internet Access for Understanding Digital Divides: An Empirical Investigation","In this investigation, a multifaceted model of Internet appropriation that encompasses four types of access—motivational, material, skills, and usage—is tested with a representative sample of the Dutch population. The analysis indicates that while the digital divide policies' focus has moved to skills and usage access, motivational and material access remain relevant since they are necessary through the entire process of Internet appropriation. Moreover, each type of access has its own ground of determination and they interact together to shape digital inequalities. Therefore, digital divide policies should address material, skills, and usage access simultaneously.","",""
"2015","<i>Inequity in the Technopolis: Race, Class, Gender, and the Digital Divide in Austin</i>, edited by Joseph Straubhaar, Jeremiah Spence, Zeynep Tufekci, and Roberta G. Lentz. Austin, TX: University of Texas Press, 2012. 281 pp. $55.00 hardcover. ISBN 9780292728714 (hardcover)","Inequity in the Technopolis: Race, Class, Gender, and the Digital Divide in Austin, edited by Joseph Straubhaar, Jeremiah Spence, Zeynep Tufekci, and Roberta G. Lentz. Austin, TX: University of Texas Press, 2012. 281 pp. $55.00 hardcover. ISBN 9780292728714 (hardcover) Rachael Neal Reviewed by a Department of Sociology, Social Work, and Criminology, St. Edward's University, Austin, Texas, USA Published online: 23 Dec 2014.","",""
"2015","Overcoming digital divides in higher education: Digital literacy beyond Facebook"," The accelerated development of Information and Communications Technology has had a profound impact on the education system, both online and offline. In a South East European country such as Serbia, new technologies shape information, communication, and collaboration dynamics while contributing to a persistent digital divide regarding the skills necessary to obtain, process, evaluate, and communicate information. In this article, we explore digital divides between students and teachers in higher education with a focus on tensions surrounding digital literacy and collaboration. We apply Weber’s theory of stratification to an empirical case study of the digital divide in higher education in Serbia. We draw upon international indicators, secondary statistical sources, and primary semi-structured interviews with students and teachers in higher education. Through this analysis, we illustrate how forms of stratification intervene when trying to integrate new technologies and technology-oriented practices into the classroom. We consider stratification in terms of the traditional digital divide of access as well as stratification along lines of status, politics, and motivations. We interpret educators’ reluctance to adopt new technology as a reaction to the technology’s capacity to challenge the educators’ legitimacy, expertise, and preferred teaching materials. Students compound this situation with both greater familiarity and yet less focus on source credibility. ","",""
"2016","The contemporary US digital divide: from initial access to technology maintenance","As US Internet penetration rates have climbed, digital divide researchers have largely shifted attention to differences in Internet skills. Interviews with 72 low-income US residents from both a large metropolitan city and a medium-sized Midwestern town, however, reveal that many people still struggle to maintain physical access, supporting technology maintenance theory. Technology maintenance theory argues that although most of the US poor now use digital technology, access is unstable and characterized by frequent periods of disconnection. As a result, low-income users must work to maintain access, often experiencing cycles of dependable instability. In these interviews, nearly all used the Internet, but technology maintenance practices were widespread, including negotiation of temporarily disconnected service, broken hardware, and logistic limitations on public access. As a result, participants had limited access to health information and employment, and biased attitudes toward technology. That is, in some cases, negative attitudes toward Internet adoption reflected a rational response to disconnection rather than cultural norms or fears of the Internet, as suggested by previous research. Findings support and extend the theory of technology maintenance by emphasizing a shift in the US digital divide from issues of ownership to issues of sustainability; they also provide insight into the interrelated nature of access and attitudes toward technology. This new theoretical approach complements other theoretical approaches to the digital divide that foreground a contextualized understanding of digital disparities as embedded within a history of broad social disparities.","",""
"2016","Digital skills and social media use: how Internet skills are related to different types of Facebook use among ‘digital natives’","ABSTRACT Based on the idea that Internet use can be conceptualized in terms of depth (frequency) and width (differentiated) uses of the Web, this study explored how socio-demographic factors and digital skills are related to frequency and types of Facebook use among young adults. It used a face-to-face representative survey conducted in the three main urban areas of Chile among a sample of 18-to 29-year olds. The results found that men and more educated young people had higher levels of skills, confirming that the so-called ‘digital natives’ are not a monolithic group. They also revealed that digital skills did not predict frequency of Facebook use. Furthermore, lower educated young people tended to use Facebook more frequently. Although these results go against the long-established digital divide research, traditional digital gaps emerged when types of use were analyzed. While more educated and skillful individuals tended to use Facebook for informational and mobilizing purposes, socio-demographic factors and skills did not make a difference in Facebook use for social purposes.","",""
"2016","Information society and digital divide in South Africa: results of longitudinal surveys","Integration into the information society implies that information plays an increasingly important role in all sectors of society and holds distinct social and economic benefits. Discourses on the information society are, however, also associated with the digital divide and inequalities in access to and use of information and communication technologies (ICTs). Within sub-Saharan Africa, South Africa is often regarded as one of the most information-integrated societies due to widespread mobile phone ownership, among other things. However, while ICT access has been emphasized, research also points to the role of demographic, socio-economic and cultural factors such as ethnicity, income, education and gender. This article discusses the results of questionnaire surveys conducted by Afrobarometer among probability South African samples in 2008 and 2011. The results indicate that individual Internet use and mobile Internet access were lower than estimated in the literature. Furthermore, gender gaps, as well as considerable gaps between population groups and educational levels, were found in Internet and computer use, mobile ownership and access to mobile Internet and accessing news via the Internet. Conclusions regarding strategies for bridging the digital divide and integrating South Africa into the information society are discussed.","",""
"2016","Digital inequality and racialized place in the 21st century: A case study of San Francisco's Chinatown","Despite robust scholarship on the digital divide, little attention has been paid to its spatiality: how does the organization of physical space, especially the status of the built environment, affect digital access? These questions are especially neglected with regard to Asian Americans, who are thought to have consistently high levels of technological attainment. Nonetheless, certain Asian American communities, particularly those that are poor, working-class, or from refugee backgrounds, remain disproportionately disconnected from the Internet. In this paper, I examine the relationships between digital, racial, and environmental inequalities in San Francisco’s Chinatown. I show that historic disinvestment in Chinatown’s building stock, combined with campaigns led by ethnic Chinese people themselves to preserve historic structures and prevent displacement, have created a physical landscape that cannot support broadband Internet. As a result, many residents depend on inferior connections that diminish their life outcomes. I conclude that digital inaccess is the most recent manifestation of historical place-based racism through which Asian Americans have been constructed as outsiders and perpetual foreigners.","",""
"2016","With a little help from my friends: An analysis of the role of social support in digital inequalities"," This article reports an empirical study on the composition and socio-economic background of social support networks and their moderating role in explaining digital inequalities. It conceptually draws upon and empirically reaffirms Van Dijk’s multiple access model, acknowledging motivational, material, skill and usage divides, while focussing on the under-researched issue of social support as indispensible source of social learning. Besides a small group of self-reliants, the results indicate a pattern of relatively socially disadvantaged domestic support receivers, characterized by lower digital resources. A second social support pattern points to a relatively socially advantaged non-domestic support receivers (i.e. friends/colleagues), high in digital resources. Drawing upon the concept of homophily in social networks, the results indicate a link between offline and online exclusion, perpetuating digital inequalities. ","",""
"2016","Modeling the second-level digital divide: A five-country study of social differences in Internet use"," Based on representative surveys on Internet use, this article advances comparative research on the second-level digital divide by modeling Internet usage disparities for five countries with narrowing access gaps. Four core Internet usage types are constructed and predicted by sociodemographic variables in a structural model. Overall, the findings confirm the recently identified shift in the digital divide from access to usage in five further countries. Results show that sociodemographics alone account for up to half of the variance in usage in these high-penetration countries, with age being the strongest predictor. Measurement invariance tests indicate that a direct comparison is only valid between three of the five countries explored. Methodologically, this points to the indispensability of such tests for unbiased comparative research. ","",""
"2016","A Social Milieu Approach to the Online Participation Divides in Germany"," Research on digital divides has been helpful in advancing our understanding of the social structuration of Internet access, motivations to go online, digital skills, and Internet (non-)use, including participatory uses. However, digital divide research has been criticized for oversimplifying the relationship between demographic characteristics and Internet use and for its under-theorization. A social milieu approach, inspired by Pierre Bourdieu’s sociological theory, presents an excellent set of concepts to address these criticisms and thus advance digital divide research. This article uses the social milieu approach for an empirical investigation of the participation divides in Germany. Focus groups and online communities with 96 participants from seven distinct Internet milieus serve to differentiate online participation along social lines. The results show that German citizens are strongly segregated into distinct Internet milieus that differ in their intensity, variety, understanding, and attitudes toward online participation. Each milieu displays specific participatory patterns and some of the findings challenge existing research on digital and participation divides. Implications are derived and limitations of the approach carved out. ","",""
"2017","The unexplored history of operationalising digital divides: a pilot study","Since the early years of the personal computer, when computing began to diffuse to the general public, social researchers have focused on the (non)use of information and communication technologies in the household and the impact of the resulting digital divides on social and economic inequalities. The Internet's diffusion led this work to become an increasingly central focus of research, but not following a sustained trajectory of attention. This study tracks the questions used to operationalise digital divides as a heretofore unexplored history that throws light on the course of social research – illuminating problems that are masked by traditional studies that follow the responses to these questions, but not the questions. By focusing on surveys of Internet use, analysing questionnaires from the USA, Britain, Hungary and South Africa reaching back to 1997, we examine how survey research questions on Internet (non)use have evolved. Study of the changing operational definitions of Internet use across time and space provides a formerly unexamined perspective on the ebb and flow of academic interest in digital divides, the changing meaning of that term and the relationship of social research to technology and policy change.","",""
"2017","Access is not enough: the impact of emotional costs and self-efficacy on the changes in African-American students’ ICT use patterns","ABSTRACT Previous research has examined the impact of computing interventions to reduce digital inequity. However, few studies focus on factors such as inequalities to material access, Internet use patterns, and affective or emotional anxiety. This paper investigates the potential role of emotional costs and computer self-efficacy in the connection between computer use at home and students’ computer use patterns. Data for this research come from pretest and posttest surveys administered to fourth- and fifth-grade African-American students. The results reveal that students’ home computer use is a significant predictor of the change in their information and entertainment usage over the course of the intervention. Students’ emotional costs partially mediate the relationship between home computer use and information-oriented usage over the intervention period. The findings suggest that providing students access to digital devices is not enough to close the digital divide.","",""
"2017","Do the rich get digitally richer? Quantity and quality of support for digital engagement","ABSTRACT This paper asks what predicts having access to and using social support networks that might help an individual in using the Internet. Following the course taken by the digital divide or digital inclusion research, this paper uses socio-cultural, socio-economic, social, and digital indicators to predict access to and the type of potential and actual social support networks that might help an individual in using the Internet. In addition, the paper examines the quality of the support received which is neglected in most investigations that mainly focus on quantitative indicators of support. The study draws on a representative survey conducted in the Netherlands; 1149 responses were obtained. The results show that while there are no real inequalities in access to and use of support, the quality of the support that people access is unequally distributed replicating existing patterns of disadvantage. Thus, access to support is another level at which the digital divide manifests and strengthens itself. Those who experience most problems online also seem to have the most difficulty obtaining high-quality support even when it is available, creating an even larger ‘gap’ between those who do and do not need support.","",""
"2017","Between class and status? Examining the digital divide in Finland, the United Kingdom, and Greece","ABSTRACT This article examines the digital divide in terms of access and the cultural use purposes of the Internet in Finland, the United Kingdom, and Greece. The analysis is based on data from Finnish, British, and Greek sections of Eurobarometer collected in 2013 (N = 3,009). Separate measures for class and status are applied in the analysis. The findings indicate that both access to and use of the Internet for cultural purposes are affected by a number of interdependent factors, whose effects and strengths vary significantly among the countries.","",""
