"year","title","abstract","journal","doi"
"2008","Metadata provision and standards development at the Collaborative Digitization Program (CDP):  A History","What began in 1998 as the Colorado Digitization Project is now known as the Collaborative Digitization Program (CDP), or CDP@BCR.  The CDP’s Heritage West database represents not only the primary product of the organization, but also one of the oldest continuously-operating collaborative repositories of cultural heritage metadata in the country.  As a basis for the author’s forthcoming quantitative and qualitative analysis of Dublin Core metadata in Heritage West, the following article offers a history of how the CDP has, over time, organized and managed the metadata provision for its digitization projects.","",""
"2008","Multimedia for Peanuts: The Pachyderm Project at Five","The genesis for this paper was a panel discussion held in March 2008 at the annual WebWise conference on the topic of “The Power of Presentation.”  In that discussion a number of projects were profiled that featured new approaches to presentation – some using virtual worlds, some recreating history – and some using a generic multimedia development platform called Pachyderm. As it happened, the invitation came at the same time that the Pachyderm Project, initially funded by the Institute for Museum and Library Services, was celebrating its fifth year of operations, under a model in which it had achieved self-sustaining status by the end of its third year.  This paper captures the story of the Pachyderm Project in brief, and aims to highlight some of the insights and learnings the team had as they moved from a model of external support to one in which the project could move forward under its own power.","",""
"2009","Digital Museums and Diverse Cultural Knowledges: Moving Past the Traditional Catalog","Web 2.0 technologies have introduced increasingly participatory practices to creating content, and museums are becoming interested in the potentials of “Museum 2.0” for reaching and engaging with new audiences. As technological advances are opening up the ways in which museums share information about the objects in their collections, the means by which museums create, handle, process, and transmit knowledge has become more transparent. For this to be done effectively, however, some underlying contradictions must be resolved between museum practices, which privilege the account of the “expert,” and distributed social technology practices, whose strengths lie in allowing for many, sometimes contradictory, perspectives. This article presents a theoretical position and framework for the adaptation of Web 2.0 technologies within the traditional work of the museum, in ways that support the generation and representation of knowledge in, by, and for diverse communities. We then expand on this theoretical perspective by discussing several case studies of exploratory work in this area, and close the article by presenting a few tactical, bottom-up initiatives that museums and distributed communities can take to facilitate the diffusion of this new conceptual framework. Though the subject of this article is online museums, the issues are relevant to all online collections, in particular portals, online public access catalogs (OPAC), and content management systems.","",""
"2010","A software agent and Web service based system for digital preservation","Digital objects have extensively existed in daily work and life. Some of them often need to be kept accessible and usable for a relatively long period of time. Therefore, digital preservation has emerged as a pressing demand for the communities of archives, libraries, and publishers, and even for ordinary computer users. However, compared to traditional papery and magnetic preservation, digital preservation poses novel challenges to these communities. In this paper, we briefly introduce how the challenges are addressed in the PROTAGE system developed by integrating the widely adopted software agent and Web service technologies.","",""
"2010","Digital cultural collections in an age of reuse and remixes","This paper explores the question of under what circumstances CI should seek to control non-commercial reuse of digital cultural works. It describes the results of a 2008 survey of CI professionals at U.S. archives, libraries and museums which gathered data on motivations to control access to and use of digital collections, factors discouraging control, and levels of concern associated with different types of unauthorized reuse. Analysis presents three general themes that explain many of the CI motivations for control:“Controlling descriptions and representations,” “Legal risks and complexities” and “Getting credit: fiscal and social costs and revenue.”  It concludes by offering a set of examples of varying levels of reuse control (from none to complete) to serve as heuristics.","",""
"2012","The Politics of Ethnic Heritage Preservation in Canada: The Case of the Multicultural History Society of Ontario","    This article examines the constitution of the collections of the Multicultural History Society of Ontario between 1976 and 1982 in the context of the Canadian policy of multiculturalism. Set up as an independent nonprofit organization to document the history of ethnocultural communities in Ontario, the society was funded with public money. This article considers how competition with other cultural heritage organizations and relationships with ethnic donors affected collecting strategies. While the society’s mission was scholarly, the politicization of multiculturalism influenced its collecting process in significant ways. This case study illustrates the importance of understanding contextual factors when assessing the scope, content, and limitations of library, archive, or museum collections.  ","",""
"2014","Archives, Libraries, Museums: Coming Back Together?","While libraries, archives, and museums have taken separate paths to professionalization, the digital environment, along with its many opportunities for collaboration, is bringing these cultural institutions closer together, just as David Gracy projected early in his career. In the networked world, these siloed organizations with their unique professional histories are realizing that users of their content want information about subjects, not information from a particular source.","",""
"2014","Archives, Libraries, Museums: Coming Back Together?","While libraries, archives, and museums have taken separate paths to professionalization, the digital environment, along with its many opportunities for collaboration, is bringing these cultural institutions closer together, just as David Gracy projected early in his career. In the networked world, these siloed organizations with their unique professional histories are realizing that users of their content want information about subjects, not information from a particular source.","",""
