"year","title","abstract","journal","doi"
"2000","Online Personal Networks"," Personal relationships are noted for intimacy, frequent interaction, the maintenance of multiple relations, face-to-face contact and a desire for proximity. What happens to such relationships when face-to-face contact is unavailable or severely limited? How do pairs maintain personal relationships at a distance and via computer-mediated communication, and what do their personal networks look like under these conditions? Social network data from four computer-supported distance learning classes are used to build a picture of the size and composition of students' personal online networks. Individuals reported on their communications regarding instrumental and social relations with others in their class, and on which media they used to maintain these relations. In keeping with social network studies, those who communicate more frequently maintain more relations and more socially supportive relations, and report more positively about their desire for future work and social interaction. Individuals benefit from closer ties by feeling a stronger belonging to the class and perceiving greater social interaction among class mates. Unique to the online multi-media environment, strongly tied pairs use more media to communicate and appropriate both the technology and occasions for interaction to maintain their ties. Interview data from members of the same program reveal that pairs with closer ties used computer media to create virtual proximity, whispering to each other via Internet Relay Chat during synchronous classes, and seeking out others via email late at night. ","",""
"2001","Exploring Multiplexity: Social Network Structures in a Computer-Supported Distance Learning Class","A computer-mediated group is a complex entity whose members exchange many types of information via multiple means of communication in pursuit of goals specific to their environment. Over time, they coordinate technical features of media with locally enacted use to achieve a viable working arrangement. To explore this complex interaction, a case study is presented of the social networks of interactions and media use among members of a class of computer-supported distance learners. Results show how group structures associated with project teams dominated who communicated with whom, about what, and via which media over the term, and how media came to occupy their own communication niches: Webboard for diffuse class-wide communication; Internet Relay Chat more to named others but still for general communication across the class; and e-mail primarily for intrateam communication. Face-to-face interaction, occurring only during a short on-campus session, appears to have had a catalytic effect on social and emotional exchanges. Results suggest the need to structure exchanges to balance class-wide sharing of ideas with subgroup interactions that facilitate project completion, and to provide media that support these two modes of interaction.","",""
"2002","Strong, Weak, and Latent Ties and the Impact of New Media","This article argues that consideration of the strength of ties between communicators can help reconcile disparate results on the impact of new media on social relations. It is argued from the research literature and studies by the author that where ties are strong, communicators can influence each other to adapt and expand their use of media to support the exchanges important to their tie, but where ties are weak, communicators are dependent on common, organizationally established means of communication and protocols established by others. Due to this differential use of media, a new medium that adds means and opportunities for previously unconnected others to communicate will have positive effects on weak ties and weak-tie networks, in particular by laying an infrastructure of latent ties (ones that exist technically but have not yet been activated), and providing an opportunity for weak ties to develop and strengthen. A new medium may also have positive effects on strongly tied pairs where it adds another means of communicating and supports the communication needs and tasks of the pair. However, where a new medium replaces a former, common means of communication, the dependence of weak ties on a common medium makes weak-tie networks highly susceptible to dissolution. In contrast, strong-tie networks, with their connections via multiple relations and multiple media, can be expected to be more robust under conditions of change.","",""
"2003","A social network caught in the Web","We present an analysis of Club Nexus, an online community at Stanford University. Through the Nexus site we were able to study a reflection of the real world community structure within the student body. We observed and measured social network phenomena such as the small world effect, clustering, and the strength of weak ties. Using the rich profile data provided by the users we were able to deduce the attributes contributing to the formation of friendships, and to determine how the similarity of users decays as the distance between them in the network increases. In addition, we found correlations between users' personalities and their other attributes, as well as interesting correspondences between how users perceive themselves and how they are perceived by others.","",""
"2004","‘I’ve Never Clicked this Much with Anyone in My Life’: Trust and Hyperpersonal Communication in Online Friendships"," Earlier research on online communication has observed how its distinctive characteristics (such as limited cues and potential asynchronicity) facilitate online communication, notably ‘hyperpersonal communication’. Yet these distinctive characteristics do not explain the development of trust in online communication. This article uses qualitative interviews with 17 internet users to explore the foundations of trust in online friendships, drawing on Piotr Sztompka’s theoretical framework. It concludes that there are four main sources of online trust. First, reputation, whether grounded in a pseudonym or offline identity. Second, performance, due to the scope for enhanced performance in online communication. More than this, performance plays an especially important role in the building of online friendship, following Giddens’ model of the pure relationship (1991). Third, pre-commitment, through self-disclosure, which in turn encourages a ‘leap of faith’ and reciprocal self-disclosure. Finally, situational factors, especially the premium placed upon intimacy and the pure relationship in contemporary societies. ","",""
"2004","Internet connectedness before and after September 11 2001"," Abstract Based on survey data gathered before and after September 11, 2001 (‘9/11’), this study examines the relationship between ‘internet connectedness’ and communicative actions after September 11 2001. The study found that: (1) people heightened their dependency relations with traditional mass media after September 11, regardless of whether or not they had an internet connection; (2) ‘internet high-connectors’ intensified their internet connections, while ‘internet low-connectors’ decreased the intensity of their internet connections; and (3) internet high-connectors participated in a broader range of civic activities in response to September 11 than did internet low-and non-connectors. ","",""
"2004","Social Interactions Across Media"," Two studies compared college students’ interpersonal interaction online, face-to-face, and on the telephone. A communication diary assessed the relative amount of social interactions college students conducted online compared to face-to-face conversation and telephone calls. Results indicated that while the internet was integrated into college students’ social lives, face-to-face communication remained the dominant mode of interaction. Participants reported using the internet as often as the telephone. A survey compared reported use of the internet within local and long distance social circles to the use of other media within those circles, and examined participants’ most recent significant social interactions conducted across media in terms of purposes, contexts, and quality. Internet interaction was perceived as high in quality, but slightly lower than other media. Results were compared to previous conceptualizations of the roles of internet in one’s social life. ","",""
"2004","Interpersonal communication after 9/11 via telephone and internet: A theory                 of channel complementarity"," How did Americans respond to the crisis posed by the terrorist attacks of September 11 (‘9/11’) in their communicative choices? Proposing the theory of channel complementarity, this article argues that users of a medium who satisfy a particular functional need also use other media types to fulfill that need. Based on an analysis of the data gathered by the Pew Research Center for the People and the Press immediately after the 9/11 attacks, it demonstrates that the individuals who communicated via telephone with family and friends about the 9/11 attacks were also more likely to communicate with family and friends on the internet. ","",""
"2005","Social networks and Internet connectivity effects","This paper explores the impact of communication media and the Internet on connectivity between people. Results from a series of social network studies of media use are used as background for exploration of these impacts. These studies explored the use of all available media among members of an academic research group and among distance learners. Asking about media use as well as about the strength of the tie between communicating pairs revealed that those more strongly tied used more media to communicate than weak ties, and that media use within groups conformed to a unidimensional scale, showing a configuration of different tiers of media use supporting social networks of different ties strengths. These results lead to a number of implications regarding media and Internet connectivity, including: how media use can be added to characteristics of social network ties; how introducing a medium can create latent tie connectivity among group members that provides the technical means for activating weak ties, and also how a change in a medium can disrupt existing weak tie networks; how the tiers of media use also suggest that certain media support different kinds of information flow; and the importance of organization-level decisions about what media to provide and promote. The paper concludes with a discussion of implications for Internet effects.","",""
"2005","Weak Ties in Networked Communities","Communities with high levels of social capital are likely to have a higher quality of life than communities with low social capital. This is due to the greater ability of such communities to organize and mobilize effectively for collective action because they have high levels of social trust, dense social networks, and well-established norms of mutuality (the major features of social capital). Communities with “bridging” social capital (weak ties across groups) as well as “bonding” social capital (strong ties within groups) are the most effective in organizing for collective action. People who belong to multiple groups act as bridging ties. When people with bridging ties use communication media, such as the Internet, they enhance their capability to educate community members and to organize, as needed, for collective action. This article summarizes evidence from stratified household survey data in Blacksburg, VA, showing that people with weak (bridging) ties across groups have higher levels of community involvement, civic interest, and collective efficacy than people without bridging ties among groups. Moreover, heavy Internet users with bridging ties have higher social engagement, use the Internet for social purposes, and have been attending more local meetings and events since going online than heavy Internet users with no bridging ties. These findings may suggest that the Internet—in the hands of bridging individuals–is a tool for enhancing social relations and information exchange, and for increasing face-to-face interaction, all of which help to build both bonding and bridging social capital in communities.","",""
"2005","The use of the Internet to activate latent ties in scholarly communities","  This paper presents the results of a survey on the use of the Internet by university-based scholars to contact unknown peers. These contacts are considered as examples of the activation of “latent ties” which are said to exist within communities with associated interests. The research indicates that the Internet facilitates the activation of these ties and that the degree to which it is used for this purpose is associated with academic rank.  ","",""
"2006","Social capital online: Collective use of the Internet and reciprocity as lubricants of democracy","This article puts the democratic potential of using the Internet into perspective through an analysis of how collective uses of the Internet promote social capital. Research results reveal that social capital online (i.e. trust and reciprocity) is enhanced by involvement in collective use of the Internet such as participation in online communities and use of the Internet among informal groups in everyday life. This process could counter negative aspects of Internet use. Further, accumulated online social capital can be a powerful predictor of online political participation, i.e. online reciprocity has a positive effect on intention to participate in online civic discussion. Finally, the authors' analyses indicate the possibility of a spillover of online social capital into offline arenas. It is concluded that collective use of the Internet can be a lubricant for democracy.","",""
"2006","The Quality of Online and Offline Relationships: The Role of Multiplexity and Duration of Social Relationships","Recent studies have shown that adolescents use the Internet not only to maintain social relationships with distant relatives and friends but also to create new relationships online; some of these friendships become integrated into their social circle. Research has focused mainly on the effect of the Internet on existing relationships or the nature of online-only ties, so studies comparing the quality of online and face-to-face relationships are missing. The goal of this study is to bridge this gap. In keeping with previous studies on social association, we argue that the quality of social relationships is dependent on duration and diversity of topics and activities carried together. Time is important, as it facilitates the development of a collective shared history and identity. Intimacy develops through the participation in shared activities and discussion of diverse issues of personal concern. Using a representative sample of the adolescent population in Israel, we find that closeness to a friend is a function of social similarity, content and activity multiplexity, and duration of the relationships. Friendships originated in the Internet are perceived as less close and supportive because they are relatively new and online friends are involved in less joint activities and less topics of discussion. The implications of the findings are discussed.","",""
"2006","Focused Activities and the Development of Social Capital in a Distributed Learning “Community”","This study examined the development of individual social capital in a distributed learning community. Feld's theory of focused choice predicts that the formation of network ties is constrained by contextual factors that function as foci of activities. In our research, we examined how group assignment and location could function as such foci to influence the development of individual social capital in a distributed learning community. Given that networks with different content flows may possess different properties, we examined two different types of networks—task-related instrumental networks and non-task-related expressive networks. A longitudinal research design was used to evaluate the evolution of networks over time. Hypotheses were tested using a sample of 32 students enrolled in a distributed learning class. The results show strong support for Feld's theory. While serving as foci of activities to organize social interactions, both group assignment and geographic separation can also function to fragment a learning community.","",""
"2006","Friends, Friendsters, and Top 8: Writing community into being on social network sites","“Are you my friend? Yes or no?” This question, while fundamentally odd, is a key component of social network sites. Participants must select who on the system they deem to be ‘Friends.’ Their choice is publicly displayed for all to see and becomes the backbone for networked participation. By examining what different participants groups do on social network sites, this paper investigates what Friendship means and how Friendship affects the culture of the sites. I will argue that Friendship helps people write community into being in social network sites. Through these imagined egocentric communities, participants are able to express who they are and locate themselves culturally. In turn, this provides individuals with a contextual frame through which they can properly socialize with other participants. Friending is deeply affected by both social processes and technological affordances. I will argue that the established Friending norms evolved out of a need to resolve the social tensions that emerged due to technological limitations. At the same time, I will argue that Friending supports pre-existing social norms yet because the architecture of social network sites is fundamentally different than the architecture of unmediated social spaces, these sites introduce an environment that is quite unlike that with which we are accustomed.","",""
"2006","The social support networks of internet users"," The available research indicates mixed results regarding the internet’s role in social relations. The article contributes to this research by studying the provision of support in egocentred social networks. Data regarding size, structure and communication channels were assessed through two specially designed surveys. The results show that the internet has a relatively limited impact on social relationships. Internet users have slightly larger social networks only in certain socially de-privileged segments (e.g. divorced, less educated). However, they reveal some specifics with respect to the structure of networks (more friends and less kin, weaker ties) and communication channels (typically the internet is used as a complement). The article also illustrates certain serious problems when drawing a causal inference from non-experimental data. ","",""
"2007","Media use in long‐distance friendships","New media such as email and mobile phones have made it easier to maintain relationships over distances. The present paper examines which media people use to maintain long-distance friendships. The main focus lies on the comparison of email and phone. Media choice theories like media richness theory assume that media can be classified according to their richness, and that people choose the medium which fits best to the affordances of a specific task. The phone as richer medium should be preferred over email in the case of maintenance of long-distance friendships because it is easier to express emotions and to give immediate feedback via phone than via email. Email is an asynchronous medium and communication via email is therefore independent of space and time. Therefore, it can also be argued that email is preferred over the phone because it makes it easier to communicate across different work schedules or even time-zones. In two studies (Study 1 conducted in the Netherlands, Study 2 conducted in Germany) media use in long-distance friendships was measured. Across both studies, email was the most frequently used medium. In Study 1, an interesting asymmetric influence of closeness of the friendship emerged. The closer the friendship, the more emails were written in total, but the less the relative use of email. Instead, the percentage of phone calls increased. Study 2 aimed to replicate and explain this finding and assessed also the content of the phone call or emails. Whereas the intimateness of the emails did not change with increased closeness of the friendship, the intimateness of the phone calls increased with increasing closeness of the friendship. This result indicates that people use email primarily for staying in touch, whereas important personal matters are still discussed on the phone.","",""
"2007","University Students' Local And Distant Social Ties: Using and integrating modes of communication on campus","The use of the Internet has increased dramatically in recent years, with university students becoming one of the most dominant user groups. This study investigated how the Internet is integrated into university students' communication habits. The authors focused on how online (email and instant messaging) and mobile (cellphones and texting) modes of communication are used in the context of offline modes (FTF and telephone) to support students' local and distant social ties. Using a mixed methods approach that combined survey data from 268 Canadian university students with focus group data, a rich description was obtained of what modes of communication students use, how they integrate them to fulfill communication needs, and the implications of this integration for the maintenance of social ties. It was found that friends were the most important communication partners in students' everyday lives. Regardless of the type of social tie, instant messaging was used the most for communication. Because of their high cost, the cellphone and texting were used less. Increased distance between communication partners reduced communication – local communication was more frequent for both friends and relatives. While instant messaging and email were used less for contact with those faraway, the decrease was not as sharp as with in-person and telephone contact. In particular, instant messaging was used extensively for distant contact with friends – often daily. While online modes were used widely for local communication, it was evident that they also filled communication gaps with those faraway. Because they were inexpensive and readily available on campus, email and instant messaging were highly used by students and they facilitated a close integration of far-flung ties into university students' everyday lives.","",""
"2007","Neighborhoods in the Network Society the e-Neighbors study","This study examines whether the Internet is increasingly a part of everyday neighborhood interactions, and in what specific contexts Internet use affords the formation of local social ties. Studies of Internet and community have found that information and communication technologies provide new opportunities for social interaction, but that they may also increase privatism by isolating people in their homes. This paper argues that while the Internet may encourage communication across great distances, it may also facilitate interactions near the home. Unlike traditional community networking studies, which focus on bridging the digital divide, this study focuses on bridging the divide between the electronic and parochial realms. Detailed, longitudinal social network surveys were completed with the residents of four contrasting neighborhoods over a period of three years. Three of the four neighborhoods were provided with a neighborhood email discussion list and a neighborhood website. Hierarchical linear modeling (HLM) was used to model over time the number of strong and weak ties, emailed, met in-person, and talked to on the telephone. The neighborhood email lists were also analyzed for content. The results suggest that with experience using the Internet, the size of local social networks and email communication with local networks increases. The addition of a neighborhood email list further increases the number of weak neighborhood ties, but does not increase communication multiplexity. However, neighborhood effects reduce the influence of everyday Internet use, as well as the experimental intervention, in communities that lack the context to support local tie formation.","",""
