"year","title","abstract","journal","doi"
"2021","Identifying the Moderating and Mediating Variables in Parental Mediation Practices in Nigerian Families in the Digital Age"," This study examined the moderating and mediating variables in parental mediation practices in Nigerian families in the digital age. This study applied a multi-stage sampling technique to achieve an adequate representation of the population in six educational districts in Lagos, Nigeria. The study included 1,270 adult sample. Data were obtained through questionnaire from parents of children in the selected schools. Findings of the study showed that a strong and positive relationship exists between parent’s age and educational level and parent’s gender and educational level. These relationships were evident as strong moderating variables for the four mediation strategies measured in this study. It was found that, relating to the digital literacy of parents, the hierarchical regression analyses showed that only 7% of variance in parental mediation practice, in the case of participatory learning, was explained. By implication, the constructs of digital literacy are more relevant to participatory learning mediation practice compared to other parental mediation practices in the context of Nigerian families. ","",""
"2021","Factors Explaining Grandparental Mediation of Children’s Media Use in Two National Contexts"," This study aimed at revealing the factors determining grandparental mediation of their grandchildren’s screen viewing and interactive media use, based on online surveys conducted among 291 American and 356 Israeli grandparents who reported taking care of 2-to-7 years old grandchildren at least once a week. Past mediation, familiarity with children’s media, parental instructions and joint leisure activities were positively associated with mediation of both interactive and non-interactive media use, whereas country of residence was not significantly associated with mediation. These findings provide initial knowledge about the universal aspects of grandparental mediation in early childhood. ","",""
"2022","Familial digital mediation as a gendered issue between parents"," The different strategies explored by parents managing their children’s digital practices, the associated challenges, and the conditions for a successful outcome are central in the literature on digital mediation within families. However, few studies consider the family context in its entirety, which is essential if we wish to capture the meanings, perceptions, and negotiations that are played out in the daily family routine. Based on an ethnographic survey on the place of screens in Swiss families’ socialization processes, the paper shows, first, how paternal use undermines digital mediation within the family and, second, that this mediation is ultimately a maternal concern and responsibility. By interviewing all family members (including children) on their assessment of screen use by all family members (including parents), our research design provides access to the backstage of parental digital mediation. Our data shows that women confront fears and guilt in the face of social norms that a ‘good’ mother should regulate screens ‘well’ within her household. We conclude that parental digital mediation is embedded in a gendered social and relational context, where fathers and mothers do not adopt the same roles, the same duties, nor the same mental burden. ","",""
"2022","Emerging Digital Inequalities: A Comparative Study of Older Adults’ Smartphone Use"," Older adults are increasingly using smartphones. Researchers have identified demographic, attitudinal factors and social outcomes related to inequalities in access, skills, and activities of internet use. While this research has been ongoing for years, studies about the digital inequalities related to the use of smartphones by older adults are still scarce, and they rarely have undertaken sociocultural comparisons of usage. This article builds on an analysis of tracking data of older adults’ (pp. 55–79) smartphone use, to explore digital inequalities around traditional axes of inequality and sociocultural factors that shape older adults’ smartphone use. It adds a comparative perspective for understanding emerging inequalities related to sociocultural contexts to the existing literature. The results show that differences cannot be explained solely by sociodemographic factors, but also possibly by national policies and culture. Particularly, age, on its own, is not able to explain the differences reported. Older adults engage in a range of different activities on their smartphones, and differences between groups across the traditional axes of inequalities do not mirror exactly the differences found in previous research on internet use. This is important considering the risk of emerging new inequalities and the ongoing revisiting of policies to mitigate them. ","",""
"2023","Parental mediation of online interactions and its relation to adolescents’ contacts with new people online: the role of risk perception","ABSTRACT To ensure their children's safety online, parents can utilize number of strategies, including active and restrictive parental mediation. Active mediation encompasses parents discussing and advising children about safe usage of the internet, whereas restrictive mediation means limiting children's internet usage. Both strategies aim to affect children's online behavior, especially to minimize online risks. Using a sample of 1031 adolescents aged 11–17 (54% females) and structural equation modeling, we focused on the active and restrictive parental mediation of online interactions and their connections to adolescents’ potentially risky online contacts with new people. In addition, we considered the indirect effect of parental mediation on adolescents’ behavior through adolescents’ risk perception. In this way, we captured one of the potential explanatory mechanisms through which the parental mediation's effect occurs. The results showed that restrictive mediation decreased contacts with new people by increasing adolescents’ risk perception of this activity. In contrast, active mediation had neither a direct nor indirect effect on adolescents’ online contacts. The results enrich the theory of parental mediation by showing that risk perception is an important factor to consider when researchers examine the effects of parental mediation on children's potentially risky online behavior.","",""
"2023","Using the story completion method to explore Australian parent and child responses to online risk"," This study uses the story completion method to explore how young people and their parents respond to online risks. During 13 family workshops with Australian participants which utilised a participatory action research approach, 197 parents and children responded to hypothetical online risk scenarios by completing one of seven story ‘stems’. Reflexive thematic analysis of participants’ stories revealed empathy and compassion for the hypothetical protagonists, as well as a range of practical, technical and discursive/communicative strategies for addressing risk. Most participants – especially children – demonstrated a pragmatic approach that drew on a range of practical skills and knowledge, eschewing sensationalised accounts documenting worst-case scenarios. This study offers insights which may inform policy and educational approaches to online safety for adolescents, highlighting a need to move beyond a deficit and protectionist approach to minimising online risks for young people, towards recognition of children’s knowledge, competencies, agency and resilience. ","",""
"2024","Nurturing early learners in the digital world: A parental perspective","In today’s contemporary society, parents need to prudently integrate digital devices into their children’s lives to nurture, and not hinder their holistic development. Normatively, a four- to six-year-old child is expected to achieve numerous developmental milestones, as outlined in the nurturing early learners (NEL) framework. The NEL framework classifies these milestones under various learning domains, skills and competencies, namely Aesthetics and Creative Expression, Discovery of the World, Language and Literacy, Motor Skills Development, Numeracy, and Social and Emotional Development. Through qualitative interviews conducted with 21 parents (14 mothers and 7 fathers) online who spoke about their four- to six-year-old children, this study investigated how parents wielded digital devices to foster their children’s development in these key domains, but deliberately ring-fenced their children from pernicious use.","",""
"2024","Children’s, parents’ and educators’ understandings and experiences of digital resilience: A systematic review and meta-ethnography"," Supporting children to be digitally resilient when facing online adversity is an increasingly important developmental task. However, conceptual knowledge underpinning digital resilience and how this operates among children and across their home, community and societal contexts is embryonic. A systematic review and meta-ethnography of research focusing on the understandings and experiences of digital resilience of children aged 8–12, their parents and educators identified 11 studies conducted since 2011 across 14 countries. Four main themes, ‘Using connective technologies’, ‘Risky online experiences’, ‘Mediation strategies’ (comprised of sub-themes ‘Proactive coping’ and ‘Reactive coping’), and ‘Risk and protective factors’ were constructed from our translation of first- and second-order constructs, with the overarching theme ‘ Constant balancing’ cross-cutting these themes. We argue one cannot have risky online experiences without the potential to develop digital resilience and vice versa. Insofar as current conceptualisations of digital resilience underestimate the role played by wider contexts, important knowledge gaps are highlighted. ","",""
"2024","Parental mediation of children’s online risks: The role of parental risk perception, digital skills and risk experiences"," This article advances the understanding of parental mediation of children’s online activities by examining the roles of parental perceptions of risk and parent and child digital skills. Analysis of a survey of European parents distinguishes parental perceptions of the likelihood of risk and the severity of harm before testing the linearity of their relation to digital skills. Results show that parents with higher perceived control over online risk management and those with a broader set of digital skills are more involved in mediating their children’s online activities. The analysis also shows a non-linear, n-shaped relationship between parental skills and parental perception of the severity of harm. The results suggest that future research on parental mediation should distinguish parental knowledge of the digital world based on direct experience from their general perceptions of the likelihood of risk and severity of harm. ","",""
