"year","title","abstract","journal","doi"
"2015","Parental socialization of children’s Internet use: A qualitative approach"," This study explores how parents feel about the Internet and its impact on children, how they manage children’s Internet use, and how they view the role of various socialization agents in creating a safer Internet environment for children. In-depth interviews with parents of children aged 7–12 revealed that parents presumed more positive than negative influence of the Internet on their children and felt confident about their ability to manage their children’s Internet use. This high confidence in their own management, however, seemed to lead parents to be less engaged in purposeful and communication-based parental mediation and be less interested in updating their Internet knowledge. Nonetheless, they argued that parents should be actively engaged in communication with their children and be equipped with Internet knowledge to promote a safer online environment for children. Implications of the findings are discussed and suggestions for future research are provided. ","",""
"2015","Brokering new technologies: The role of children in their parents’ usage of the internet"," This study investigated to what extent sons and daughters influence their parents’ adoption of digital media, particularly the internet, compared to other influence sources. It also explored structural factors that play a role in this bottom-up process, such as socio-economic differences and gender. Finally, it examined the relationship between this bottom-up technology transmission process and parents’ levels of internet self-efficacy and online activities. Drawing from socialization and diffusion of innovation research and using a self-administered random mail survey, we found that children play a role in including their parents in the digital environment, particularly among women, people who are older (35 years old and above), and belong to lower socio-economic groups. We also found that this bottom-up technology transmission is somewhat negatively associated with parents’ internet self-efficacy. Implications and possible interpretations of these results are discussed. ","",""
"2016","Internet risks and expert views: a case study of the insider perspectives of youth workers in Hong Kong","This study collects and analyses the viewpoints of front-line youth workers regarding the notion of ‘Internet risks’. Previous studies have examined and discussed various dangers of the Internet. Parental, school, and governmental interventions are often called for by those concerned. The implicit assumption is that these are the people who possess the expertise to tackle the problems at hand. Through participation in three forums focusing on ‘Internet risks’, and in-depth interviews with 10 such ‘experts’ in Hong Kong, the study examines if this is a valid assumption. It finds that experts perceive Internet risks rather differently. In addition to the more conventional views about content, contact and conduct risks, our interviewees are aware that a new order is quickly emerging in the new media environment. Despite being considered as ‘experts’, they do not necessarily know how to tackle the so-called ‘youth-at-risk’. Rather, they are exploring how they would capitalize on the opportunities offered by the developments. The key findings highlight the need to critically review the notion of ‘Internet risks’. As with other risk frameworks, the ultimate aim is to develop intervention programmes. In this regard, risks are often treated as concrete problems that can be solved. Youth experts, however, find that the changing scope, speed and persistence of communication in today's information society present the biggest challenge in youth work. The existing framework of risks was unable to describe and account for such risks. In response, Internet risk has to be reconceptualized so that more updated, relevant and imaginative intervention can be introduced.","",""
"2016","Boys and girls taking risks online: A gendered perspective on social context and adolescents’ risky online behavior"," This study explores gender differences in the relationship between adolescents’ risky online behavior and their social context, as in family factors and the prevalence of Internet use in a country. Using the EU Kids Online dataset, including information on 8554, 14- to 16-year-old adolescents in 25 countries, and applying multilevel modeling, this study shows that social context is additionally and differentially related to adolescent boys’ and girls’ risky online behavior. When taking individual characteristics such as sensation seeking and digital skills into account, particularly for male adolescents, growing up in a single-parent household and lacking parental co-use increases the chance of online risk behavior. Adolescents, especially males, however, are less likely to participate in risky online behavior in societies where Internet use is widespread. Overall, this study shows that it is important to take account of individual and social factors when explaining adolescents’ online risk taking and gender differences herein. ","",""
"2017","How does “talking about the Internet with others” affect teenagers’ experience of online risks? The role of active mediation by parents, peers, and school teachers"," This study investigated how active mediation employed by three key socialization agents—parents, peers, and school teachers—is associated with teenagers’ engagement in online risks. A survey with 746 students aged 12–18 years found that different socialization agents focus on different aspects of the Internet when they engage in active mediation. Parents and teachers focus more on making instructive remarks whereas peers are more likely to engage in neutral facets of active mediation (e.g. helping or recommending). However, parental mediation tends to diminish whereas peer mediation tends to escalate with age among teens. The findings also suggest that school teachers’ Internet-related discussions can reduce teens’ potential exposure to online risks while peer interactions may increase teens’ vulnerability to online risks. ","",""
"2018","Youth interaction with online strangers: experiences and reactions to unknown people on the Internet","ABSTRACT Previous research on youths’ experiences with online strangers has mostly utilized quantitative designs which may result in the omission of important parts of the youths’ experiences and perceptions. In this qualitative study, we adopt a child-centred approach and focus on the children’s and adolescents’ experiences with unknown people from the Internet. This is one of the most pronounced parental concerns, despite the fact that an online presence is now normative for most children. We use the data from focus-groups and individual interviews in nine European countries (N = 368) conducted with youths between the ages of 9 and 16 years. Participants were asked about their perceptions of potentially negative or problematic situations while using the Internet and digital technology. Using thematic analysis, we classified youths’ experiences and reactions related to interacting with online strangers in four themes: (1) non-verbal interaction; (2) initiation of contact; (3) communication; and (4) face-to-face meeting. In all four levels of interactions, children and adolescents reported a variety of positive and negative experiences and reactions. We interpret our findings with a co-construction model which perceives children and adolescents as active participants in the online world. We conclude that children are successfully making active decisions to initiate, continue, and stop interactions with unknown people from the Internet. These findings broaden the current perspectives of youths’ meetings with unknown people online.","",""
"2018","When digital natives instruct digital immigrants: active guidance of parental media use by children and conflict in the family","ABSTRACT Based on the premise that children are active agents who influence their parents’ media use, this study investigated child–parent digital media guidance. Children often introduce new media into the family and influence parents’ media adoption and use. This study also investigated whether this child–parent digital media guidance is associated with media conflicts in the family. A cross-sectional survey was conducted among 187 parent–child dyads in Flanders, Belgium. Paired samples t-tests and multiple linear regression analyses were conducted. The results showed that both children and parents reported that children guide their parents how to use digital media, especially for newer media forms such as smartphones, tablets, and apps. Families where there was more child–parent digital media guidance reported more conflicts about media. These relationships were comparable in the parent and child reports.","",""
"2018","Is big brother more at risk than little sister? The sibling factor in online risk and opportunity"," This article uses data from the 25,142-child study EU Kids Online to investigate the impact of sibling status on a child’s experience of online risk and opportunities. In general, the effects associated with having a sibling appear to be comparatively small. The presence of older siblings slightly increases use and skills, while younger siblings are associated with slight reductions. These dynamics are particularly visible in the use of social networking sites. Older siblings have the effect of increasing the range and number of online activities pursued by their younger siblings. Patterns around concerning exposure to risk and possible harm are not straightforward but younger children with an older sibling are not at an increased risk. Where younger aged children have even younger siblings, this is associated with a slight reduction in risk, whereas older-aged children with a younger sibling, and only children, appear to experience slight increases in risk. ","",""
"2018","Online opportunities and risks for children and adolescents: The role of digital skills, age, gender and parental mediation in Brazil"," This article presents a study that applies integrated and multi-factor path analysis to report the direct and indirect effects of young Brazilian individual and home factors on their online opportunities and risks. The results show that engaging in more online opportunities, being older and having a lower level of parental mediation are associated with a higher number of online risks. At the same time, being older, having Internet access at home, having parents with a higher educational level, possessing more digital skills and receiving a higher level of co-use and active parental mediation are positively associated with online opportunities. Although restrictive parental mediation is negatively associated with online risks, it also reduces opportunities. In addition, co-use and active mediation are positively associated with parental educational level. These findings offer a starting point to understand children’s online behaviour and digital inclusion in Latin America and analyse its differences with other regions. ","",""
"2018","European research on children’s internet use: Assessing the past and anticipating the future"," In this article, we reflect critically on the research agenda on children’s Internet use, framing our analysis using Wellman’s three ages of Internet studies and taking as our case study the three phases of research by the EU Kids Online network from 2006 to 2014. Following the heyday of moral panics, risk discourses and censorious policy-making that led to the European Commission’s first Internet Action Plan 1999–2002, EU Kids Online focused on conceptual clarification, evidence review and debunking of myths, thereby illustrating the value of systematic documentation and mapping, and grounding academic, public and policy-makers’ understanding of ‘the Internet’ in children’s lives. Consonant with Wellman’s third age, which emphasizes analysis and contextualization, the EU Kids Online model of children’s online risks and opportunities helps shift the agenda from how children engage with the Internet as a medium to how they engage with the world mediated by the Internet. ","",""
"2019","Measuring Mediation of Children’s Media Use","This study presents the development of a new scale for measuring mediation of children’s noninteractive and interactive media use by their caregivers. Comprising two subscales, this 16-item measure was tested in a pilot study and then included in an online survey of 356 grandparents. The mediation constructs had good internal homogeneity, significant interconstruct correlations, and high loadings on a single latent factor for each subscale. Scores were well distributed along the range. A concurrent validity test indicated a significant negative association between attitudes toward media and restrictive mediation. These findings suggest that the new scale is reliable and useful.","",""
"2019","The Complexities of the Role of Children in the Process of Technology Transmission Among Disadvantaged Families: A Mixed-Methods Approach","Using mixed methods that triangulated survey data with interviews and focus groups, this study explores the complexities of the process of technology transmission from children to parents in vulnerable contexts, such as rural communities in Chile. The findings suggest that among Internet users, about one-fourth learned from their children and a similar percentage relied on them to perform different tasks. Both the quantitative and qualitative results suggest that in many families, both processes are closely intertwined and are more likely to occur among people of a similar profile—women, older people, and less educated people. In addition, they are significantly associated with parents’ improved digital skills, but not with more online activities.","",""
"2019","Contextualizing connectivity: how internet connection type and parental factors influence technology use among lower-income children","ABSTRACT This project links research on digital inequality, which focuses on connection quality and its outcomes for under-connected individuals, and parental mediation, which focuses on the influence of parents on children’s technology experiences. We examine the internet connection type used by families, the technology experiences of lower-income parents, and their perceptions of opportunities that technology use offers their children. We then determine how these factors influence the frequency and scope of their school-age children’s technology use. Findings show that contextualizing children’s connectivity to account for infrastructural, socio-demographic, and relational influences provides new insights into the technology experiences of lower-income children. One set of findings suggests that direct benefit from increased connectivity is most evident for lower-income parents – those with the lowest household incomes, lowest levels of education, and whose dominant language is not English. These effects remain after controlling for other socio-demographic factors. The second set of results shows that greater connectivity increases how frequently both children and parents use the internet, but is associated only with a greater scope of internet activities for parents. Parents’ online activity scope is important for their children’s online experiences, directly predicting the scope of their online activities. High-scope parents were also significantly more likely to see digital opportunities in their children’s internet use, which in turn also predicted more frequent and broader internet use by their children. We conclude by considering the practical implications of these findings for digital equity initiatives targeting lower-income families.","",""
"2019","“I PREFER TO BUILD TRUST” – EXAMINING PARENTAL CONFIDENCE IN CHILDREN’S DIGITAL SKILLS","Digital and social media has become deeply intertwined into children’s mundane daily routines. Considered to be digital natives, young people are often assumed to be experts in using digital and social media. As they are indeed enthusiastic users of new devices and social media platforms, children might be quick in picking up on platform’s features and affordances. However, their ability for a strategic understanding of risks and opportunities is often questioned. Parental anxiety about children’s engagement with digital and social media stems from their lack of confidence in children’s ability to navigate online risk. While academic research attempted to identify and measure digital skills, less is known how these skills are negotiated in the family.&#x0D; Drawing on separate home-based interviews with children and parents, this paper looks at the approaches parents use to govern children’s digital and social media use. It discusses how confidence in children’s abilities – or varying degrees of it – affects the parental approach and success in working with their children on developing safe digital practices. Three dominant parental approaches identified across the sample are practices where parents act as *watchdog*, *chaperon* and/or *collaborator*. Central to each of these approaches are varying degrees of trust in children’s ability to engage in safe practices online.","",""
"2019","INTERNET SAFETY EDUCATION: HOW WE EDUCATE OUR GIRLS TO BEWARE OF OTHERS, AND OUR BOYS TO BEWARE OF THEMSELVES","Alongside its many advantages, the Internet presents a variety of challenges and risks to adolescents. From a perspective focusing on information flow processes, this study distinguishes between risks resulting from _exposure to information_, i.e. exposure of adolescents to inappropriate content: Harmful, sexual or violent, and risks resulting from _exposure of information_, i.e. disclosure of personal information online, privacy harms inflicted by the user or others, misuse of personal information which can result in identity theft, physical and sexual assault. The study examines gender differences in perceptions regarding adolescents’ online uses, habits and risks, and whether these lead to differences in emphasis of educational messages delivered by parents and teachers to adolescents. Based on a mixed-method study combining survey conducted among 513 adolescents and 50 semi-structured interviews with educators and adolescents, the findings illustrate how a common perception that girls share more personal information online and are (consequently) more vulnerable to online predators leads to more emphasis given on implications of personal information disclosure in messages delivered to girls. On the other hand, boys are considered naughty and nosy, searching for “forbidden”, mainly sexual, content, and emphasis is given on limiting and monitoring their searches and video consumption. Apparently, although parents, teachers and adolescents proclaim to be aware of the similar risks to boys and girls online, there is a message interwoven in internet safety education discourse: Girls are to be aware of others looking to harm them, and boys are to be aware of themselves, their curiosity and evil inclination.","",""
"2020","Parenting Style, Personality Traits, and Interpersonal Relationships: A Model of Prediction of Internet Addiction","This study examined how parenting style can help or hinder the development of healthy family relationships when Internet addiction is a concern. A sample of 700 middle school and 500 college students in Zhuhai (a special administrative city in Southern China) were surveyed using self-report questionnaire scales to examine the links among Internet addiction, parenting style, personality traits, and interpersonal communication skills. The findings indicate that problematic parenting styles, such as strict attitudes, heavy punishment, and regularly withholding affection significantly predict individuals’ Internet addiction. Dysfunctional parent–child relations can drive children to extensively use the Internet for escape. In addition, personality traits of introversion, tendency to lie, neuroticism, and psychoticism are positively associated with Internet addiction. Poor interpersonal skills are also linked to self-reported Internet addiction. This study found an interaction effect among parenting style, interpersonal relationships, and personality traits that produced a significant joint effect predicting Internet addiction. The findings provide some guidance for policy makers and professional counselors involved with youth and families struggling to treat Internet addiction.","",""
"2021","A Review and Content Validation of 10 Measurement Scales for Parental Mediation of Children’s Internet Use","For the last decade, research has shown inconsistent findings about validity of parental mediation scales for children’s Internet use. This inconsistency has manifested itself in at least 10 parental mediation models, which are also inconsistent in contents and definitions, lacking content validity thereof. With the goal of facilitating a consistent framework, this narrative review focuses on the content and factorial validity of 10 measurement scales. A panel of eight experienced researchers in the field of children’s online safety/risks assessed the content validity. Based on this assessment, the present review proposes a trichotomy of restrictive-enabling-observant parental mediation and corresponding conceptual definitions for further research.","",""
"2021","Problematic Internet use among elementary school students: prevalence and risk factors","ABSTRACT This study develops a new version of the problematic Internet use scale suitable for senior elementary school students. It includes six subscales: time management, compulsive Internet use, emotion adjustment influence, interpersonal and academic influence, preferred online social interaction, and daily life influence. This research utilized the survey method to understand the relationship between student backgrounds and their Internet use behaviors, and problematic Internet use. A total of 775 elementary school fifth and sixth graders from northern Taiwan were sampled based on the stratified random sampling method. There were 763 valid surveys. The results indicated that the factors of gender, parents’ attitudes towards Internet use, the time when subjects first started to use the Internet, number of hours spent getting online each time on weekdays, number of types of devices used to go online, and Internet activity preferences are significant. Boys have more serious problematic Internet use than girls. Different Internet activities present different risks of triggering problematic Internet use for male and female students. Students whose parents allow them to use the Internet without intervention have more serious problematic Internet use. Students exhibit more serious problematic internet use if they start using the Internet before beginning elementary school. When students use the Internet more and can go online using more types of devices, they tend to have more serious problematic Internet use. This study finds that students preferring Internet activities for recreational entertainment and social interaction have more serious problematic Internet use than students preferring Internet activities as learning tools.","",""
"2021","Parenting in the digital age: Between socio-biological and socio-technological development"," Parents have long been encouraged to treat their child’s development as a capability, with the imperative being to maximize this capability. At the same time, however, children’s ‘natural’ process of development must be allowed to take its course. Digital media technologies promise to not only enhance children’s developmental capacity, but also threaten to disrupt their normal development. Drawing on qualitative research involving 40 Australian parents, this article examines parents’ concerns about their teenage children’s use of digital media. It examines how parents negotiate the tension between technological development and the benefits it affords their child, and the perceived risks that technological development poses to their child’s normal development, through mediating what they construct as positive and negative exposure to digital media. Parents distinguished between media use that was considered to enhance their child’s development and use that had the potential to disrupt it, by categorizing various activities as appropriate and inappropriate. ","",""
