"year","title","abstract","journal","doi"
"2018","Digital Traces in Context| Digital Traces and Personal Analytics: iTime, Self-Tracking, and the Temporalities of Practice","This article examines digital traces related to the use of self-tracking devices in the context of digitally mediated iTime. These devices enable the continual production, representation, interpretation, and negotiation of varied traces of physical activity, time use, and temporal coordination. We focus on temporalities, exploring how the “tendencies” of iTime are being differentially produced, encountered, interpreted, and acted on in daily life. In-depth interviews with 25 individuals between 18 and 24 years of age are used to examine the contexts of trace production and analysis as they take place within different configurations of ordinary practice. First, we examine whether continuously self-tracked data alters people’s sense of the temporal possibilities of self-transformation. Second, we ask whether people’s encounters with, and analytics of, their traces alter how their daily life is temporally sequenced, coordinated, and experienced. Third, we consider if and in what ways quantified and visualized self-tracked data change the temporal meaning and value of media-related practices for those undertaking them. We show how digital traces are produced within, and become concrete elements of, the temporalities of practices.","",""
"2018","Digital Traces in Context| Self-Tracking Data as Digital Traces of Identity: A Theoretical Analysis of Contextual Factors of Self-Observation Practices","Digital traces occur as a consequence of using digital devices or applications, but they can also be produced intentionally, as in the case of self-tracking activities. Self-tracking increases the amount of data that represents users’ or communities’ identity traces, and individuals, institutions, and companies are interested in analyzing these data, but few consider the framing conditions of the data collection, distribution, and evaluation. This article demonstrates how contextual factors influence self-observation data. Based on approaches of a sociology of quantification and a theoretical discussion of metadata in scientific research, it examines the individual, social, and technological contextual factors that influence the production, analysis, distribution, and interpretation of digital self-tracking data. The article develops systematization of the phenomenon of self-tracking data.","",""
"2018","Blood, Sweat, and Tears: Navigating Creepy versus Cool in Wearable Biotech","ABSTRACT This paper considers how personal data protections figure into the design process of wearable technology. The data question is becoming especially important in the face of recent innovations in biotechnology that capitalize on the new fungibility of biology and electronics, in which new biotech wearables capitalize on the ability to analyze and track changes in blood, sweat, and tears. Interviews and participant observation with wearable tech designers, data scientists, fashion tech entrepreneurs, and select experts in cybersecurity and intellectual property law, reveal a range of approaches to data protection in design within the culture where wearables are beginning to merge with biotech. While a few respondents were extremely vigilant about protecting consumer’s privacy, the majority felt that when consumers ‘opt in’ to data sharing, they should be cognizant of the risks. From their perspective, it is not necessarily the producer’s responsibility to protect user's personal data. These attitudes present a problematic logic, which leaves users vulnerable to data exploitation. The paper concludes by arguing that this laissez-faire culture is the environment in which wearable biotech is being developed and will be deployed. This emerging technology raises issues about bodies, data, and ownership in crucial need of analysis and critique to push its move into the mainstream toward more equitable and inclusive ends.","",""
"2018","Co-evolving with self-tracking technologies"," Seen in a longitudinal perspective, Quantified Self-inspired self-tracking sets up “a laboratory of the self,” where people co-evolve with technologies. By exploring ways in which self-tracking technologies energize everyday aims or are experienced as limiting, we demonstrate how some aspects of the self are amplified while others become reduced and restricted. We suggest that further developing the concept of the laboratory of the self renews the conversation about the role of metrics and technologies by facilitating comparison between different realms of the digital, and demonstrating how services and devices enlarge aspects of the self at the expense of others. The use of self-tracking technologies is inscribed in, but also runs counter to, the larger political-economy landscape. Personal laboratories can aid the exploration of how the techno-mediated selves fit into larger structures of the digital technology market and the role that metrics play in defining them. ","",""
"2018","The mundane experience of everyday calorie trackers: Beyond the metaphor of Quantified Self"," In this article, we build on the work of Ruckenstein and Pantzar, who have demonstrated how our understanding of self-tracking has been influenced by the metaphor of the Quantified Self (QS). To complicate this very selective picture of self-tracking, we shift the focus in understanding self-tracking from members of the QS community to the experiences of ‘ordinary man and woman’. Therefore, we interviewed ‘everyday calorie trackers’, people who had themselves started using MyFitnessPal calorie counting app but were not part of any tracking community. Our analysis identifies three main themes – goals, use and effect – which highlight the mundane side of self-tracking, where people pursuing everyday, limited goals engage in basic self-tracking and achieve temporary changes. These experiences contrast with the account of self-tracking in terms of long-term, experimental analysis of data on the self or ‘biohacking’, which dominates the QS metaphor in the academic literature. ","",""
"2018","The temporal flows of self-tracking: Checking in, moving on, staying hooked"," This article conceptualizes the experience of self-tracking as flow, a central technique, utilized by digital media companies to hook their users. We argue the notion of flow is valuable for understanding both the temporal lock-ins of self-tracking practices in sequences and repetition, and the way self-tracking technologies thrive on data sequences for retaining users and creating viable businesses. To substantiate this, we present a qualitative empirical study of how users experience flow when tracking various aspects of their personal lives. Users find self-tracking technology and the metrics they generate to have much more limited relevance and thus guide their attention elsewhere. If they are hooked, they are so in ways different from those projected by the technology. Users find meaning in their self-tracking in moments of registration, allocution, consultation and conversation, but also problematize their attachment to specific temporal tracking regimes. ","",""
"2018","“Find Your Fit”: Wearable technology and the cultural politics of disability"," By examining advertisements, technological design, workplace wellness programs, and legal discourses involving Fitbit activity trackers, this article examines how cultural ideas about disability infuse the representation, use, study, and implementation of wearable technology. Although Fitbit features wheelchair users prominently in advertising, Fitbit only measures movements in steps, and its use in workplace wellness programs has been accompanied by legal concerns about wellness programs’ potential weakening of workplace protections afforded to US workers by the Americans with Disabilities Act (ADA) and the Genetic Information Nondiscrimination Act (GINA). This article shows that inspirational and tragic representations of disability work to depoliticize wearable technology and argues that disability needs to be a more central category of analysis for cultural studies and sociological studies of the cultural impacts of fitness tracking and wellness culture. ","",""
"2018","Making art from self-tracking cycling data","ABSTRACT This paper describes a collection of data-driven aesthetic explorations that investigate the concept of ‘cycling as art practice’ made possible through the use of self-tracking tools while journeying by bicycle into the landscape. The explorations draw upon the philosophy of the ‘Walking Artists’ and the concept of ‘the dematerialization of the art object’ as counterpoints to the Quantified Self Community, which aims to visualize previously invisible aspects of our daily lives for the purposes of positive self-monitoring. In doing so, it begins to draw attention aesthetically, and philosophically, to the way in which representations of our experiences, particularly of landscape, can be formed through the use of such technologies for generative art purposes.","",""
