"year","title","abstract","journal","doi"
"2014","Why data is not enough:  Digital traces as control of self and self-control","As an alternative to the seemingly natural objectivity and self-evidence of “data,” this paper builds on recent francophone literature by developing a critical conceptualization of “digital traces.” Underlining the materiality and discursiveness of traces allows us to understand and articulate both the technical and sociopolitical implications of digital technology. The philosophies of Gilbert Simondon and Michel Foucault give strong ontological and epistemological groundings for interpreting the relationships between technology and processes of subjectification. In this light, digital traces are framed as objects and products of heteronomous interventions, the logics of which can be traced through the programs and algorithms deployed. Through the empirical examples of “Predictive Policing” and “Quantified Self” digital traces are contrasted with the premises and dreams of Big Data. While the later claims to algorithmically correlative, predict and preempt the future by reducing it to a “what-is-to-come,” the digital trace paradigm offers a new perspective on how forms of self-control and control of the self are interdependent facets of “algorithmic governmentality.”","",""
"2015","Towards more helpful bus tracker apps for blind transit riders","Bus trackers aid in travel planning with real-time bus arrival and location information. However, their sight-centered design means they’re inherently challenging for the blind. A clear understanding of their help-seeking situations in interacting with bus trackers is necessary to design appropriate help features as a solution.We present a qualitative method to study help-seeking situations of blind users in interacting with bus-trackers, and illustrate its application on the use of CTA bus tracker. Think-aloud observation of seven participants generated verbal reports of performing bus-tracking activities. Qualitative analysis explained what, where, and how help-seeking situations arose in learning the interface, in site interaction, determining estimated time of arrival, requesting ETA alerts, and finding bus location. We elaborate results pertinent to key help-seeking situations, the underlying help needs, and design implications for appropriate help features. The paper contributes a feasible qualitative method to study help-seeking situations, as well as valuable insights into the thoughts, actions and perceptions of blind users in real time bus tracking. This represents the first step towards developing the tool to transform the 45 million blind citizens into empowered transit riders. Implications for transit agencies, real time systems designers, and research in travel management, human-computer interaction and cognitive science are discussed.","",""
"2016","Self-tracking as communication","Self-tracking has attracted a lot of attention from researchers and public opinion makers owing to its potential for improving life conditions through preemptive action on health, and as a tool of user empowerment vis-à-vis health-care professionals and private and public institutions. Nevertheless, the ‘stuff’ that is typically tracked – exercise and diet being the dominant tracking activities – refers to cultural and social practices that, for the individual user, are utterly mundane and reside in an experiential realm of everyday life. Self-tracking has to be understood in relation to behavior that is predominantly about getting things done in ways that are possible, suitable and meaningful for the individual. To account for this, we propose to conceptualize self-tracking as a communicative phenomenon along three dimensions: communication with the system, the self and social networks of peers. We develop the theoretical framework, drawing upon empirical findings from a qualitative study on how self-tracking is practiced and experienced in the context of exercise by different categories of empirical users. We demonstrate that the meanings of self-tracking practices are, at once, shaped by the motivation of an individual user who is situated in a broader web of everyday activities, and stimulated and augmented by communicative features provided by the technology.","",""
"2016","Technologies for Sharing: lessons from Quantified Self about the political economy of platforms","ABSTRACT Quantified Self (QS) is a group that coordinates a global set of in-person meetings for sharing personal experiences and experiments with self-tracking behaviours, moods, and activities. Through participation in US-based QS events and watching online QS presentations from around the globe, we identify a function of ambiguous valuation for supporting sharing communities. Drawing on Stark's (2011) theory of heterarchy, we argue that the social and technical platforms supporting sharing within the QS community allow for multiple, sometimes conflicting, sets of community and commercial values. Community cohesion benefits from ambiguity over which values set is most important to QS members. Ambiguity is promoted by sharing practices through at least two means, the narrative structure of members' presentations, and what counts as tracking. By encouraging members to adhere to a three-question outline, the community ensures that multiple values are always present. Thus, it becomes a question of which values this sharing community emphasizes, not which value sets members present, at any given time. By leaving the tools and methods of tracking open − from sophisticated wearables and data analysis to pen-and-paper and storytelling − the community creates space for and embraces self-trackers with a broad spectrum of technological proficiency and interest. QS as a group capitalizes on circulation of knowledge valued somewhat ambiguously to sustain and grow the community, both encouraging and supporting the commercialization of self-tracking technologies while keeping technology developer interests from overwhelming community-building interests. This, we argue, has implications for researchers hoping to understand online communities and the ‘sharing economy' more generally.","",""
"2016","Fit for prosumption: interactivity and the second fitness boom"," This article advances the claim that a new ‘fitness boom’ has arrived, one marked by the proliferation of devices such as wearable fitness trackers. The first fitness boom of the 1970s/1980s was characterized by the heightened availability of fitness ‘tools’ and the supposition that pursuing a ‘fit’ lifestyle was tantamount to responsible living. The new era in fitness intensifies foregoing fitness trends, rather than departing from them completely. Specifically, the second fitness boom is deemed to be characterized by the following traits: (1) the manifestation of socio-technical networks, (2) an emphasis on human–technology interactivity, (3) data-intensiveness, (4) customization in the interest of ‘optimization’, (5) the option for individual users to partake in wider online communities and, finally, (6) both ‘new’ and ‘old’ forms of commodification. With these characteristics in mind, a case is made that fitness is a site for prosumption – production and consumption together – now more so than ever. More importantly, fitness is a site for automated prosumption in that fitness data can be generated with limited effort from fitness participants. Consideration is given to the significance of automated prosumption in the fitness realm as it pertains to fitness and to the notion of prosumption both. ","",""
"2016","Unhappy? There’s an App for That","This article analyses happiness apps, a subset of quantified self (QS) applications focused on tracking and improving user subjective well-being or happiness. I examine these apps, the data they track, and the interventions they propose to explore the social, political, and ethical implications of QS practices associated with happiness apps. Despite their focus on science, data, and quantification, happiness apps are ideologically inflected, mediated through the influential research, rhetoric, and pedagogy of positive psychology. Positive psychology as the “science of happiness” applies research in order to maximise well-being globally, and it increasingly leverages technology for this goal. Through a close reading of the claims and functions of these happiness apps, I highlight their assumptions about the happy individual and good society. Happiness apps do not assess emotions objectively via user data; instead, they filter user emotions through positive psychology’s theories of happiness that inform these apps’ conceptions and standards of well-being. This article argues that happiness apps may function conservatively, teaching users to pursue happiness and the good life without recognizing that understandings of happy and good are not universal but inextricably bound to particular ideological assumptions, cultural contexts, and interpretations of what is positive, valuable, and desirable. The practice of tracking and operationalising user data via a happiness app is a complex, mediated practice. The data are mediated by the particular tool as well as users’ individual understandings of and aspirations for happiness, which in turn are mediated by the rhetoric, ideology, and pedagogy of positive psychology. This triple mediation demonstrates that the QS is not neutral but instead embedded within social, cultural, economic, political, and ethical commitments.","",""
"2016","Coupling Quantified Bodies","The main promise behind the idea of self-quantification is to transform our lives through the continuous collection of numerical evidence about the body and its activity. Although this process may help boost self-knowledge, everyday life also involves a complex network of relations with other bodies that exert a significant, sometimes determining, influence on our behaviour. To address this concern, we suggest that self-quantification data can be modulated as perturbations to other human and non-human bodies that, in turn, may directly affect the everyday practices of the self. By coupling quantified bodies, we transform existing practices by disrupting the elements that realise, perform and reproduce existing practices. In order to explore and further understand the affective potential of this idea, we designed a system that creates unfamiliar, digitally enabled couplings between two quantified bodies: a human and a plant. In particular, in this design experiment we modulate walking activity data into perturbations to a quantified plant. How does this coupling transform the way we look at self-quantification? Are we bringing forth a new space of responsibility and ethical concern? What if the plant dies because someone did not walk enough? In this article we discuss the implications of creating such a coupling keeping a critical distance to current forms of self-quantification, which are often focused on change through prescriptive solutions rather than through the fostering of self-determined growth. With this work we aim to expand the current understanding of the affective possibilities of self-quantification in the context of social change.","",""
"2016","How Old am I?","In previous work we argued that ageing bodies and changes across the life-course were becoming measured, standardised, and treated according to a new logic of functionality, supplanting traditional categories of normality (Katz/Marshall 2004). In particular, the binary between the ‘functional’ and the ‘dysfunctional’ has become a powerful tool in mapping and distributing bodies around datapoints, functional subsystems, and posthuman informatics. In this paper, we extend this line of analysis by exploring how current developments in self-tracking technologies and the proliferation of digital apps are creating new modes and styles of ‘quantified ageing’. In particular, we identify four interrelated fields for inquiry that are specifically relevant in setting out a research agenda on ageing quantified selves and statistical bodies: 1) ‘Wearables’ and mobile technologies, including both technologies designed for selfmonitoring/self-improvement (health, fitness, sleep, mood and so on) and those designed for surveillance of and ‘management’ of ageing individuals by children, caregivers or institutions. 2) Digital apps, including those that collect and connect data uploaded from wearable devices, and those that deploy various algorithms for ‘calculating’ age and its correlates. 3) The rhetorics of games and scores in age-related apps such as those used in digital ‘brain training’ games that track a person’s imagined cognitive plasticity and enhancement, while promising protection against memory loss and even dementia. 4) The political economy of data sharing, aggregation and surveillance of ageing populations. Conclusions ponder wider sociological questions; for example, how will the insurance industry acquire and use data from digital health technologies to produce new actuarial standards? How will older individuals plan their futures according to the risks assembled through quantifying technologies? We argue that the technical turn to new ways of quantifying and standardising measurements of age raises a range of complex and important questions about ageism, agency and","",""
"2016","My Quantified Self, my FitBit and I","The rise of wearable tech, namely devices with sensors measuring the user’s daily activities and habits seems to be suggesting a paradox in the post-Snowden era: On one hand, it is generally accepted that unauthorised use, storage and processing of the user’s private data by the state directly clashes with our fundamental rights for privacy; on the other, the user seems to be keen on self-recording and storing one’s own data by willingly using sensors, enabling him to learn more about one’s habits, general health status or even personality. In the era of wearable tech we seem to be accepting that measuring data is not a privacy infringement but a self-surveillance exercise in a quest to get to know ourselves better, most acute to exercising one’s right to free expression. Yet, how is this addressed in legal terms? The focal point for this paper is to address the nascent phenomenon of users actively partaking in the QS movement by wilfully sharing health related datasets. Part 1 notes the transition from the “right to be let alone” to the right to own one’s data as the underlying rational for QS: is it a form of expression regarding a tradable commodity in a free market or a matter of greater public importance? Part 2 dissects the dilemma in sharing health data for public health and/or research purposes exceeding the strict limits of private sphere. The unfortunate case of Google Health, the unconstitutional purchase of Iceland’s national datasets by deCODE and the mishap of the Care.data are studied to shed light to the many faces of our Quantified Selves: Is the current legislative approach fit for facilitating the QS movement, as a type of self-expression? The paper critically examines self-measurement technologies from a legal perspective and calls for urgent reforms in self-measured data protection.","",""
"2016","Theorising the Quantified Self and Posthumanist Agency","In our paper we will examine the cultural implications of the quantified self technology and analyse how contemporary US-American novels reflect and comment on the qualitative changes of the human condition against the backdrop of an interpretive dominance held by the natural and social sciences as well as the changes effected by quantitative methods. Moreover, we will investigate some historical and cultural continuities of the quantified self within USAmerican culture. We claim that, although the quantified self is a global phenomenon, it has emerged from a model of subjectivity which has been deeply engrained in American culture at least since Benjamin Franklin’s Autobiography (1791) and which emphasises individualism, economic self-optimisation, and a techno-euphoric belief in progress, self-control, and self-possession. In this context, the quantified self can be connected to theoretical discourses of 1) economy-driven subjectivity, 2) posthumanism and 3) knowledge cultures of the information age. Drawing on Gary Shteyngart’s recent novel Super Sad True Love Story (2010), we will map forms and functions of literary engagements with various manifestations of the quantified self in relation to the cross-dependencies between distributed agency, potentials and the limits of knowledge systems, and economic mechanisms. As critical systems of second-order observation, fictional texts reflect on the repercussions of practices related to numerical self-description. At the same time, they constitute epistemological counter models to the relational, modular, and combinatory logic of the database (Manovich 2001; Hayles 1999), by focusing on the qualitative dimension of human experience and thus (re-)inscribing human agency into these “technologies of the self” (Foucault 1984). Theoretical Assumptions Quantified approaches to self-knowledge are not a new phenomenon. Humans have always collected and systematised comprehensive data about the world and about themselves. While the term ‘the quantified self’ is a rather recent coinage, Stefan Danter, Ulfr ied Reichardt and Regina Schober 54 other terms signifying similar concepts have been around for some time such as self-tracking, self-monitoring, self-reporting, personal metrics (Young 2012), and in a more theoretical context, of forms of self-thematisation (Hahn/Schorch 2007). In this light, self-tracking can be traced back to early Protestantism and more specifically to Calvinism, particularly Puritanism, and also several other, earlier forms of observing oneself, such as diaries and journal keeping, autobiographies and personal letters. What becomes immediately clear is that one needs a medium to observe oneself, that is to ‘look at oneself’ from outside, even if the focus is on interiority and private experiences. The beginning of modernity brought about a radical shift to the interior of one’s experience (Taylor 1989) and at the same time a strong shift to externalisation of the self in the sense of relying on a medium. This necessarily implies that all forms of self-monitoring are medium-dependent and consequently at least partially codetermined by the medium or technology. This ‘doubleness’ is constitutive, we want to suggest, to every form of self-tracking. Therefore, if we wish to comprehend contemporary forms of selfconstitution through self-tracking, we have to consider the historically decisive shift to the individual as well as the immense reliance on tools that increasingly defy individual control, as for instance computer-based appliances. The first and most important technology that allowed for and at the same time lead to self-tracking was of course the technology of writing. Only if you have a medium that allows you to externalise and store your thoughts, feelings and experiences, is it possible to begin creating a coherent self and identity, which is always a retroactive construction. What seemed contingent when it happened is presented as necessary and brought into a linear, that is narrative, sequence only afterwards in autobiographical writing. As has often been noted, writing and the rise of the individual as a historical phenomenon are closely linked (Ong 1982). The emergence of the individual as a privileged site of social organisation is also connected to the rise of the bourgeoisie in Western and Southern Europe in early modern times and has to be understood within the context of the Reformation, the invention of the printing press and a shift in the economic as well as political/social structure. The link between economics and individualism is particularly noteworthy, and one significant moment to observe this connection is the fact that autobiography in its modern form and double-entry bookkeeping as ‘genres’ or forms to organise ‘data’ arose at about the same time. The most significant literary example of this nexus is Daniel Defoe’s novel Robinson Crusoe (1719), in which the protagonist keeps track of his experience as well as of his possessions and “investments,” in spite of his isolation on the island. Even while the concept of modernisation has been much criticised and relativised in recent debates, processes of individualisation are certainly part of the Western, European and North Atlantic version of modernisation, now understood as neither necessarily linear nor exclusively Western (Eisenstadt 2000). Particularly the digital revolution as the most recent development in information processing technology has made the accumulation and analysis of massive amounts of data easier and affordable for the individual. Big Data has Theorising the Quantif ied Self and Posthumanist Agency 55 not only enabled the functional evaluation of global economic, ecological, and social statistical correlations, but has also made it possible for the individual to extract relevant predictions from personal data. Although Big Data research has focused primarily on economic and media theoretical descriptions of effects and practical applications of these technologies (Berman 2013; Mayer-Schönberger/ Cukier 2013; Schmarzo 2013; Davenport 2014), there have been few attempts so far to critically reflect on Big Data’s alleged epistemological paradigm shifts from a cultural studies and cultural theory perspective. Klaus Mainzer (2014) portends that Big Data debates must be connected with a “historical foundation” in order to be able to evaluate potentials and limitations of such an epistemology in terms of the history of knowledge. Other critical perspectives on Big Data include a volume of essays entitled Big Data: Analysen zum gesellschaftlichen Wandel von Wissen, Macht und Ökonomie (Reichert 2014), as well as Danah Boyd’s and Kate Crawford’s “Critical Questions for Big Data” (2012) which point at the risks and blind spots of Big Data from a social and media studies perspective, by problematising its technological, methodical, social, and ethical assumptions. A distinctly cultural and literary studies perspective allows for making statements that go beyond the diagnostic and descriptive level in that they reflect social implications, prognoses, and potential behavioural models. In this context, the concept of ‘subjectivity’ becomes a central reference point, as it emphasises the dimension of approaching and experiencing the world as a thinking, acting, and feeling subject. Since forms of subjectivities continually change (e. g. Andreas Reckwitz (2006) views processes of economicisation and aestheticisation as a part of the postmodern subject) an examination of contemporary forms of subjectivity has to account for the increasing global, technological and biomedical developments that shape and frame it. Signalling a specific subject formation and cluster of experiences, the quantified self can thus be understood as a concept of the human which is based on numerical and statistical models. In this context, the quantified self can be connected to theoretical discourses of 1) economy-driven subjectivity, 2) knowledge cultures of the information age, and 3) posthumanism. The quantified self is often examined in relation to economic interests, usability, and financial profit. Related to the notion of ‘possessive individualism’, as already drawn out by John Locke (Macpherson 1962), the quantified self is deeply engrained in US-American self-definition. Against the backdrop of a ‘geopolitics of knowledge’, American concepts of individualism in particular have circulated globally (Curry 1991; Ehrenberg 2012), just as distinctive forms of economic orientation have done (Tocqueville 1835/1840). Thus, there are definite connections between a certain technological drive and belief in the feasibility of self, future, self-control, economic ambition and possession (including selfpossession) and the quantified self. The nexus between a particularly US-American form of neoliberalism (Brown 2003; Harvey 2005) and a subject formation which contains elements of the quantified self is key to understanding globalisation, digitalisation, and the increasing transformability of bodies. Stefan Danter, Ulfr ied Reichardt and Regina Schober 56 The digitalisation of all social fields has rendered quantified conceptions of the self increasingly popular. The rapid spread of mobile technology especially has spurred a growing trend toward personalisation of applications. A concept of knowledge as economic resource in a postindustrial “information age” (Bell 1974) unveils the paradox of quantifying a non-quantifiable entity. On the one hand, digital media demonstrate that (collective) forms of knowledge are neither predictable nor ascribable to individuals (Lévy 1997; Jenkins 2010). On the other hand, they simultaneously suggest a potential of collecting, generating, and accessing knowledge through massive databases. According to Nora Young, contemporary digital culture disembodies and decontextualises and takes one “out of the here and now. It is precisely this disembodied, distracted, digital l","",""
