"year","title","abstract","journal","doi"
"2000","The Suitability of Employing Digital Technology for Accessing Photographic Collections","The problems of The storage of photographic material is undertaken by thousands of archiving establishments throughout the world and millions of images are held photographic either in official archives or stored by individuals in various storage collections conditions. The need for archiving standards is no more apparent than when a large collection of images is discovered or obtained such a collection may be a valuable asset and contain precious works in a state of decay. Many neglected collections contain photographic prints that are not mounted or contained in folders but stored loose in files","",""
"2000","The plant information center","The Plant Information Center is a partnership of the North Carolina Botanical Garden, Unviersity of North Carolina (UNC) Herbarium, UNC School of Information and Library Science, McDougle Middle School, and Orange County Public Library. The intent of the Project is to connect the research community and the general public (including school children) to make greater use of primary research material and to nurture the public interest and enthusiasm in the study of trees, plants, and natural history. Four specific objectives include: 1) successful cooperation between the various institutions; 2) the development of an interactive Plant Information Center with a Web-based portal; 3) the development of lesson plans using primary research materials from the herbarium for 6th grade students; and, 4) a test of the usefulness of digital images of herbarium specimens for plant identification and for inspiring the public with the aims and methods of botanical science.","",""
"2000","Linking Florida's natural heritage: Science and citizenry","Linking Florida's Natural Heritage: Science and Citizenry is an IMLS-funded project that improves access to diverse information on Florida species and ecology. The project includes the development of a Web-based interface to both library bibliographic files and museum speciman databases; the creation of bibliographic databases with enhanced taxonomic information; the digitization of a core collection of seminal texts; and, the use of a thesaurus and other tools to improve search and access.","",""
"2000","Web-Wise: A Conference on Libraries and Museums in the Digital World: Introduction","","",""
"2000","Digital image managers: A museum/university collaboration","The University of North Texas and the African American Museum in Dallas are partners in a program designed to produce expert managers of digital images and information. The School of Library and Information Sciences in cooperation with the School of Visual Arts received a 1998 National Leadership Grant from the U.S. Institute of Museum and Library Services to build a collaborative program that includes a digital imaging laboratory and fellowships for students in a Certificate of Advanced Study Program.  The work of the digital image manager includes the production of visual images, the creation and management of databases, and the ability to use advanced network and information technologies to improve access to digital images and information. The program of study prepares individuals to work as digital image managers in museums, libraries, archives, and other information centers.  The Project provides a unique educational experience made possible by the cooperation between a museum and a university. Students digitize objects from the Museum collection and build an image database that will be accessible on the Web. The experience includes the use of video-conference technologies to enhance collaboration between the Museum and the University. Students communicate with the Museum staff, work on images and database information simultaneously, and share experiences immediately. By linking the digital image laboratory and the African American Museum, students have every opportunity to learn from museum professionals as well as from the University community.","",""
"2000","Digitizing and preserving plant images: Linking plant images and databases for public access","Our project continues to develop a database of plant image images dynamically linked to associated scientific data about those images. We strive to research and improve image capture, retrieval, and delivery technologies. Our long-term objectives are to create a digital library for botany including images, digitized botanical references and """"born"""" digital data. All content and research resulting from this project is freely available through the Internet.","",""
"2000","ArtsConnectEd: Collaboration in the integration and access to museum resources","This paper discusses the philosophical underpinnings for museum collaboration; background, implementation, and evaluation of a particular collaboration between the Walker Art Center and The Minneapolis Institute of Arts, ArtsConnectEd; and a vision for future directions for museum collaborations.","",""
"2000","Collaboration through the Colorado digitization project","As a state-wide collaborative among cultural heritage institutions, the Colorado Digitization Project (CDP) is demonstrating how collaboration among libraries, archives, historical societies and museums can support an enhanced digital collection of primary resource material. Collaboration permeates every aspect of the CDP, from governance to infrastructure, from planning to standards. This paper discusses many aspects of that collaboration and the results to date of the CDP.","",""
"2000","Preserving digital assets: Cornell's digital image collection project","This paper describes a two-year project at Cornell University Library to develop an archiving solution to safeguard Cornell's digital image collections, consisting of two and a half million images created over a decade. The Project has inventoried Cornell's digital image collections, investigated current and emerging file formats for long-term utility, explored functional requirements for storage, and drafted recommendations for requisite preservation metadata. These efforts demonstrated the need to develop institutional policies and resources to facilitate long-term maintenance. The final goal of this Project, therefore, is the development of a mainstreaming effort to move digital preservation from a project to program mode. A Digital Preservation Policy Working Group has been assembled that will present its recommendations to the Library Management Team in September 2000. Their report will cover requirements for conversion and metadata, a technical strategy for storage, maintenance, and long-term care, and an assessment of the resources needed to maintain these digital assets.","",""
"2000","Oh what a tangled Web we weave: Opportunities and challenges for standards development in the digital library arena","Standards development is particularly difficult within the digital library arena, primarily because the most active players have not yet formed a true community in the sense of having evolved a common vocabulary, commonality of interest, or structures for collaboration and communication. Competition, the need to allow for innovation and experimentation, and the need for speed in a rapidly changing technological environment all help to foster a culture that does not necessarily value standards. Appropriate responses can help encourage the development of standards even in this environment. Among these is the recognition that collections of practices, best practices, local and global guidelines, normative standards and implementers' agreements can all be useful under different circumstances, and to aim for the level of standarization most appropriate to the situation.","",""
"2000","Children Shaping the Future of Digital Libraries","","",""
"2000","Interoperability and standards in a museum/library collaborative: The Colorado digitization project","The Colorado Digitization Project's goal is to increase access to the special collections and unique resources of the cultural heritage institutions through digitization.","",""
"2000","The digital landscape: The Hawaiian newspapers and war records and trust territory image repository of the University of Hawaii","This paper discusses the nature of three image collections - Hawaiian language newspapers, Hawaii War Records Depository (HWRD) and Trust Territory of the Pacific Islands Photographs - as well as future plans and desires for these digital collections, funded as an IMLS project.","",""
"2001","They threw me a computer but what I really needed was a life preserver","Libraries and museums have a central role to play in ensuring that all Americans are able to access and use effectively emerging communications tools, such as the Internet. These institutions are key pillars of the public sphere of communications, the realm of civil society independent of government and commercial forces that provides citizens the tools to become full participants in republican self-government. This paper identifies four attributes of the digital divide -- literacy, access, content and training -- and discusses the role of libraries and museums in cultivating each of these capacities. The central thrust of the paper is that there are comprehensive solutions to bridge the divide (in the realization of these four elements) where the technological component is necessary but not sufficient to move the truly disadvantaged into the mainstream of American life.","",""
"2001","The IMLS Digital Cultural Heritage Community Project: A case study of tools for effective project management and collaboration","Designed to create a model environment for collaboration on digitization projects, the Digital Cultural Heritage Community Project (DCHC) focused on the digitization of materials from central Illinois museums, archives, and libraries for integration into elementary grades' social science curricula. Support from the Institute of Museum and Library Services' National Leadership Grants, Model Program of Cooperation enabled a group of central Illinois libraries, museums, and elementary schools to develop the underpinnings of a new community. Together the participants in this community built a framework for digitizing primary source materials on common teaching themes, according to the Illinois Board of Education Learning Standards, and providing free access to those materials, organized through a simple search interface.","",""
"2001","A shared digital library of Native American images","Montana State University has available on the Web a digital library called the """"Indian Peoples of the Northern Great Plains."""" The key elements of this collaborative IMLS project were the sharing of equipment, staff, and images.","",""
"2001","Piloting a course: Using a pilot project to identify training needs","Connecticut History Online, a collaboration of The Connecticut Historical Society, The Thomas J. Dodd Research Center at The University of Connecticut and Mystic Seaport, has recently completed a pilot project that is helping to define and shape future training for students and teachers. An initial panel of Teacher Advisors helped create the original program for Connecticut History Online. Further input was obtained through meetings with Teacher Advisors, e-mail responses, and statistics regarding the use of the site. This input is being used to plan training workshops and online tutorials to expose teachers to potential uses of primary research material in the classroom and to encourage them to create their own lesson plans. Ongoing feedback from teachers will assure that Connecticut History Online continues to meet their needs in training students to build observation, analysis and critical thinking skills while preparing for the Connecticut Mastery Test and the Connecticut Academic Performance Test.","",""
"2001","A tool for multipurpose use of online flora and fauna: The Biological Information Browsing Environment, BIBE",") is a facility to help novices and experts find information about plants and animals in digital collections. The Project is funded by the National Science Foundation Biological Databases and Informatics Program and is a collaboration between the Graduate School of Library and Information Science at the University of Illinois, Illinois Natural History Survey, Missouri Botanical Garden, Flora of North America Project at the Harvard Herbarium, and Illinois Department of Natural Resources.  The objectives of the Project are to facilitate access to online flora and fauna by both novices and experts through enhanced indexing, searching, and visualization techniques. Specific search facility and content will be added to help users with different levels of domain knowledge identify species based on the augmentation of professionally developed taxonomic treatments or species descriptions. This is a novel use of taxonomic descriptions. In the course of development the system will undergo a series of qualitative and quantitative evaluations and re-designs by several communities of users, including professional entomologists and botanists as well as citizen scientists performing biodiversity surveys.","",""
"2001","Visualising historical knowledge using virtual reality technology","This paper discusses virtual reality reconstructions of historical sites. Seeing the past as a cultural construction makes the process of representation problematic. Two case studies illustrate aspects of the visualisation of virtual environments: how authenticity in computer reconstructions is reduced to their visuality, and how historically-based VR environments as copies honour their original. The paper asks for more implementation of life forms into architectural settings, and also examines the impact of user expectations on the VR experience.","",""
"2001","Museums and virtual reality: using the CAVE to simulate the past","This project looks at virtual reality (VR) as a mode of displaying history in museums. It focuses on CAVE technology, a form of immersive VR, and examines how current CAVE presentations based on digital reconstructions of buildings and landscapes mediate the historic past. The project is partly based on observations from the use of the CAVE at the Foundation of the Hellenic World (FHW) in Athens, Greece. A special emphasis is placed on the digital reconstruction of ancient cities now in ruins. Miletus, an Athenian and later a Roman colony on the coast of Asia Minor, is the first created so far and constitutes the focus of my investigation. The empirical material I have collected consists of data (video/audio tapes) recording group visits to the CAVE (both school and adult groups) in April 2000. The virtual tourists are ‘shown round’ a digital version of Roman Miletus of the 1st century AD by a museum educator. My analysis concentrates on: • the structure of the CAVE experience (the way information is verbally and visually communicated); • the patterns of producing and communicating knowledge (historical/archaeological discourses practiced within the general pedagogic framework of FHW).","",""
