"year","title","abstract","journal","doi"
"2012","CARING CAPITAL WEBSITES","‘Caring capital’ is that subset of social capital characterized by caregiving, charity and compassion when these actions are given out of a concern for the welfare of others. The relationship between caring and various forms of capital has scarcely been noticed by social scientists, either theoretically or empirically. After reviewing the concepts of caring and capital, 77 websites related to caring capital were analyzed to explore these types of questions: How large, influential and effective is the care-oriented sector of the web? How is it best to categorize the diversity of websites promoting caring capital? What social or interactive and user-generated opportunities are offered by these web sites? What implications for the future do these web organizations have? While we cannot offer any definitive answer to the question of the potential of the Internet for facilitating caring capital, this study's glimpse of the web finds only minimal charitable activity compared to the huge need for greater compassionate caring at both individual and organizational levels.","",""
"2012","FRIENDSHIP TYPE, CLIQUE FORMATION AND THE EVERYDAY USE OF COMMUNICATION TECHNOLOGIES IN A PEER GROUP","This study focuses on teens' use of communication technologies to maintain connections with people from their everyday peer group. It departs from a pre-defined network (in a secondary school in Flanders, Belgium) and investigates how friendship type and clique formation (an important dynamic in this (micro) context) are related to face-to-face communication (FTFC) and the use of email, instant messaging, text messaging, telephone and social network sites in this network. Hypotheses/expectations were derived from network theory and (qualitative and quantitative) studies on the social affordances of communication technologies for adolescents. Data were collected among the 78 pupils of a fourth grade (15–16-year-olds) in a Belgian secondary school. First, dyadic quadratic assignment procedure regression analyses were run to explain the frequency of FTFC and communication through different technologies by looking at dyad characteristics (strength of ties, number of friends in common, same sex…). Second, FTFC and communication through technologies were compared for in-group versus out-group ties. The analyses show that the patterns of FTFC were sometimes reproduced (and therefore extended), and sometimes deviated from in communication through technologies. The specific function each of the studied technologies fulfilled in relation to social structure (in this network) is addressed in the discussion.","",""
"2012","HARMONY AND TENSION ON SOCIAL NETWORK SITES","The need to maintain harmony among one's social contacts is proposed in this paper to impose constraints on the interconnectivity between users of social network sites (SNS). A particular focus is on the connectivity between different social spheres. It is hypothesized that the type and number of social spheres and technological features of SNS interact such that increased levels of social tension result. These ideas are supported by the findings from a survey study among Facebook users. Social diversity of the Facebook network predicted online tension as did the number of family members on Facebook, in contrast to work and social contacts. Furthermore, evidence was found to support the idea that tension might impose an upper limit on network size. Follow-up interview data also showed that online tension was predominantly about unwanted connectivity between the spheres. All the technological features that users reported as problematic focused on the easy access to and broadcast of text and pictures. Findings are discussed in light of unintended, negative side-effects of SNS and social media in general.","",""
"2012","Teenagers’ Experiences With Social Network Sites: Relationships to Bridging and Bonding Social Capital","Many studies have examined the relationship between social network sites (SNSs) and the development of social capital. However, most studies to date have only considered college and adult populations. This study examines the patterns of SNS use in an urban, teenage sample in the United States. It tests the hypothesis that use of SNSs is related to higher levels of social capital. The results show that youth who use Facebook and Myspace report higher social capital in both their school and online relationships. In addition, the analysis suggests that distinct modes of SNS experiences are differentially related to bridging and bonding social capital. Time spent in SNSs is related to bridging capital, while positive or negative experiences are related to bonding capital. The study offers new insights into how youth experience SNSs and the relationship of that experience with their connection to the world.","",""
"2012","Sharing as “frands”: Personified branding strategies on social network sites in China","Prior research on social network sites (SNSs) has focused on interpersonal communication on Facebook, Twitter, and MySpace. Much less is known about the use of SNSs beyond the individual level and outside of the American context. This study fills in the gaps by offering insight into the personified use of interactive features on SNSs by organizations in China for branding purposes. Based on the notion of the social affordances of technologies, we conducted a content analysis of the presence and activities of 98 organizations on a popular Chinese SNS and identified 15 interactive features, including profile related features (e.g., status updates, discussion board, message forwarding) and social game related features (e.g., game players, raffles, virtual goods). The results of our statistical analysis indicated that the more interactive features that an organization used, the more page visits and fans it attracted and the more electronic word of mouth (eWOM) behavior occurred. All of these interactive features helped personify the organizations as friends to their fans, followers, service users, and potential customers, which created a new form of organization–public communication: sharing as “frands.”","",""
"2012","The imagined audience on Facebook: Analysis of Estonian teen sketches about typical Facebook users","This paper analyses Estonian high–school students (N=15) perceptions about the imagined audience on Facebook. Students’ sketches (N=39) and reflections on focus group interviews indicate that the youth are well aware of the plurality of the imagined audience on Facebook. From the total of six prevalent user types and sub–types that emerged, just one user type could be considered representative of an ideal audience on Facebook in the eyes of youth.","",""
"2012","The bandwagon effect on participation in and use of a social networking site","This study examined the bandwagon effect on participation in and use of one particular SNS — Facebook — using a Singapore–based sample of active Internet users. Building on theories addressing the social mechanisms of interactive or communicative technologies, we tested the postulation that the decision of individuals to participate in Facebook would be linked to their perceptions of how widely Facebook had been diffused either at large or among their off–line contacts. Regression analyses confirm this bandwagon tendency in Facebook participation. Moreover, multiple SNS users tended to use Facebook more than all other SNSs if they perceived that it penetrated their off–line contacts more widely. The results suggest that Internet users engage in SNSs to forge personal online networks in ways complying with real–world group proximity and their perception of the prevalence of adoption rather than making random or amorphous choices.","",""
"2012","Mobile communication and strong network ties: Shrinking or expanding spheres of public discourse?"," This study tests theoretical propositions that intensive mobile communication in small networks of like-minded strong ties hinders open dialogue with others. Using multi-wave panel data from a representative sample of adults in the US, the study found that reported levels of open dialogue decreased slightly with mobile-mediated political discussion in small and like-minded strong-tie networks. Interestingly, a more pronounced positive effect was found for mobile-mediated discussion in larger networks of like-minded close ties. In this case, open dialogue was facilitated by mobile-mediated discussion, revealing potential for mobile communication among close personal ties to expand spheres of public discourse and deliberation. Theoretical implications and directions for future research are offered in the discussion. ","",""
"2012","Social networking and adjustments among international students"," How do social media facilitate adjustment to changes in social structure and culture? This research examines the impact of online social networking on online and offline social capitals and adjustment of international students in the United States. A survey of 195 international students in a major Midwestern university showed that students’ interactions with Americans and home country friends using Facebook, extroversion, and horizontal collectivism were positively related to international students’ social adjustment and online bridging capital. Facebook usage mediated the relationship between extroversion and online social capital. The implications of social network site use, personality, and cultural difference on social capital and adjustment are discussed. ","",""
"2012","Norm evolution and violation on Facebook"," This study explores how norms on social network sites evolve over time and how violations of these norms impact individuals’ self-presentational and relationship goals. Employing Expectancy Violations Theory (Burgoon, 1978) as a guiding framework, results from a series of focus groups suggest that both the content of the violation and the users’ relationship to the violator impact how individuals react to negative violations. Specifically, acquaintances who engage in minor negative violations are ignored or hidden, while larger infractions (that could negatively impact the individual) result in deletion of the offending content and – in extreme cases – termination of the Facebook friendship. Negative violations from close friends (that did not impact participants’ goals) resulted in confrontations, while similar violations from acquaintances were often ignored by participants in an effort to ‘keep the peace.’ Furthermore, positive violations were more likely to arise from acquaintances than close friends. ","",""
"2013","EXPLAINING COMMUNICATION DISPLACEMENT AND LARGE-SCALE SOCIAL CHANGE IN CORE NETWORKS","Decline in the size and diversity of American's core networks has been tied to the displacement of face-to-face interaction and to lower societal well-being. Comparing core networks in the United States, Norway, and Ukraine, we reject the conclusions that frequent in-person contact predicts individual well-being and that large/diverse networks predict broader societal well-being. Individuals of lower socioeconomic status (SES) and societies with lower levels of overall prosperity have higher rates of in-person contact. Internet use is associated with higher in-person contact for the socioeconomically advantaged but lower rates of in-person contact for the disadvantaged. In-person and ICT-based contact is generally associated with maintaining a larger network, but in societies of lower well-being frequent interaction impedes the ability to maintain a large network. In contrast to the positive relationship between individual SES and network size, societal prosperity has a negative relationship to network size. Findings are discussed in relation to social support, democratic engagement, and the digital divide.","",""
"2013","EXPLORING YOUNG PEOPLE'S USE OF SOCIAL NETWORKING SITES AND DIGITAL MEDIA IN THE INTERNET SAFETY CONTEXT","This paper explores young people's use of digital media focusing upon the use of social networking sites (SNS) as a means of networking and communication in the context of internet safety. It also considers cultural and gender differences in the use of the medium. It draws upon recent research conducted by the authors in the UK in 20091 and in the Kingdom of Bahrain in 20102 (the first large-scale research study on young people and internet usage to be conducted in a country in the Middle East). A similar methodological approach was adopted in both studies, which included large random, stratified samples of young people aged 12–18 and focus groups with children aged 7 plus. Both studies investigated internet usage and online behaviours, definitions of risk, awareness of safety and use of SNS. In total, approximately 4,500 young people participated in the research, along with teachers, stakeholders and adults. Findings suggest that young people use digital media in much the same way regardless of the social and cultural contexts, but that culturally gendered perspectives place restrictions upon usage.","",""
"2013","The Implications of Social Capital for the Digital Divides in America","The existing literature is oriented toward examining how Internet access and use may affect social capital. The role of social capital in narrowing the digital divides has been frequently mentioned but few studies have empirically examined how various types of social capital may affect people's access and use of the Internet. Drawing on a two-wave national panel data set, this article aims to fill this gap. Results demonstrate that social capital facilitates Internet access and use. In particular resource-rich bonding social capital helps overcome the digital divides in access, general use, and online communication. Before the Internet can revitalize social capital, there must be the right social capital in place to close the digital divides. Highlighting the relationship between social connectivity and digital connectivity, the findings have important implications for policymakers and practitioners.","",""
"2013","Friendship and trust in the social surveillance network","This article draws on findings from semi-structured interviews to investigate an important, and previously unexplored aspect of the social networking site Twitter, which is the ways that users can employ lateral surveillance to initiate friendships.  Social penetration theory (Altman and Taylor 1973) is used to investigate the ways that Twitter provides a platform to technologically augment friendship evolution.  Three consecutive phases of online surveillance are proposed, which are: unidirectional ‘studied’ following; ‘reciprocal’ following, when interaction between the user and the Tweeter only occurs online; and fully fledged friendship, when online relations are supplemented by offline meetings.  The visibility of users via their Tweets creates information that others can use to evaluate character in what might be considered a phase of pre-friendship screening, and that this also generates trust and solidarity prior to an offline meeting. Perceived similarity between the user and the Tweeter was contributory to an assessment of their worth as a potential friend.  Geographic proximity and ‘transferable trust’ were also factors that helped offline friendship to develop. Ultimately, Twitter was an important tool for sociality, and provided a wider source of potential friends than was available offline.","",""
"2013","Scientists’ use of social media: The case of researchers at the University of the Philippines Los Baños","Using proportional random sampling, 86 researchers working at the University of the Philippines Los Baños (UPLB) were chosen as respondents of a survey study that aimed to determine scientists’ perceptions and use of social media for research. The study also investigated the influence of several factors — age, awareness, Internet connectivity, research style, and technology adoption behavior — on the scientists’ use of social media in research and research–related activities. Results showed that age, connectivity, research style, and technology adoption behavior did not influence the use of social media by UPLB scientists in research. The study also found age to be correlated to factors such as connectivity, research style and awareness of social media. On the other hand, the researcher’s connectivity and broad discipline were found to be correlated to his or her awareness of social media tools. In conclusion, awareness of social media tools roughly translated into actual use of social media in research. In spite of this, a considerable gap exists between awareness and actual use of social media in research by UPLB researchers. In terms of policy, it is suggested that the university administration take a hard look at the benefits and tradeoffs of integrating the use of social media in various aspects of instruction, research, and extension. A social media use policy should be carefully crafted and appended to the University’s existing acceptable use policy for Internet resources.","",""
"2013","Understanding the role of social media in online health: A global perspective on online social support","Around the globe, people are increasingly using social media for the provision of online social support. Online social support may be especially relevant for parents who have children that are afflicted with rare chronic diseases such as MECP2 Duplication Syndrome. Despite increasing evidence that online social support enhances a person’s psychological well-being, there is little research that seeks to understand how and why various forms of social media facilitate social support. This study develops a theoretical framework from the existing psychosocial and media theories that describes the relationship between social media and social support. This paper concludes with implications for health information systems design.","",""
"2013","Does social networking service usage mediate the association between smartphone usage and social capital?"," This study examined the effect of smartphone and social networking service (SNS) usage on various aspects of social capital, including trust, organizational participation, political participation, and network resources. The study further examined whether SNS usage moderates the relationship between smartphones and social capital. A cross-sectional survey data ( N = 339) from a random sample of university students was gathered. The results demonstrated that smartphone and SNS usage have direct effects on all social capital dimensions. In addition, the intensity of smartphone usage has an indirect effect on various social capital dimensions, except organizational participation. These results provide evidence that smartphone and SNS usage is not intrinsically harmful to one’s social capital and may in fact broaden social capital among its users. ","",""
"2013","‘There’s a network out there you might as well tap’: Exploring the benefits of and barriers to exchanging informational and support-based resources on Facebook"," Research has established a positive relationship between Facebook use and perceptions of social capital, a construct that describes the total resources − both potential and actual − available in one’s social network. However, the process through which social capital conversions occur is unclear. This study presents results from semi-structured interviews with 18 adult Facebook users (ages 25 to 55) about their Facebook use, focusing on how participants use the site to request and provide social support (associated with bonding social capital) and information (associated with bridging social capital). Findings describe how Facebook use facilitates interactions related to social capital and users’ beliefs about the potential negative outcomes of these interactions, providing insight into how users negotiate potential benefits and risks when making decisions about site use. ","",""
"2013","Media refusal and conspicuous non-consumption: The performative and political dimensions of Facebook abstention"," This paper is a study of consumer resistance among active abstainers of the Facebook social network site. I analyze the discourses invoked by individuals who consciously choose to abstain from participation on the ubiquitous Facebook platform. This discourse analysis draws from approximately 100 web and print publications from 2006 to early 2012, as well as personal interviews conducted with 20 Facebook abstainers. I conceptualize Facebook abstention as a performative mode of resistance, which must be understood within the context of a neoliberal consumer culture, in which subjects are empowered to act through consumption choices – or in this case non-consumption choices – and through the public display of those choices. I argue that such public displays are always at risk of misinterpretation due to the dominant discursive frameworks through which abstention is given meaning. This paper gives particular attention to the ways in which connotations of taste and distinction are invoked by refusers through their conspicuous displays of non-consumption. This has the effect of framing refusal as a performance of elitism, which may work against observers interpreting conscientious refusal as a persuasive and emulable practice of critique. The implication of this is that refusal is a limited tactic of political engagement where media platforms are concerned. ","",""
"2013","The Friendship Assemblage"," In an age in which social networking sites have become the preferred way of socializing online, the question of how to think about the contours of friendship in and through these mediated spaces becomes all the more important. In contrast to much existing research on online friendship, this article takes on a software-sensitive approach. Through a close reading of various sociotechnical processes in which friendship is activated on Facebook (i.e., registering, making a profile, finding friends, communicating, etc.), this article suggests that friendships online need to be understood as a gathering of heterogeneous elements that include both humans and nonhumans. Moreover, this article attempts to show how the traditional notion of friendship as something created between equals and free of structural constraints does not apply to the realm of social networking sites, where software increasingly assists users in making certain choices about who will and who will not be their friends. ","",""
"2013","The Martini Effect and Social Networking Sites: Early adolescents, mobile social networking and connectedness to friends"," The Martini Effect refers to being constantly connected to people through mobile devices; research into mobile phone use reports that its use may be related to feelings of connectedness. Social Networking Sites (SNSs) are becoming increasingly popular among early adolescents with the majority using them to stay in contact with existing friends. In addition, many adolescents use a range of mobile devices to access these sites. The present study compared feelings of belonging to the friendship group between SNS users who used a mobile device and those who did not. A self-report questionnaire was completed by 337 early adolescent SNS users (11–13 years, mean age = 12.28 years, SD = 0.73). Mobile device users were found to have significantly higher levels of belonging than non-mobile device users and this relationship was partially mediated by the frequency of use of SNSs. It is suggested that these mobile devices not only afford an opportunity for increased use of SNSs and therefore increased interaction with friends but that mobile device SNS users feel constantly connected to their friends. ","",""
"2014","Enacted Social Support on Social Media and Subjective Well-being","This study examines supportive interactions on Facebook to understand the role of social media use in obtaining social support and promoting psychological well-being. By assessing the amount of social support received through Facebook and by other means, this study ascertains a direct relationship between Facebook use and social support reception. Facebook use was the strongest predictor of social support reception, even stronger than the number of strong ties, although its link to life satisfaction was not significant. Findings also demonstrated that gender difference in social support reception was not found in the context of social media and that fixed Internet use had a negative association with life satisfaction, whereas mobile Internet use had no such relationship.","",""
"2014","Will Social Media Use Reduce Relative Deprivation?: Systematic Analysis of Social Capital’s Mediating Effects of Connecting Social Media Use with Relative Deprivation","This study aimed at examining the relationship between social media use, communication with influential others, social capital, and relative deprivation. It examined the roles of two main variables—communication with influential others and social capital—for mediating social media use and relative deprivation. For this examination, a path model was tested through structural equation modeling (SEM). SEM results indicated that communication with influential others significantly and positively mediated the relationship between social media use and social capital—personal network and personal trust. Moreover, it could be found that social capital significantly reduced relative deprivation. These results indicate the considerable role of social media for reducing relative deprivation, helping the resolution of social problems related to relative deprivation.","",""
