"year","title","abstract","journal","doi"
"2007","Gradations in digital inclusion: children, young people and the digital divide"," Little academic and policy attention has addressed the `digital divide' among children and young people. This article analyses findings from a national survey of UK 9—19-year-olds that reveal inequalities by age, gender and socioeconomic status in relation to their quality of access to and use of the internet. Since both the extent of use and the reasons for low- and non-use of the internet vary by age, a different explanation for the digital divide is required for children compared with adults. Looking beyond the idea of a binary divide, we propose instead a continuum of digital inclusion. Gradations in frequency of internet use (from non and low users through to weekly and daily users) are found to map onto a progression in the take-up of online opportunities among young people (from basic through moderate to broad and then all-round users), thus beginning to explain why differences in internet use matter, contributing to inclusion and exclusion. Demographic, use and expertise variables are all shown to play a role in accounting for variations in the breadth and depth of internet use. ","",""
"2008","Modeling information equality : social and media latency effects on information diffusion","In this study, we build and test a stochastic, agent-based model of  diffusion, called dFusion. The model incorporates diffusion research and social network analysis into a framework that is consistent with the findings of digital divide and knowledge gap research. Using three separate real-world data sets, our model demonstrates clear causal relationships between social structure, communication network structure, and the degree of information equality (relatively equivalent speed of access to salient information) within a given social network. By focusing on differential, rather than absolute, speed of access to information, we hope to create an evaluative framework for  technology investment that accurately and comprehensively predicts the effects of such interventions on social equality.","",""
"2008","DIGITAL TASTES: Social class and young people's technology use","Informed by Bourdieu's notions of habitus and taste, and Raymond Williams' notion of cultural form, this article considers the relationship between young people's use of technology and social class. Drawing on the findings of case studies of 25 Australian 15-year-olds, the article suggests that there is a strong link between technology use and class. We argue that markers of class such as parents' level of education and occupation inform the habitus of young people which, in turn, influences their digital tastes. The case studies set out to explore young people's digital communication practices at home and in school. The findings show the importance of habitus in young people's engagement with and interest in digital technologies. We found that new experiences, objects, actions and accomplishments using digital technologies were accepted as valuable or rejected depending on how well they fit with already existing thoughts and processes incorporated into the young people's habitus. Apart from common teenage interests such as music, young people's tastes are influenced by their social background. For schools to equip young people with the skills to participate and communicate in an increasingly digital world, an expansion in ICT resources is not the sole solution. The article concludes that the link between cultural capital, habitus and cultural form produces a socially entrenched digital inequality rather than an economically entrenched digital divide.","",""
"2008","Consumer Benefits of Public Services Over FTTH in Japan: Comparative Analysis of Provincial and Urban Areas by Using Discrete Choice Experiment","As the rapid development of broadband Internet access services continues, particularly fiber to the home (FTTH) services, the digital divide between provincial and urban areas is becoming a big social issue in Japan. We classify the issue into two problems: access to high-speed Internet, and service utilization of high-speed Internet access. We focus on the latter problem by quantitatively and qualitatively investigating whether a digital divide problem exists based on Internet service utilization. Consequently, we discover that willingness to pay (WTP) for public services over FTTH is almost identical between provincial and urban areas. Furthermore, territorial digital broadcasting over FTTH accounts for a large part of WTP in provincial areas, while tele-working and tele-education are also important as public services over FTTH in urban areas.","",""
"2008","Digital Divide Complacency: Misconceptions and Dangers","In the United States an intense debate has taken place between those wishing to minimize the digital divide and others who are skeptical of this view. In regard to the global digital divide, by contrast, although a similar type of complacency can be found, it has not yet been seriously debated. This article, accordingly, hopes to initiate such a discussion. It attacks the notions that information technology can be easily compared with the earlier diffusion of consumer durable goods, that the divide can be made to disappear by redefining the issue, and that the global divide can be analyzed without the help of basic knowledge from fields such as innovation studies, technology and development, and the diffusion of process innovations.","",""
"2008","The young and techless? Investigating internet use and problem-solving behaviors of young adults in Singapore"," This article critically examines the technologically-savvy image of young adults by investigating the digital divide issues underlying youth internet use, including their daily computer and internet problem-solving behaviors. The study draws on data from a web-based questionnaire and face-to-face interviews with young adults in Singapore, a country where internet adoption is pervasive. Contrary to popular conceptualizations of youths as a cohort of technically-savvy experts, the findings showed considerable variance in their internet expertise and problem-solving behaviors, with some demonstrating limited knowledge of internet use and awareness of troubleshooting strategies. The analyses also showed that internet skills and self-efficacy in internet-related problem-solving behaviors were significantly related to the internet practices of young adults. The findings suggest that in wired contexts, variations in post-adoption patterns may reflect more accurately the extent and presence of social stratification, extending the meaning and scope of the digital divide. ","",""
"2008","The digital divide and the theory of optimal slack"," The digital divide and exclusion from the knowledge society have become important subjects of government policy. This article compares online communities located in two UK housing estates. Both have relatively high levels of computer literacy but also significant numbers of novices and non-users. It is argued that one estate is achieving a higher level of inclusion because it combines teamwork with optimal levels of organizational slack. Further, this article discusses the optimal conditions for creating an information and communication technology (ICT) learning community and hence contribute to the debate on how best to overcome the digital divide. The possible implications of the findings are explored in terms of policy initiatives. ","",""
"2009","SOCIAL ATTITUDE DIFFERENCES BETWEEN INTERNET USERS AND NON-USERS","As more survey and opinion polling agencies collect their data using the Internet, questions arise about how representative Internet users are of the American population as a whole. We use a targeted module of IT-relevant questions added to the 2000, 2002, 2004 and 2006 samples in the General Social Survey (GSS) to analyze differences between Internet users and non-users. We devote particular attention to the issue of whether Internet use is associated with more or less diverse or ‘liberal’ political opinions and to how these associations have changed since 2000. In general, we found that where differences existed, they were in the direction of Internet users being more supportive of diverse and tolerant points of view than were non-users, consistent with the premise that going online is a way of expressing openness to opposing points of view and new experiences. However, the differences were often non-monotonic – that is, openness did not always increase progressively with the amount of Internet use. Moreover, there were differences for some racial/family/sexual/political attitudes but not others, in patterns that do not fit easily under standard labels such as liberal, conservative or even libertarian. Internet users also expressed slightly more optimistic and sociable attitudes on certain other GSS questions. On most GSS items, however, either there were no differences between Internet users and non-users, or the differences could be explained by age, education, race, gender or income factors. Thus, respondents in Internet surveys can be expected to differ from non-Internet respondents in being selectively more tolerant on certain political issues, but not on most other political issues. The results held about as strongly in 2006 as in 2000. †Revision of paper presented at the August 2008 meetings of the American Sociological Association, Boston.","",""
"2009","A TASTE FOR THE NECESSARY","While American teenagers are often presumed to be uniformly ‘wired’, in reality, segments of the youth population lack high-quality, high-autonomy internet access. Taking a uniquely holistic approach that situates new media use within respondents’ larger lifeworlds, this study examines the effects of digital inequality on economically disadvantaged American youth. Analyzing primary survey and interview data, findings reveal the roles played by spatial‐temporal constraints and emotional costs in creating disparities in usage and skills among differently situated respondents. A close examination of the interview material discloses a dramatic divergence in the informational orientation or habitus internalized by respondents with more- and less-constrained internet access. Drawing on Bourdieu's concept of skholè, the work outlines the differences between the playful or exploratory stance adopted by those with high-quality internet access and the task-oriented stance assumed by those with low-quality internet access. Analysis reveals that those with low-autonomy, low-quality access enact a ‘taste for the necessary’ in their rationing of internet use to avoid what they perceive as ‘wasteful’ activities with no immediate payoff. The article closes with an eye to developing a theory of information habitus, a potentially invaluable concept in future research on digital inequality.","",""
"2009","Digital Divide: A Discursive Move Away from the Real Inequities","Within the context of the telecommunications policy environment in the United States during the 1990s, the Department of Commerce's Falling Through the Net reports can be read as a 7-year ideological project to legitimize U.S. government's deregulatory policies. This article analyzes the “digital divide” as rhetorical trope in a neoliberal ideology, which placed responsibility for social and economic success in the emerging global information economy at the level of the individual and not the system, effectively foreclosing on any class-based analyses of the problems associated with the transition from a Keynesian welfare state and industrial economy to a neoliberal and globalized information economy. Unpacking the discursive significance of the “digital divide,” with special focus on public libraries and projects of the Gates Foundation, illuminates how it foreclosed on the possibility of alternative problem definitions by making the problem a technical and administrative one rather than an issue of historic class struggle. The article draws on open-source projects in developing countries to offer an alternate frame for formulating policies for equitable access to information and communication technologies (ICTs).","",""
"2010","DIVIDING LINES","Using 2007 data from the Pew Research Center's Internet and American Life Project, this study poses the question: ‘What are distinct groups within the African-American population with respect to technology ownership and Internet activity?’ Several findings are reported. Factor analysis reveals a structure of technology preferences for African-Americans. For the consumption of technology, two broad preferences present themselves: mainly consuming portable, ‘mobile technologies’ or mainly consuming ‘home technologies’. For Internet activity, the authors identify three preferences: a preference for youth-oriented Internet activity, information-oriented activity, or a preference for adult-oriented activity. Using classification and regression tree analysis, six distinct groups within the population present themselves, with education being the most important variable in creating these groups. The six groups vary widely on their technology and Internet preferences, suggesting that future research focusing on differences within the African-American population is needed.","",""
"2010","THEORIZING DIGITAL AND URBAN INEQUALITIES","Contemporary research on disparities in access to and use of information and communication technologies (ICTs) – what is commonly referred to as the digital divide – is limited in terms of its ability to explain the interrelationships between digital and urban inequalities. Drawing upon critical geographical conceptualizations of the relationships between power, place, and scale, and a Bourdieusian conceptualization of technological and social capital, this article proposes a model of the interconnections between urban and digital inequalities from the vantage point of the everyday experiences of economically marginalized urban residents in the United States. On the basis of this model, the author suggests a future research agenda that examines the empowerment or disempowerment of people related to ICTs in relation to their own frameworks for ICT use; how technological capacity is related to technological and social capital embedded in particular places; and how technical capacity is developed across multiple spaces and multiple arenas situated in a broader analysis of inequality.","",""
"2010","Weaving Networks: An Educational Project for Digital Inclusion","In this article, the authors describe the development of a digital training project aimed at groups at risk of social exclusion in the community of Cantabria, Spain. This project is in keeping with national and international policies—especially those designed by the European Union—that seek to develop an information society accessible for all citizens. They describe the results of two-and-one-half years of training activities that aim to bring certain social groups into closer contact with information and communication technology (ICT). Although the training program is based on the notion that access to technologies, as well as certain uses that can be made of them, is linked to digital and social inclusion, the authors try to avoid what some have called myths and mistaken beliefs surrounding ICT, especially the idea that more and better technology necessarily produces a society that is more in touch, more socially committed, more just, and more democratic. They believe that the ideas and dilemmas that have arisen as a result of the design, development, and assessment of the digital training project can cast light on the meaning of teaching “with,” “from,” and “based on” ICT.","",""
"2010","Putting Digital Literacy in Practice: How Schools Contribute to Digital Inclusion in the Network Society","In the sociology of childhood and youth, children have been conceptualized as passive subjects on hold, still in the process of becoming—rather than in an effective state of being. In effect, children have been conceptualized as the subjects rather than the objects of the research process. This influence got carried over to digital divide research. The latest thinking in the field has started to define and understand children and young people as heterogeneous, nonpassive, autonomous, diverse, and versatile agents actively appropriating the Internet in meaningful contexts of their everyday lives. This article seeks to move the discourse forward via four parallel binary logistic regressions that assess diverse and socially mediated opportunities needed to learn basic digital skills from a representative sample of 6,602 primary and secondary students from 350 schools and high schools in Catalonia, Spain. Our research shows that the school appears to be playing a secondary role, as compared with children and young people's social practice in heterogenic contexts of everyday life, not only for Internet training but also for providing opportunities to develop and master basic digital skills.","",""
"2010","The internet in everyday life: a typology of internet users","This study focuses on those factors that determine internet usage. How can differences in use be explained, and what factors influence the relevance the various web applications have for the individual? This article argues that the increasing diffusion of the internet has by no means closed the digital divide within society (Roe, 2006): the differences have merely shifted from disparity in internet access to disparity in the quality of its usage (Hargittai and Hinnant, 2008). The concept of digital inequalities assumes that different patterns of internet use influence the life chances of a user: the more capital he/she can accumulate using the internet, the more he/she benefits from web use (Zillien and Hargittai, 2009). Until now, research on the digital divide has operationalized capital-enhancing activities using demographic variables (van Dijk, 2006). As an alternative, we suggest using the habitus–capital theory of Bourdieu as a theoretical background to answer the question regarding which kinds of capital the internet users gain online and which factors influence the patterns of usage. These patterns are not only influenced by user age, but also by social position, gender and job status, and can only be assessed in the context of everyday life (Roe, 2006). The present study is based on in-depth interviews (basis: Germans aged 14 years and older), because the practical sense that users assign to the internet is more readily observable when their background, daily routines and media repertoire (and therefore functional alternatives) are well known. The sample of 102 interviewees was selected Media, Culture & Society © The Author(s) 2010, Reprints and permissions:","",""
"2010","The digital divide in Internet information searching:  A double-hurdle model analysis of household data from Vermont","While most studies on the digital divide in the United States focus on disparities in access to computers and the Internet, this study examines the digital divide in Internet information searching. With data from 476 Vermont households surveyed in 2009, a double-hurdle model is used to identify the factors that impact the likelihood and frequency of using the Internet for information searching. Empirical results suggest that there are significant disparities in both the likelihood and frequency of online information searching in Vermont and that these disparities are closely associated with several socioeconomic and demographic factors such as education level, income, and age. Also, the impacts of some variables on the likelihood to use the Internet are different from their impacts on the frequency of using the Internet for information searching. These research findings are expected to be useful when developing programs and policies for reducing the digital divide.","",""
"2010","Group differences in attitudes towards technology among Americans"," What are the key indicators determining groups’ attitudes towards the use of ICT in the United States? Nationally representative data from the Pew Internet and American Life Project ( N = 4100) were used to address this question. This research found that (1) the most salient divider in the American population with respect to attitudes towards ICT is education; (2) the two social groups reporting the highest levels of social improvement were respondents under the age of 30, and older African-Americans with low educational levels; (3) higher income but lower educated respondents who are over 30 and are not African-Americans report relatively low levels of social improvement. In effect, the population surveyed was stratified based upon their attitudes about ICT use in their everyday life. This stratification system is clearly of a different nature than our past understanding of haves and have-nots based upon ICT access. ","",""
"2010","The digital identity divide: how technology knowledge impacts college students"," This article embraces the concept of technology identity as an innovative theoretical and methodological approach to study the digital divide. Reporting on qualitative data taken from a mixed-method study, the analytical approach goes beyond an access and skills perspective in measuring digital inequities. Narratives collected from students demonstrate how powerful sociocultural influences, such as family practices and access to a quality K-12 education, contribute to the development of a technology identity. The stories outlined in this article offer illustrative accounts of how holding a particular technology identity impacts the academic and social life of college students. Taken together, the narratives highlight the role of schools and universities as institutions which are perpetuating — rather than resisting — inequalities associated with the digital divide. ","",""
"2010","How to become a sophisticated user: a two-dimensional approach to e-literacy"," The internet media require the development of new user skills not required by the traditional media. Current European initiatives focus on providing access to a PC with internet and ensuring basic usage skills to address the digital divide, while media competence is of less importance. Although access rates in European countries are quite high, this study finds persistent rates of non-users, because access and basic skills alone do not guarantee usage. The article presents a representative survey carried out in Austria in 2007 ( N = 529) which illustrates the full spectrum of internet usage and its determinants, employing a typology developed by the authors. In addition to the continuing influence of sociodemographics on usage behaviour, location of access is shown to be an important influence on skills development. Furthermore, deficits in digital literacy can often be compensated by social support, given either in the form of emotional support during learning, or in the form of technical support. The authors conclude that to become a sophisticated user, however, requires guidance beyond merely attending computer classes or the assistance of relatives, colleagues, or friends, but is also a societal issue, if the goal of universal participation and integration is to be achieved. ","",""
"2011","ETHNIC DIFFERENCES IN INTERNET ACCESS","Internet adoption has expanded rapidly in recent years and its use is been associated with the formation of social networks, the accumulation of social capital and a wage premium. Thus, lack of Internet access might reflect and even enlarge existing social inequalities. Considering the need for a better understanding of Internet inaccessibility, we investigated differences in access in relation to ethnicity. Presumably, in deeply divided societies, with a partial but significant overlap between ethnicity and the occupational structure, disadvantaged minorities lack digital access as they are concentrated in occupations that are not exposed to computers and the Internet. The hypotheses were tested with a representative sample of the Israeli population, a society deeply divided according to ethnic lines. Israeli Arabs proved less likely to have access to the Internet because they are concentrated in blue-collar occupations that do not involve work with computers and the Internet. Lack of exposure foments the development of negative attitudes to technology, which presumably deter them from adopting the Internet.","",""
"2011","Are Changes in the Digital Divide Consistent with Global Equality or Inequality?","To answer the question in the title, the author divides a sample of developing countries according to whether they have experienced a rise or fall of the (absolute) digital divide in the Internet. He suggests that in countries where the divide is falling, incomes will tend to be relatively high, and vice versa in the case of a rising divide. This relationship is examined on the basis of simple regression analysis; the analysis indicates the hypothesis is true with a high level of significance. Interpretation of the findings is carried out mainly in relation to countries from Sub-Saharan Africa, Latin America, and the Caribbean. In short, recent changes in the digital divide are associated with global inequality rather than equality, although there are some important anomalies that need to be explained.","",""
