"year","title","abstract","journal","doi"
"2005","Descriptive metadata for copyright status"," The need to express the intellectual property rights of digital materials has focused on access and usage permissions which must be granted by the rights holder. A key set of permissions not acknowledged by these rights expressions is inherent in the legal copyright status of the item. Digital libraries can hold and provide access to many items for which copyright status is the sole governor of use. This article proposes a small set of descriptive data elements that should accompany digital materials to inform potential users of the copyright status of the item.  ","",""
"2005","Engaging the public with digital primary sources: A tri–state online history database and learning center"," This collaborative database project, involving five universities and historical societies in Washington, Oregon, and Idaho, has sought to encourage online researchers to think more deeply about the digitized primary sources featured. The project intended to serve as a model for other institutions that wanted to share collections and stimulate public interest in and use of those collections. This essay focuses on how we incorporated pedagogical elements into the design of the database, and how we have encouraged K–12 teachers and college students to use it. Project ","",""
"2005","Survey of Web–based educational resources in selected U.S. art museums"," Art museums in the United States share a common mission to educate many people — from families to teachers to researchers. But how do these museums use the World Wide Web to extend their educational mission? More specifically, what kinds of educational materials do U.S. art museums offer to online visitors, and how broadly available are such resources across the Web? This study set out to answer these questions and to tie the findings to the contextual model of museum learning. Conclusions are drawn about how museums from the sample fit within a technology adoption curve.  ","",""
"2005","Teaching and Learning with Digital Resources: Web-Wise 2005"," Teaching and Learning with Digital Resources: Web-Wise 2005. Selected papers from the Sixth Annual Conference on Libraries and Museums in the Digital World, sponsored by the U.S. Institute of Museum and Library Services and the University of Illinois at Chicago, 17-18 February 2005 ","",""
"2005","Using digitized primary source materials in the classroom: A Colorado case study"," Using digitized primary source materials with K–12 students makes learning content more engaging and relevant, and helps students develop a wide range of skills. This paper highlights the use of primary source materials in Colorado classrooms and provides a brief overview of what educators’ needs are in order to use digitized primary source materials more efficiently and effectively with students.  ","",""
"2005","Evaluation of digital libraries using snowball sampling"," This article describes how snowball sampling was applied in two different cases to evaluate digital collections. The first digital library was evaluated by conducting in–person interviews with survey participants. For the second digital library, an e–mail survey was mailed to site users. The results are compared and a cost–benefit analysis is provided. The author concludes that the convenience of an e–mail survey is not necessarily the most effective way to survey users.  ","",""
"2005","De–unifying a digital library"," The University of Tasmania decided to explore using a unified digital library for all its research output: journal articles, conference papers, higher degree theses, and other types. This decision is in advance of the state of the Australian national indexing systems. The digital library also uses OAI–PMH protocols for harvesting, which one of the national repositories does not as yet. The paper describes the context, reasons for the University’s decision, consequences and outcomes, and the development of software to talk to the Australian Digital Theses Program.  ","",""
"2005","Project Access for adult English–language learners"," Project Access, funded by the Institute of Museum and Library Services, is a collaborative two–year program between the Frist Center for the Visual Arts and the Nashville Public Library. The goal of Project Access is to help increase adult English Language learners’ (ELL) skills in language, visual art, and computer literacy. The eight–visit program offers participants from local community service institutions the opportunity to engage in art making, computer–based learning, museum and library visits. This article and the project Web site, http://www.projectaccess.org, give the visitor an overview of the project, lesson plans, and interactive features.  ","",""
"2005","From libraries to ‘libratories’"," While the eighties of the last century were a time of local automation for libraries and the nineties the decade in which libraries embraced the Internet and the Web, now is the age in which the big search engines and institutional repositories are gaining a firm footing. This heralds a new era in both the evolution of scholarly communication and its agencies themselves, i.e. the libraries.  Until now libraries and publishers have developed a digital variant of existing processes and products, i.e. catalogues posted on the Web, scanned copies of articles, e–mail notification about acquisitions or expired lending periods, or traditional journals in a digital jacket. However, the new OAI repositories and services based upon them have given rise to entirely new processes and products, libraries transforming themselves into partners in setting up virtual learning environments, building an institution’s digital showcase, maintaining academics’ personal Web sites, designing refereed portals and — further into the future — taking part in organising virtual research environments or collaboratories. Libraries are set to metamorphose into ‘libratories’, an imaginary word to express their combined functions of library, repository and collaboratory. In such environments scholarly communication will be liberated from its current copyright bridle while its coverage will be both broader — including primary data, audiovisuals and dynamic models — and deeper, with cross–disciplinary analyses of methodologies and applications of instruments. Universities will make it compulsory to store in their institutional repositories the results of research conducted within their walls for purposes of academic reporting, review committees, and other modes of clarification and explanation. Big search engines will provide access to this profusion of information and organise its mass customization.  ","",""
"2006","Disciplining Search/Searching Disciplines: Perspectives from Academic Communities on Metasearch Quality Indicators","“Quality Metrics” is an IMLS–funded research project which aims to address longstanding deficits in the formal conceptual support for and development of scholarly digital libraries. Central to attaining these goals is collecting and analyzing feedback from stakeholders in the scholarly community about the efficacy and value of key aspects of search technologies; including search interfaces, modalities, and results displays. A team at Emory University conducted this foundational research by utilizing the qualitative methodology of focus groups. In addition to an initial set of exploratory focus groups, the team conducted a second round of focus group sessions with a protoype search system specially designed for scholarly digital libraries. This paper describes the concept, objectives, methodology, and findings of the focus groups component of the Quality Metrics Project.","",""
"2006","Machine-assisted Metadata Generation and New Resource Discovery: Software and Services","Research and other libraries are priceless given that they hold, organize and provide sensible, generally open, access to many of the treasures of knowledge of our species. Especially when mass media, popular culture and/or governmental information flows fail in making available the objective and relevant information needed to enable us to make informed decisions about our lives, businesses or planet, libraries usually will provide the information needed. As both a first and last refuge for knowledge, libraries could come to play an increasingly expansive and critical role in society, given this need, if we can develop and better keep pace with the expanding role of technology in scholarly and educational communication and information access. Librarians and the technological directions we choose to develop and/or follow are more important, on a societal scale, than most us think. Libraries and related services are not inexpensive to develop and maintain, though, and, with the information boom that both preceded (in print resources) and continues to follow the advent of the Web (in both print and digital resources), are not keeping up with the large numbers of significant information resources being produced. Therefore an important contribution to help enable libraries work better and have more impact on a more expansive scale is the development and judicious use of machine–assistance related software, technologies and services which amplify collection building expertise in library collection building. Discussed in this article are two projects in this area.","",""
"2006","Getting the Word Out: Making Digital Project Metadata Available to Aggregators","Digital projects managed by traditional libraries have tended to follow the “exhibit” model, with an expectation that Web search engines are the best and only way to attract users to available resources. The development of aggregations based on OAI–PMH provides another avenue for libraries and museums to use to market their resources to users who might not discover their resources using individual portals.","",""
"2006","Moving towards shareable metadata","A focus of digital libraries, particularly since the advent of the Open Archives Initiative Protocol for Metadata Harvesting, is aggregating from multiple collections metadata describing digital content. However, the quality and interoperability of the metadata often prevents such aggregations from offering much more than very simple search and discovery services. Shareable metadata is metadata which can be understood and used outside of its local environment by aggregators to provide more advanced services. This paper describes shareable metadata, its characteristics, and its importance to digital library development, as well as barriers and challenges to its implementation.","",""
"2006","Advances in Discovery: The Electronic Cultural Atlas Initiative Experience","The Electronic Cultural Atlas Initiative was founded in 1997 by a group of scholars with a mission to advance education and research in the humanities and social sciences through increased attention to time and place. Knowing about context forms the basis for discovery and understanding. Our recent emphasis has been on developing a metadata infrastructure for the four facets What, Where, When and Who, each of which has special characteristics and display requirements, to advance discovery. WHAT requires thesauri of topics and tools to explore cross references within and between thesauri. WHERE needs place name gazetteers and map displays. Similarly, for WHEN we developed a directory that connects named time periods with calendar dates and a timeline or chronology. WHO requires best practices and standards for encoding the events in people’s lives, for contextualizing those events, and for displaying interpersonal relationships.","",""
"2007","The Florida folklike digitization and education project","The State Library and Archives of Florida’s Florida Folklife Digitization and Education Project was a two–year IMLS–funded project intended to enhance access to the Florida Folklife Collection, to develop educational resources based on the Collection, and to make these cultural and educational resources accessible to lifelong learners on the Florida Memory Project Web site at http://www.floridamemory.com.","",""
"2007","Metadata for all: Descriptive standards and metadata sharing across libraries, archives and museums","Integrating digital content from libraries, archives and museums represents a persistent challenge. While the history of standards development is rife with examples of cross-community experimentation, in the end, libraries, archives and museums have developed parallel descriptive strategies for cataloguing the materials in their custody. Applying in particular data content standards by material type, and not by community affiliation, could lead to greater data interoperability within the cultural heritage community.  In making this argument, the article demystifies metadata by defining and categorizing types of standards, provides a brief historical overview of the rise of descriptive standards in museums, libraries and archives, and considers the current tensions and ambitions in making descriptive practice more economic [1].","",""
"2007","The library: A distinct local voice?","Librarians collaborating with their patrons and using technology to tap deeper into the reservoirs of local knowledge within their communities? Creating and becoming active participants in locally-focused online communities, blogs and wikis? Leveraging local search engines and creating their own customized locally-focused search engines? Libraries mapping information relevant to their communities? The librarian as local expert specializing in the hyper-local content not captured elsewhere? It may not be the norm, but it’s already happening. This paper examines the library’s place as a local information provider — highlighting local activities that libraries are currently involved in and suggesting some ways that libraries can become better recognized as places to turn for local information. The convergence of a few factors make this topic timely: Libraries are well-positioned as community-focused institutions that have a history of helping preserve, organize and promote access to local information. The importance of and demand for local information seems to be growing. The Internet is becoming more “place-conscious,” enabling improved ways for disseminating and accessing local information.","",""
"2007","Collaboration and the cyberinfrastructure: Academic collaboration with museums and libraries in the digital era","This talk, which was presented at the 2007 WebWise conference in Washington, DC, argues for the importance of collaboration between scholars in the humanities and museums, libraries, and archives, especially in the digital era. It is illustrated with examples drawn from the work of the Center for History and New Media, which the author directs.","",""
"2007","Defining digital stewardship in the digital age","The 2007 WebWise Conference on “Stewardship in the Digital Age” brought together over 40 speakers to explore the issues of preserving and accessing cultural heritage in digital form. The following article summarizes the conference presentations, prevailing themes, and challenges that remain, and suggests that digitization forces us to rethink assumptions about preservation and access in the context of cultural stewardship.","",""
"2007","Visible Past: Learning and discovering in real and virtual space and time","Visible Past proposes a cross platform, scalable environment (Exploratorium) for collaborative social, geographic, and historical education and research. The Exploratorium will be deployed in a variety of settings, from Web to fully immersive virtual reality environments. Educational activities can be formal (classroom teaching) or informal (conducted in a museum or self–directed online learning setting). The specific goals of the Exploratorium concept are two–fold: 1) to create a set of tools for collecting, organizing, or disseminating knowledge in a collaborative manner at various scales and in various formats; and, 2) to extend and refine a theoretical framework and methodological tools for prototyping and testing future research and learning applications and architectures that benefit from 3D and location aware applications. The heart of the Visible Past Exploratorium concept, the Exploratorium, is an information space built on top of a georeferenced wiki database that can be accessed through a variety of avenues: full immersion 3D environments, Web interfaces, or Geographic Exploration Systems (GES), such as Google Earth or NASA’s World Wind.","",""
"2007","Digitizing for access and preservation strategies of the Library of Congress","Our time’s digital information revolution makes being a librarian exciting. The Library of Congress, like others, is exploring new ways of using digital technology for both access and preservation. This work, and the excitement, will grow as the library completes moving its audio–visual resources into its new National Audiovisual Collection Center. The library hopes to share new developments and work with others in meeting the challenges of the digital information era.","",""
"2007","The Health Heritage Index findings on digital collections","The Heritage Health Index, the first comprehensive survey of the condition of U.S. collections, concluded that immediate action is needed to save millions of artifacts held by archives, historical societies, libraries, museums, and archaeological and scientific research organizations. The study, conducted by Heritage Preservation in partnership with the Institute of Museum and Library Services, revealed new and compelling data on the preservation needs of digital materials. While the recommendations of A Public at Risk: The Heritage Health Index Report on the State of America’s Collections (http://www.heritagepreservation.org/HHI/summary.html) apply to all types of collections, the extensive dissemination and publicity that the study has received makes it an effective advocacy tool for digital preservation.","",""
