"year","title","abstract","journal","doi"
"2016","Crowdsourcing the curriculum: Redefining e-learning practices through peer-generated approaches","ABSTRACT Inclusion of open resources that employ a peer-generated approach is changing who learns what, from whom, and via what means. With these changes, there is a shift in responsibilities from the course designer to motivated and self-directed learner-participants. While much research on e-learning has addressed challenges of creating and sustaining participatory environments, the development of massive open online courses calls for new approaches that go beyond the existing research on participatory environments in institutionally defined classes. We decenter institutionally defined classes and broaden the discussion to the literature on the creation of open virtual communities and the operation of open online crowds. We draw on literatures on online organizing, learning science, and emerging educational practice to discuss how collaboration and peer production shape learning and enable “crowdsourcing the curriculum.”","",""
"2016","MOOCs in the humanities"," Massive open online courses (MOOCs) have been heralded as a democratizing force bringing higher education to the world’s neediest students. But do MOOCs effectively confront the well-documented challenges of online education for underprivileged students? This textual analysis examines MOOC offerings in the humanities and finds that courses are designed for relatively well-prepared students, not underprivileged students. ","",""
"2017","What is Happening in Digital Education? The Class and The War on Learning","","",""
"2017","From digital commons to the data-fied urge: Theorising evolving trends in the intersections of digital culture and open education","This paper aims to unravel the interlacing of learning theories and media theories in order to map out how the link between digital culture and open education has been argued in related research and scholarship. Taking into account evolving trends and trajectories in the fields of digital networked technology and education since the 1990s, it argues for the multiple articulations of mediation as a core component in competing discourses about competence formation. These are centred on three evolving and interrelated trends: a) the increased emphasis on computer mediated communication and collaboration as shapers of meaning and improvement; b) the introduction of media logics in particular fields and domains of education; and c) datafication and metrics as means of both self-organization or management and cross-promotional strategies. While several scholars within critical media literacy traditions and critical educational technology have dealt with evolving trends in technology and competing discourses as writing passage from the information to data-driven society, developing a fuller sense of these trajectories can enable us to chart out interconnected threads of power, conflict and subversion that frame learning as a competitive endeavour and reconfigure the expansion of education in broader areas of society.","",""
"2017","Breaking down barriers: The ambivalent nature of technologies in the classroom"," This article provides a critical study of the ambivalent nature of educational technology. Departing from the fact that the contemporary classroom is no longer a bounded and discrete space, the article uses ethnographic participant observation to provide thick descriptions of technologies-in-use at a Danish business college. These observations suggest that educational technologies play much more nuanced roles than hitherto imagined. Building on the notion of spatial imaginaries, the article explores two complementary patterns of spatial relations in the classroom: Educational technologies open a gateway to the world that can be used both to bring relevant information into the space of the classroom (“outside-in”) and to escape educational activities in favor of off-task activity (“inside-out”). By exploring these twin movements, this article hopes not only to provide a glimpse into the 21st-century digitized classroom but also to showcase the uneasy position of educational technology between burden and blessing. ","",""
"2017","Design thinking and<i>imitatio</i>in an educational setting","ABSTRACT Schools are expected to prepare students for the future, providing them with methods for dealing with the emergent world. This article considers how teachers can work with digital productions at primary schools even when they are not acquainted with the new production genres. We propose a methodological framework to assist students and teachers in their exploration of unknown media genres based on a case study. We revive the ancient concept of imitatio and integrate it with contemporary design thinking to support production dynamics that lead to increased digital literacy.","",""
"2017","Getting on the Map: A Case Study in Digital Pedagogy and Undergraduate Crowdsourcing","","",""
"2019","The possibility of enmemberment","Learning in the Age of Digital Freedom, by Petar Jandrić, accomplishes several goals. It brings together 16 diverse and complex voices to discuss human learning at the intersection of technology. It also delves deeply into the layered work of each individual interlocutor while juxtaposing their dialogues collectively to frame a wholistic critical conversation that resounds with collaboration. Finally, it feels important. As a college professor, I step into the classroom several times a week to confront not only the complexities of the teaching task, but also the dilemmas inherent in the changing pedagogical landscape. And, like many progressive educators, I ask: What does freedom in this space mean for every learner (Bialka, 2015)? Which voices are likely to be the most vulnerable as a result of the irrevocable push of outside social forces (Freire, 2010; hooks, 2017), especially in this age of digital reasoning? And which teacher/learners (Cook-Sather & Shore, 2007; Freire, 2010) appear the best positioned to succeed in today’s “knowledge economy”? Critical pedagogy informs my praxis and my political ideology, but, at times, I need both a comforting arm across the shoulder to shepherd me through or a bit of a shove in the backside to move me along. And, as our praxis has taught us, in order to break out of the ideological frameworks that inform our everyday life, we need to dig deeply into critical theory. Jandrić (2017) provides both by weaving a continual dialogue which has at its core the simultaneous goal of informing learning while transgressing disciplinarity. To me, this is the best of all worlds because of the benefits to students, especially with the shifting student demographics toward minoritized, high poverty, and immigrant populations (Noguera, 2017). Although there are numerous critical theoretic and dialogic goals accomplished by the work, the conversations in Learning in the Age of Digital Reason enable educators to explore dynamic teacher/learner dialogism for all students through a lens of enmemberment (Scuro, 2018) which encapsulates both the limitation and possibility of the book.","",""
"2019","PLATFORM PEDAGOGIES: LEARNING, AUTHORISING AND VALIDATING TRUST IN EDUCATION","This panel investigates the pedagogic dimension of digital platforms thus drawing on older theoretical traditions that use pedagogy as a way of describing and explaining the relationships between individual and society, agency and structure (paper 1). We want to explore what it means to conceive of the relationship between people and their platforms as a pedagogic relationship; and how such conceptualisations might advance study of platforms in general (paper 4). Additionally, using the term pedagogy in its more specifically educational sense the panel explores the relationship between learning, schooling and education systems across emerging platforms (papers 2 regarding 8th grade teachers in the US using apps, and paper 3 regarding Australian universities’ learning management systems).&#x0D; Platforms, we argue, standardise and seek to offer a relationship of trust over time with their “citizens”. Platforms working with families, schools or in higher education feed off the authority and trust that pertains between citizens and these institutions. However, the platformisation of education (van Dijck, Poell &amp; de Waal, 2018) may contain other kinds of risks for students and their families, thereby introducing the need for new forms of validation. By thinking about activities in and across a series of platforms in terms of pedagogic relationships, where trust is placed in authority, the panel will explore the mechanisms by which digital interactions take forms of social trust and yet expose people to forms of dataveillance beyond ways that any membership or participation suggests in its initial contract.","",""
"2019","CRITICAL PEDAGOGIES IN INTERNET STUDIES: TEACHING FOR CHANGE","There are urgent reasons for considering whether, as academics, we place our trust in the current system or whether we try to change it. Research offers one pathway towards supporting efforts for positive change, but we should not neglect the potential of our teaching work. Academics within Internet studies have unique possibilities for engaging in critical pedagogies, supporting students in understanding and challenging oppression. I draw here on ten years’ experience teaching in Internet studies, student and peer feedback, and the literature on critical pedagogy and decolonizing academia. I suggest that where possible we reflect on the texts we set students; redesign assessment; considering being vulnerable with students; and challenge restrictive policies and procedures (such as those around late submission of assignments). These approaches rely on trusting students, and on building their trust in us without relying solely on our institutional authority. As a field we need to actively and explicitly discuss how, and what, we teach.","",""
"2019","(Digital) Media as Critical Pedagogy","From chalkboard sites to social media, from smartphones to interactive grading software, there is an overabundance of digital learning tools at our fingertips, many of which float into our classrooms on airy praise from university administrators, politicians, and corporate technicians alike who tout the incorporation of these technologies into our teaching as an undeniably positive step toward the â€œenhancementâ€ of student learning. Rather than promoting a critical model of learning by which students and teachers can explore the matrix of possibilities â€œaffordedâ€ by their relationship to new media, the techno-fetishist instrumentality of â€œtechnology-enhanced learningâ€ functions as an efficient means of materializing neoliberal market ideology and adjusting us to accepting our positions as self-contained users of discrete tools that define for us what the goals and processes of learning will be. It is imperative, then, that we engage ourselves and our students in the critical pedagogical process of learning to learn in conversation with â€“ not at the behest of â€“ media. To do so gets to the very heart of critical pedagogy itself, because, as I argue, the ontological assumptions underwriting the very hope and possibility of critical pedagogy as a political project are nothing if not the essential coordinates for a media theory of being. If we are to determine how to develop a sufficiently critical pedagogy in the age of digital media, we must first re-locate the learning process in the exploration of the open, dialectical circuits between human and world through which life itself is mediated, and from which political change is made possible.   ","",""
"2021","Whose pedagogy is it anyway? Decolonizing the syllabus through a critical embrace of difference"," The higher-education student body in the United States is increasingly diverse. Diversity and transnationalism are present in the classroom through the increased numbers of students and instructors who are international and/or non-White-identifying. However, syllabi in media, communication, and cultural studies remain centered around an orthodox body of literature that has come to be conceived of as the canon, consisting of scholars who are mostly white, male, and U.S.-American or European. This essay brings communication, culture, and media studies theories into conversation with critical pedagogy to suggest changes in the organization of syllabi and class activities. Namely, I use participatory culture, critical and decolonial pedagogical theories, and Black and transnational feminist pedagogy, to suggest a critical embrace of different as an approach for designing syllabi that center the students rather than the Western-rooted tradition. This paper is part of the critical body of knowledge that pushes for a decolonizing and transnationalizing intervention in higher education. ","",""
"2021","OPEN PEDAGOGY: INDEPENDENCE AND INTERDEPENDENCE IN TEACHING ABOUT NEW        MEDIA","In the quest for independence from traditional media constraints, open pedagogy — involving students in the creation of openly licensed materials — offers training in open culture practices alongside deeper learning. Our research builds upon an exploratory study by Hilton et al. (2019). We collected quantitative and qualitative data about the experiences of 85 students participating in an open pedagogy course project: creating content for the open textbook Humans R Social Media (HRSM). We asked students to compare their experiences working on HRSM with traditional learning activities (e.g., writing papers, taking quizzes). About 66% of students said the HRSM project had greater educational value than traditional learning activities. Most students (54.1%) also reported that HRSM helped them master more core academic content, and 51.8% said the project helped them become more collaborative learners. Although a small percentage preferred traditional learning activities, most students reported that open pedagogy’s focus on agency and choice enabled them to share their individuality and creativity. We also found that students valued knowing their work could be shared beyond the classroom; and that publishing, in the words of one student, “gave me more incentive to make sure my assignments were my best product.” This study tentatively reinforces the benefits of independent, hands-on learning as well as collaborative interdependence in an online environment. These findings suggest the active nature of open pedagogy holds rich possibilities for cultivating participatory learning activities, involving students in the creation of knowledge as they learn, and cultivating interdependent connection and community.","",""
"2021","“Smart” Educational Technology:  A Conversation between sava saheli singh, Jade E. Davis, and Chris Gilliard","A conversation about smart technology use in educational settings.","",""
"2021","Crowd science infused learning: Connecting online teaching and crowd science in the social sciences","In this article, we reflect upon the combination of crowd science and online teaching, which we refer to as Crowd Science infused Learning. We discuss Crowd Science infused Learning's conceptual design and its viability in sociology and related disciplines. For this purpose, our research project ‘Data Traces’ serves as an empirical case. In the project, we developed an online platform that provided a 45-minute teaching unit, training students in using different forms of digital data: websites, newspaper articles, and administrative register data. Afterwards, students were assigned to predefined, small-scale research tasks contributing to a real-world research project on the social relations in entrepreneurial groups. By completing the tasks, the students could apply their knowledge, gain insights, and contribute actively to an ongoing research project. This combination links students' learning experience with the collection of data for research purposes. We also implemented game elements in the platform's design to support students' motivation. After a brief outline of the Data Traces Project's chronology and key conceptual decisions, the article focuses on a critical discussion of the combination of crowd science and online teaching. Despite significant challenges, we believe that Crowd Science infused Learning is a promising approach and identify opportunities and conditions for a successful combination of crowd science and online teaching.","",""
"2022","Educational technology: what it is and how it works","","",""
"2022","A Theoretical Framework for Synchronous Remote Teaching? Reshaping the Pedagogical Triangle","This paper explores synchronous remote teaching as a pedagogical practice and elaborates upon a framework with which to understand the practice theoretically. The empirical backdrop comprises remote teaching practice in Sweden, where this practice is implemented via digital technology and with an onsite facilitator who is present with the students. The pedagogical triangle is revisited, examined, and explored in relation to remote teaching as a new pedagogical practice. In the theoretical elaboration, the pedagogical triangle is reshaped into a pyramid due to the onsite facilitator’s participation in the remote teaching. This elaboration is a first step to establishing a theoretical understanding of remote teaching practice on its own terms.","",""
"2022","Through the Lens of Situated Learning and Levels of Scale: Theorizing Development of Remote Teaching and the Role of On-Site Facilitators","The aim of this paper is to contribute to theoretical development within a field otherwise mostly characterized by empirical contributions, with a primary focus on the practice and perspectives of on-site facilitators. To theoretically understand the development and use of remote teaching, we focus on the interaction between systems of human activity in education and the relationships enacted in practice through their interaction, with a focus on on-site facilitators’ work. In doing so, we use the concept levels of scale in situated learning. Through levels of scale, we conceptualize the historical development of remote teaching as the large scale and the remote learning environment as the small scale. Integrating the levels of scale and tracing the historical development of remote teaching in Sweden into the enactments taking place in a classroom of modern language teaching is the concrete theoretical development that our aim entails.","",""
"2022","In Need of Development, Learning and Research? : On the Possibilities of a Common Point of Departure for Digital and Educational Development","A growing body of initiatives aims to connect school improvement with external actors, such as universities, by means of networks and collaborative partnerships of different kinds. Simultaneously, many schools have difficulties in assessing or predicting their needs associated with the digitalization of a specific local school practice given their lack of existing tools to articulate those needs. This has made it difficult to study digitalization in a complementary and symmetrical way between academia and practice. In this study, we used a quantitative instrument to generate findings and development needs relevant to both research and school development. The instrument, which we distributed to all school leaders in one municipality, measures perceptions of three overall areas: (a) levels of digitalization, (b) organizational digital maturity, and (c) notions of leadership. The data shows, for example, that digitalization, in this municipality, was a concern or issue on an individual level. Achieving a more complex view of digitalization as school development—a collegial approach and mindset together with leadership and organization that focuses on strategy and common goals—appears to be a high priority for research and practice. To conclude, the results generated from the instrument used in this study can contribute to a shared understanding of the findings and the needs relevant to both research and school development.","",""
"2023","Turtles, Tablets, and Boxes: Computer Technology and           Education in the 1970s","ABSTRACT:One of the most powerful ideas behind the potential of computer technology is that it could revolutionize education. To understand this idea historically, this article brings together computer science researchers with theories of education and childhood development. These researchers—Seymour Papert at MIT and Alan Kay and Adele Goldberg at Xerox’s Palo Alto Research Center—drew on a group of midtwentiethcentury education theorists. These cases offer a window into how computer researchers have read and interpreted scientific theories about education and childhood development that then make their way into computer technology or fail to do so entirely.","",""
"2023","Gazing or glancing? Mapping student engagement when film studies moves online"," This article presents the findings of a study undertaken by a team of three film studies teacher-researchers working with undergraduate students in a course titled ‘Histories of Film Theory’. In the context of the transition from face-to-face to remote learning during the COVID-19 pandemic, the authors observed that students’ approaches to understanding relevant film theories became increasingly inflected by their experiences of contrasting methods of course delivery, such as that between the cinema theatre or home viewing environment. To investigate this effect, the authors conducted a study of student experience across the 2020 and 2021 cohorts; the purpose was to understand how the shift to online learning shaped students’ engagement with set film texts, by analysing the behaviour exhibited when accessing film texts remotely. The study is grounded in the observation that there is an existing body of film theory on screen spectatorship that has potential significance to a scholarly understanding of the pedagogical complexity of online learning and multimodal literacies. This scholarship ranges from analyses of ‘traditional’ reception environments (Baudry 1974), to accounts of the differentiation in modes of attention introduced by new media (Ellis 1992, Cavell 1982), to analyses of the multiplying second screen practices of the digital era (Casetti 2011). A governing distinction highlighted in the results is between ‘gazing’, the mode of spectatorship associated with the traditional cinema experience, and ‘glancing’, the mode associated with home viewing and second screen use. Were the students in the course gazing or glancing, and how did this affect their encounters with films and characterize their remote learning experience more broadly? In asking these questions, the article demonstrates how the intellectual resources of film studies might be applied to contemporary digital pedagogy scholarship to reveal a complex scenario in which remote learning practices both hinder and enhance learning experiences, sometimes simultaneously. ","",""
"2023","Digital pedagogies post-COVID-19: The future of teaching with/in new technologies","Pedagogies in the 21st century still exhibit certain uneasiness in relation to digital technologies. Instead of rapid speeds and rhythms of networked technologies and their endless streams of information, these pedagogies are marked by a strong preference for what Hayles (2007) refers to as deep attention. This form of attention is able to focus on one single object for longer periods of time, has the capacity to tune out distractions, and a high tolerance for boredom. Hayles depicts this cognitive mode with an image: ‘picture a college sophomore, deep in Pride and Prejudice, with her legs draped over an easy chair, oblivious to her ten-year-old brother sitting in front of a console, jamming on a joystick while he plays Grand Theft Auto’ (2007: 187–88). The disciplinary norms upheld by education at all levels are still univocally grounded in this form of attention, while the restless excitement-seeking mode of attention associated with playing video games, but also with browsing the web or scrolling through different feeds, is seen as the enemy. This adversary mode of attention, characterized by constantly switching between different tasks in pursuit of stimulation, is referred to by Hayles as hyper attention, and is, as she rightly points out, regarded by educational institutions as ‘defective behavior that scarcely qualifies as a cognitive mode at all’ (2007: 188). One of the aims of education today, it would seem, is to remedy the influence of digital media and immunize us against it. Yet, pedagogy is not alone in its mistrust of the digital. As aptly summed by Paasonen (2021: 1), according to ‘a plethora of cultural diagnoses, networked devices, apps, and social media are atrophying our attention spans, eroding our capacity to focus and think, addicting us, boring us, and stealing our time, as well as stopping us from truly relating to one another, engaging in critical thought, or contributing to public life in a meaningful way’. Paasonen, who maps some of these accounts, draws attention to a range of such analyses put forward by journalists, critical theorists and","",""
