"year","title","abstract","journal","doi"
"2016","Digital stress: Adolescents’ personal accounts"," Based on a thematic content analysis of 2000 anonymous posts to the website AThinLine.org , this article explores adolescents’ personal accounts of digital stress. Six kinds of digital stressors that engender two distinctive types of digital stress are identified. Type 1 stressors—“mean and harassing personal attacks,” “public shaming and humiliation,” and “impersonation”—reflect the migration of common forms of relational hostility onto the online space and echo discussions of harassment, drama, and bullying. Type 2 stressors stem from adolescents’ use of digital technologies in the service of seeking relational connection. These lesser-discussed Type 2 stressors—“feeling smothered,” “pressure to comply with requests for access,” and “breaking and entering into digital accounts and devices”—transpire in the context of adolescents’ attempts to form and maintain intimacy or close connections with others. ","",""
"2016","Is LinkedIn making you more successful? The informational benefits derived from public social media"," This article uses a social capital framework to examine whether and how the use of three types of publicly accessible social media (LinkedIn, Twitter, Facebook) is related to professional informational benefits among a representative sample of Dutch online users. Professional informational benefits were conceptualized as the (timely) access to relevant information and being referred to career opportunities. The effect of content and structure of the respective online network on professional informational benefits was examined on the general (users vs. non-users of a platform) and more fine-grained level (within users of a specific platform). Overall, users of LinkedIn and Twitter reported higher informational benefits than non-users, whereas the Facebook users reported lower informational benefits. Posting about work and strategically selecting ties consistently predicted informational benefits. The network composition mattered most on LinkedIn; strong and weak ties predicted informational benefits. The results demonstrate the usefulness of the social capital framework. ","",""
"2016","Exploring the Relationship Between Mobile Facebook and Social Capital: What Is the “Mobile Difference” for Parents of Young Children?"," Mobile media have generally been found to reinforce close ties. Many have predicted this will bring about an onerous social insularity or “network privatism.” However, mobile media now enable frequent communication and multimedia activities with larger, more diffuse social networks. Might we be at a tipping point where certain groups benefit from weak tie connections on mobile social media? To answer this question, this study considers how mobile media altered social capital outcomes on Facebook among parents with young children, a group that are heavy users of mobile media and requiring social support. An online survey ( N = 262) conducted with parents with young children reveals a generally positive picture. Results show differences between desktop and mobile use of Facebook. Toward a contextual understanding of the impact of visual media, multimedia activities with social ties accrued bridging over bonding capital. Social capital was in turn correlated with mobile Facebook activities beneficial for parents’ well-being. Far from negative predictions, this study provides evidence of how mobile social media broaden our social spheres. ","",""
"2016","Motives for Online Friending and Following: The Dark Side of Social Network Site Connections"," Motives for “friending,” following, or connecting with others on social network sites are often positive, but darker motives may also play an important role. A survey with a novel Following Motives Scale (FMS) demonstrates accordingly that positive, sociable motives (i.e., others providing a valued source for humor and information, others sharing a common background, as well as relationship maintenance) and inspirational motives (i.e., others providing a target for upward social comparison) can be distinguished from darker motives related to insecurity (i.e., others providing reassurance, preference for online interaction, mediated voyeurism, as well as social obligation), and even darker antisocial motives related to self-enhancement (i.e., others providing a target for downward social comparison, competition, schadenfreude, gossip, as well as “hate-following”). Results show that lower self-esteem and higher levels of need for popularity, narcissism, and dispositional schadenfreude characterize users with stronger dark side motives, whereas users with more sociable motives report more satisfaction with life, thereby providing construct validity for the novel scale. Convergent validity is demonstrated by positive relations between following motives and both time spent and following counts on different social network sites. Moreover, an embedded experiment shows that antisocial motives predicted acceptance of a Facebook friendship request from a male or female high school acquaintance who suffered a setback in the domain of appearance or status (i.e., a convenient source for self-enhancement), thereby providing additional convergent validity for the Antisocial Motives subscale. ","",""
"2016","Social Networking Site Behaviors Across the Relational Lifespan: Measurement and Association With Relationship Escalation and De-escalation"," This study examines (1) the factor structure of social networking site relational behaviors (SNSRB), (2) the association between the behaviors and relational quality and breakup adjustment, and (3) whether behaviors vary as a function of relational status. Participants’ responses ( N = 363) indicated that the majority of variance in SNSRB was accounted for by 10 factors—surveillance, managing impressions through photographs, regulating usage, maintaining shared networks/contacts, oversharing, communicating directly via private messages, posting about offline activity, relationship broadcasting, status management, and privacy. Additionally, each factor was associated with the participants’ romantic relationships such as quality of current relationships, adjustment to dissolved relationships, or relational status. This study extends understanding of how technology reflects the way people interact throughout the romantic relationship lifespan. ","",""
"2016","Making It “Facebook Official”: Reflecting on Romantic Relationships Through Sustained Facebook Use"," For the past 12 years, Facebook has played a significant role in mediating the lives of its users. Disclosures on the site go on to serve as intimate, co-constructed life records, albeit with unique and always-evolving affordances. The ways in which romantic relationships are mediated on the site are complex and contested: “What is the significance of articulating a romantic relationship on Facebook?” “Why do some choose to make socially and culturally critical moments like the beginning and ends of relationships visible on Facebook, whereas others (perhaps within the same relationship) do not?” “How do these practices change over time?” and “When is it time to go “Facebook official”?” In this article, we draw on qualitative research with Facebook users in their 20s in Australia and the United Kingdom who have been using the site for 5 years or more. Interviews with participants revealed that romantic relationships were central to many of their growing up narratives, and in this article, we draw out examples to discuss four kinds of (non-exclusive) practices: (1) overt relationship status disclosures, mediated through the “relationship status” affordance of the site, (2) implied relationship disclosures, mediated through an increase in images and tags featuring romantic partners, (3) the intended absence of relationship visibility, and (4) later-erased or revised relationship disclosures. We also critique the ways in which Facebook might work to produce normative “relationship traces,” privileging neat linearity, monogamy, and obfuscating (perhaps usefully, perhaps not) the messy complexity of romantic relationships. ","",""
"2016","Why Do We Pin? New Gratifications Explain Unique Activities in Pinterest"," Pinterest is now the fourth most popular social network site after Facebook, Twitter, and LinkedIn in the United States, offering its own suite of functions. This study investigated why individuals use specific features of Pinterest such as pinning, creating, liking, following, commenting, inviting, sharing, checking, searching, and browsing different categories. An online survey ( N = 113) revealed that a brand new set of gratifications (specific to digital media) predicted a large number of user behaviors in Pinterest. The results showcased the predictive value of affordance-based gratifications in shaping specific user behaviors on social-media. ","",""
"2016","Social Network Sites, Friends, and Celebrities: The Roles of Social Comparison and Celebrity Involvement in Adolescents’ Body Image Dissatisfaction"," This study applies the social comparison theory to examine the effects of adolescents’ engagement in comparison with friends and celebrities on social network sites (SNSs) on (a) their body image dissatisfaction (BID) and (b) their drive to be thin (DT) or muscular (DM). The study also examines celebrity involvement as an antecedent of the outcome variables. Data were collected through a survey of 1,059 adolescents in Singapore. Regression analyses indicate that SNSs use was related to adolescents’ BID. Specifically, social comparison with friends on SNSs was significantly associated with adolescents’ BID, DT, and DM. Gender differences were also observed—social comparison with celebrities was significantly associated with BID and DT among female adolescents. Celebrity involvement was significantly associated with male BID. Theoretical and practical implications were discussed. ","",""
"2016","It’s the Audience: Differences in Social Support Across Social Media"," Responding to recent calls to transcend social media platforms when examining media effects, and using the social information processing model to predict and explain results, this multi-method study first uses a US national survey ( N = 325) to examine perceived effectiveness of social support and relational closeness via paralinguistic digital affordances (PDAs; e.g., “Likes,” “+1s,” and “Upvotes”)—the one-click tools for phatic communication—between social media platforms. Results of the survey reveal some significant between-platform differences in perceived effectiveness of social support provided by a PDA, but no significant differences in the relational closeness of ties across platforms. These findings were used to design and conduct focus groups ( N = 36) to understand why the identified differences exist. Focus groups reveal that although social support is exchanged across all platforms, different dimensions of social support are sought and received depending on the platform and the network audience that platform accesses. In addition, the focus groups revealed meaningful differences in the nature of network relationships between the platforms, if not the degree of closeness. Taking the two studies together, it seems the adoption and continued use of a platform is an idiosyncratic function of both the social and the technological. Findings underscore the importance of conducting cross-platform studies and demonstrate the value of using PDAs as a convenient cross-platform comparison tool, as they are one of the few common features across social media. ","",""
"2017","Does Receiving or Providing Social Support on Facebook Influence Life Satisfaction? Stress as Mediator and Self-Esteem as Moderator","We propose a model that assumes that receiving and providing social support on Facebook reduces stress, which subsequently improves life satisfaction. The model also hypothesizes that self-esteem moderates the relationship between receiving social support via Facebook and life satisfaction and the relationship between providing social support via Facebook and life satisfaction. Applying mediation and moderation analyses to data collected from undergraduate students taking an introductory communication course at a U.S. public university ( N  = 382) yielded three results. First, there was no significant indirect effect of receiving social support on life satisfaction via stress. Second, providing social support increased stress, which subsequently reduced life satisfaction. Finally, self-esteem moderates the relationship between providing social support and life satisfaction: Among students with low self-esteem, providing social support significantly improved life satisfaction; however, among students with high self-esteem, providing social support did not influence life satisfaction. Implications of the findings are discussed.","",""
"2017","REAL TIME EVENT LOCATION DETECTION BASED MOBILITY PATTERN MODELLING FOR SOCIAL MEDIA USER MOBILITY ANALYSIS","Detection of important events in a region through social media has been a recent development with scope for multiple applications. One of the applications is the analysis of the mobility of the users in the region to adapt the energy and resources as per their movement. For this purpose, the travel or movement behaviour of the social media users is analysed through their posts and related messages. An efficient method of mobility pattern modelling named as Event Location based Mobility Pattern Modelling WebClickviz (ELMPM-WebClickviz) is proposed in this paper based on the event location detection. Initially the social media data are collected and preprocessed. Then the geographical as well as temporal information are extracted along with the time and distance parameters. Then the pattern modelling is initiated using Sequential Hierarchical pattern clustering which detects the continuous events from the user data along with the location of occurrence. Based on these results, the mobility behaviour can be modelled with higher accuracy. The evaluation results prove that the proposed model provides efficient mobility patter modelling to be utilized for the organizations and official concerns in fulfilling the resources and needs of the users of that location.","",""
"2017","The role of network setting and gender in online content popularity","ABSTRACT In this study, we explore the role of specific network structures that enhance social capital and assess the extent to which gender, social ties, and communication interaction relate to content popularity within online social networks (OSNs). Our results are based on an extensive OSN data set, containing over 100,000 members, connected by over 1.7 million links. The findings indicate that content popularity inference is more accurate when considering activity interaction among users and that network structures known as advantageous for amassing social capital in the offline environment are relevant online as well. We conclude by discussing how gender mediates the correlation between some network measures and the growth of users’ content popularity and provide a potential explanation for the emergence of gender differences.","",""
"2017","Networked intimacy. Intimacy and friendship among Italian Facebook users","ABSTRACT In this paper, we describe the results of a qualitative study conducted with 120 Italian Facebook users to investigate how Facebook enables people to achieve a mutually constitutive intimacy with their own friendship network: a negotiation of intimacy in public through self-disclosure, where the affordances of the platform are useful to elicit significant reactions, validations and demonstrations of affection from others. We observed that, in order to achieve various levels of intimacy on Facebook, people engage in various strategies: Showing rather than telling, Sharing implicit content, Tagging, Expectation of mutual understanding and Liking. These strategies produce a collaborative disclosure that relies on others’ cooperation to maintain the boundaries between private and public space. Based on these premises, we developed a framework of collaborative strategies for managing public intimacy that both systematizes and extends the findings identified in previous studies of intimacy on Facebook. We describe this framework as networked intimacy and we discuss the consequences of it in the light of already existing research on online self-disclosure.","",""
"2017","A comparison of Facebook, Twitter, and LinkedIn: Examining motivations and network externalities for the use of social networking sites","Although the winner-takes-all approach is often theorized in the use of an information communication technology, more than one popular social networking site exists in the market. Integrating uses and gratification (U&amp;G) theory with network externalities, this study examines why social networking sites can coexist in the market and whether predictors of using social networking sites differ across popular social networking sites. Three separate surveys were conducted for Facebook, Twitter, and LinkedIn. The results show that motivations for using each SNS differ; these motives exert a greater influence on SNS use than network externalities for all three SNSs.","",""
"2017","Assessing the social media landscape: Online relational use-purposes and life satisfaction among Finns","This study examines the social Internet use-purposes of Finns along with links to perceived life satisfaction. Here, associations between life satisfaction and various online behaviors linked to socialization are explored among the Finnish adult population, sigh data coming from nationally representative surveys focused on adult populations in Finland (N=1,600). Analysis shows that social media use is linked to both higher and lower levels of overall life satisfaction with differences between platforms used. The use of Instagram and different social messaging applications, such as WhatsApp, was linked higher life satisfaction while Facebook and Twitter use did not show any significant association; notably, Internet forum use showed a negative association with life satisfaction.","",""
"2017","SNS dependency and interpersonal storytelling: An extension of media system dependency theory"," The purposes of the current study are (1) to conceptualize and test a social networking service (SNS) dependency measure and (2) to propose and test a general model of the effect of SNS dependency on online and offline interpersonal storytelling. This study is theoretically guided by media system dependency theory and communication infrastructure theory. Computer-assisted personal interviews (CAPI) were conducted with 477 SNS users aged 19–59 in Seoul in October of 2012. Confirmatory factor analyses results showed that our SNS dependency measure was valid and reliable. The results also confirmed that SNS dependency had direct effects on individual users’ levels of engagement with interactive activities on SNSs and indirect effects on offline interpersonal storytelling. ","",""
"2017","Predicting international Facebook ties through cultural homophily and other factors"," This study describes the structure of the international Facebook friendship network and its determinants using various predictors, including physical proximity, cultural homophily, and communication. Network analysis resulted in one group of nations, with countries that bridge geographic and linguistic clusters (France, Spain, United Kingdom, and United Arab Emirates) being the most central. Countries with international Facebook friendship ties tended to share borders, language, civilization, and migration. Physical distance, shared hyperlinks, use of common websites, telephone traffic, cultural similarity, and international student exchange were either weakly or not significantly related to international Facebook friendships. ","",""
"2017","Extending media multiplexity theory to the extended family: Communication satisfaction and tie strength as moderators of violations of media use expectations"," Guided by media multiplexity theory (MMT), this article reports results of an experimental study examining how participants say they would respond to hypothetical changes in media use (i.e. increasing or decreasing use frequency) by an extended family member. After contending that MMT addresses both media use patterns and expectations, we employed expectancy violations theory (EVT) to consider the extent to which communication satisfaction (CS) and tie strength moderate evaluations of media use violations. Results supported MMT’s prediction that tie strength would moderate the extent to which the violation was perceived as important, whereas, following EVT, CS with the relative moderated perception of the violation’s valence. Beyond highlighting possible outcomes of media use violations, these results commend the nature of the relationship as a motivating force for media selection in interpersonal contexts. ","",""
"2017","What have we learned about social media by studying Facebook? A decade in review"," A recent review published by Rains and Brunner documented an overwhelming preponderance of the Facebook brand in scholarship about social networking sites (SNS). This follow-up analysis shows that Facebook is still over-privileged when examining the broader umbrella of social media brands; the social networking hegemon constitutes over half of all scholarship across an array of social media, including SNS, media sharing sites, (micro)blogging platforms, virtual communities, and others. This study builds upon Rains and Brunner’s critiques about the over-reliance on the Facebook brand and calls for more scholarship that examines social media as part of larger media repertoires, is more inclusive of indigenous social media brands and their users, and provides greater diversity in terms of academic context. In doing, it serves as the most comprehensive review of social media scholarship to date. Implications for future research are discussed. ","",""
"2017","The relational reconnection function of social network sites"," Relational reconnection is a prominent yet under-explored function of social network sites (SNS) that encompasses both the activation and subsequent maintenance of dormant social ties. The present investigation used two data collections (Study 1, six university samples; Study 2, national United States sample) to explore the characteristics of friends who reconnect using SNS, and attempt to predict whether reconnected relationships persisted beyond the initial reconnection. Results indicated that relational reconnection is extremely common, especially among same-sex friends and individuals who identify as heavy SNS users. Predicted outcome value emerged as the best predictor of persistence beyond initial reconnection, in addition to engaging in modality expansion, being female, and reactivating a relationship with greater perceived development pre-loss-of-contact. ","",""
"2017","Beyond the power of networks: Differentiating network structure from social media affordances for perceived social support"," Existing research suggests that social media use is associated with higher levels of social capital—the resources contained within a person’s network of friends, family, and other acquaintances. However, in predicting access to these resources, it has been impossible to distinguish the affordances of social media from the underlying advantage of maintaining a favorable social network of relationships on- and offline. Based on data from a representative, national survey, we compare the relationship between social network structure and various activities on Facebook for one type of resource: informal social support in the form of companionship, emotional support, and tangible aid. In addition to a positive association between number of close ties, overall network size and diversity and social support, we find that Facebook status updates and private messaging are independently associated with perceived support. We argue that these affordances are an outcome of the “pervasive awareness” provided by social media. ","",""
"2017","Why do we tag photographs on Facebook? Proposing a new gratifications scale"," Using a multi-stage investigation, this study developed and validated a 35-item instrument for measuring gratifications of photo-tagging on Facebook. The questions were developed based on open-ended responses of 141 people who use photo-tags on Facebook. From their answers, 58 items were extracted and then tested on 780 people. This resulted in a 35-item scale that was re-examined with 313 adolescents and 186 adult photo-taggers. The 35-item instrument offers nine gratifications: likes and comments, social influence, peer pressure, gains popularity, entertainment, feels good, social sharing, affection, and convenience. The factorial structure and instrument validity and reliability were high and fairly stable over time. The findings are discussed in relation to the uses and gratifications theory, and the practical implications of this new instrument are explored. ","",""
