"year","title","abstract","journal","doi"
"2000","THE VIRTUAL UNIVERSITY AS 'TIMELY AND ACCURATE INFORMATION'","This article investigates the implementation of an Enterprise Resource Planning System in a redbrick university in the UK. The first part is concerned with the way in which the implementation project team has come to conceptualize its task or mission and represent it both to itself and to the rest of the university. On one hand, the discussion is about the rolling-out of a rather mundane information system, purchased simply as a replacement for an out of date system called 'MAC'. On the other, for some people, the system amounts to a large, and complex - almost mythical - model of the university, a kind of 'virtual university'. Specifically,the article is interested in one particular phrase, script, or mantra that appears over and over as the accepted rationale, mission and justification for the project: the 'provision of timely and accurate information'. It is argued that the phrase helps to mediate the boundary between how the project team and others understand the university as a whole, and the ways in which it is, could be, and should be changing. The second part of the article is focused on the way in which those implementing the new system are attempting to move the university from an old (seemingly 'chaotic') model to a new (supposedly 'ordered') 'informational model'.","",""
"2000","TECHNOLOGY AND THE FUTURE OF THE UNIVERSITY: A SOBER VIEW","Technology has had considerable impact on education and the university, but the Internet - today's newest technology - will not lead to the death of the university. While there is clearly a role for virtual education over the Internet, the conventional university will survive since students are well served by a real, physical, educational experience.","",""
"2000","THE NEW FRONTIER: WEB-BASED EDUCATION IN US CULTURE","The USA has always prided itself on the defence of freedom for all its peoples, democracy as well as being on the leading edge of innovations. The USA, therefore, is a particularly unique setting for an examination of the rhetoric associated with the politics of adopting online learning technologies. This paper examines the context of the US on-line learning system with a particular focus on those aspects of the movement which appeal so keenly to Americans. Certain values are expressed in this movement which are almost uniquely American such as democracy, freedom, efficiency, independence, the vocational nature of education, and meritocratic schemes for education as a sorting mechanism for the society.","",""
"2000","HIGHLY INTERACTIVE TUTORIAL DISTANCE LEARNING","This commentary argues for a new perspective on distance education – one that is based on advances in interactive learning, rather than one-way delivery that is encouraged too often by the design of web-based courses. Tutorial approaches to education are highly effective and new media can bring critical aspects of tutorial approaches to more students than ever before possible.","",""
"2000","DISTANCE EDUCATION PROVISION BY UNIVERSITIES: HOW INSTITUTIONAL CONTEXTS AFFECT CHOICES","Decisions about distance education are made too often without adequately considering the broader institutional context. This paper explores how a better understanding of 'macro' contexts can lead to more successful choices at the 'micro' level of designing and developing specific programmes. Six models derived from distance learning practices are examined. Analyses of these experiences highlight three primary institutional and political characteristics that have a critical influence on distance education outcomes: private or public emphasis; degree of dedication to distance learning; and holistic or incremental strategy. Three secondary dimensions are also discussed: technology mix; financial and production models; and target markets.","",""
"2000","VIRTUAL LEARNING AND THE NETWORK SOCIETY","A wide variety of organizational structures and technologies are associated with the 'virtual campus'. This paper compares the UK's two largest distance learning initiatives: the Open University (OU) and the University for Industry (UfI). The comparison suggests four alternative approaches to 'virtualization' and shows that debate has often under-estimated the variety of possible approaches. The relationship between ICTs, knowledge and organizational structure is complex, reflecting a diversity of values and rationalities embodied by learning institutions.","",""
"2000","THE VIRTUAL UNIVERSITY IS . . . THE UNIVERSITY MADE CONCRETE?","The application of information and communications technologies (ICTs) to higher education has recently gained a new impetus, fired by the promise, and also perhaps the threat, of the 'virtual' university. While there has been much empirical research on individual ICT initiatives, most of this has been narrowly evaluative with little attention paid to their cumulative impacts on the university as an institution. Equally, while there has been much writing on the development of virtual higher education, much of this has been speculative, concerned with the advent of still marginal new institutions and little of it has been empirically grounded. This paper is based on in-depth studies of ICT initiatives in four established universities in the North East of England. It argues that one of the consequences, often unintended, of the introduction of these technologies has been to generate demands and pressures for a more corporate institutional form in which goals, roles, identities and procedures are made explicit and standardized across the institution. To the degree that these demands are met, the result appears to be that the closer that institutions move towards the goal of becoming a virtual university, the more corporate, or 'concrete', their institutional form becomes.","",""
"2000","THE VIRTUAL UNIVERSITY: JONES INTERNATIONAL UNIVERSITY™, LTD","Jones International University provides a leading example of a virtual university. This brief overview focuses on innovative features of this university, ranging from its geographically distributed staff and students to its cyber-graduation ceremony.","",""
"2000","COMPETITION AND COLLABORATION IN ONLINE DISTANCE LEARNING","For-profit firms use the internet to offer classes, courses and degree programmes in direct competition with nonprofit and government-supported colleges and universities. At the same time, many firms seek to partner with academic institutions in offering online instruction or distance learning.This paper outlines and discusses alternative models of academic/for-profit collaboration that are being developed in the USA. Collaboration requires the partners to define responsibilities for technology, administrative services, content development, promotion and student selection, instruction, awarding of credits and overall quality control. Firms may want to 'unbundle' the traditional faculty role of both course designer and teacher,and use different professionals for the two functions. Although most collaborations today involve non-degree programmes, many schools of business are working with for-profit firms to offer MBA degrees online. The diversity of higher education in the USA means that many different models will be tried. Collaborations will expand the markets for online distance learning, but a number of difficult issues remain to be resolved.","",""
"2000","INFRASTRUCTURE AND INSTITUTIONAL CHANGE IN THE NETWORKED UNIVERSITY","Many people believe that information technology will bring massive structural changes to the university. This paper draws on concepts from both computer science and social theory to explore what these structural changes might be like. The point of departure is the observation that the interaction between information technology and market economics creates incentives to standardize the world. Standardization can be a force for good or evil, depending on how it is done, and this paper develops normative ideas about the relation between the forces of standardization and the places in which university teaching is done. Information technology allows these places to be more diverse than in the past, and a good rule of thumb is that the places in which learning occurs should be analogous in their structure and workings to the places in which the learned knowledge will be used. Universities can support this increased diversity of learning places with appropriate structural reforms, including decentralized governance and explicit attention to certain aspects of the university organization, such as media services and the career centre, that, historically, have been marginalized.","",""
"2000","IRELAND: DISTANCE EDUCATION IN AN EXPANDING DEMOCRACY","The recent and explosive development of the Irish economy has earned the Republic the popular accolade, CelticTiger . Enticed by government subsidies and tax incentives, foreign investors favour location in Ireland in order to penetrate the Single European Market (SEM). Commensurate with the demands of foreign investors for a fully developed infrastructure, the deregularization of the Irish Telecoms market (1998) has afforded new opportunities for the transformation of education and training in Ireland. This paper explores the democratizing potential of distance education within the Irish Republic. It focuses on awareness programmes and initiatives for the promotion of information technology (IT) access, and considers particular challenges in ensuring equal access to the benefits of new technologies, for all.","",""
"2000","CHINA'S FUTURE WITH DISTANCE EDUCATION: Rhetoric and realities","China has a long history of distance education with one of the largest and longest standing television distance delivery systems in the world. However, with the advent of online learning environments, China must face a brave new world of innovation. This paper examines the political rhethoric surrounding the allocation of funds and energies to online learning and considers critical components of that rhetoric including democracy, market driven education, open access, as well as issues of power, customization, and globalization which affect the ways in which China adopts new online learning technologies.","",""
"2000","DEFINING MOMENTS: THE TENSION BETWEEN RICHNESS AND REACH","The defining moments of traditional spatially based higher education are made up of fixed and fluid experiences. These 'moments' are now creaking as funding per student falls and the romanticized ideal of an education detached from 'real' life falters under the weight of highly variable student experiences. Distance learning in all its guises has always been regarded as inferior by those embedded in the traditional system. However more and more students demand something different from costly campus-based education. It is time for a more open discussion about the tensions between richness and reach and the role that new facilities like the Internet could play in reaching more students without wallowing in the nostalgia that often accompanies such debates.","",""
"2000","STUDENT DISTRESS IN A WEB-BASED DISTANCE EDUCATION COURSE","Many advocates of computer-mediated distance education emphasize its positive aspects and understate the kinds of communicative and technical capabilities and work required by students and faculty. There are few systematic analytical studies of students who have experienced new technologies in higher education. This article presents a qualitative case study of a small graduate-level web-based distance education course at a major US university.This paper examines students' distressing experiences due to communication breakdowns and technical difficulties. This topic is glossed over in much of the distance education literature written for administrators, instructors and prospective students. The intent is that this study will enhance understanding of the instructional design issues, instructor and student preparation, and communication practices that are needed to improve web-based distance education courses.","",""
"2000","MAKING THE CASE ONLINE: HARVARD BUSINESS SCHOOL MULTIMEDIA","New media technologies provide opportunities to expand academic curriculum offerings and enhance student learning. Yet web-based and online learning tools should not be just repurposed text and information, or videotaped faculty lectures. Instead, the web calls for the inclusion of sound, text and visuals for learning tools that provide a media-rich environment. This allows faculty to create multidimensional experiences that cater to different learning styles and provide opportunities for problem solving. Drawing on my production experiences at HBS, as well as my own experience teaching visual anthropology and creating films, videos, photographs and web products, I discuss the teaching opportunities that new technologies and media can provide.","",""
"2000","THE RHETORIC OF DEMOCRACY IN INTERNATIONAL ON-LINE EDUCATION","On-line education has been heralded as the next democratizing force in education, particularly in higher education (Daniel 1996; Jones 1997). By opening access to populations which have not had access either because of geographical location, job status, or physical handicap, the rhetoric of on-line education suggests that this new technology will democratize education, breaking down the elitist walls of the ivory tower. However, it is not at all clear that the reality of implementing distance learning solutions have in fact any potential, much less actual value for democratizing higher education. Much the opposite, founded on the myth of the meritocracy, on-line education has the potential to exacerbate already intractable views of individual achievement through education as rectifying failures to meet disadvantaged populations' needs. This paper presents several cases of international on-line education and the rhetoric that surrounds its introduction. In some cases we are able to share stories of implementation of distance learning programmes or governmental promises made to those interested in distance learning. In each case, we attempt to tell a story that sheds light on the ways in which the noble goals of democracy are and aren't met in the harsh reality of on-line learning.","",""
"2000","ENHANCING DISCOURSE ON NEW TECHNOLOGY WITHIN HIGHER EDUCATION","Universities face challenges in creating and nurturing reflective discourse about ICTs within higher education. Constraints to this discourse include time-space compression caused by ICTs, and changing perceptions of the university's role in an information society. In answering these challenges, a call is made for elevating the role of higher education in public knowledge formation. Such a move reduces the constraints of time pressures by valuing discussion and debate and the time required for these activities, and questions authority and credibility gained solely due to practical and discursive technological competency. Thus, the question is not just to explore how communications technologies are shaping our experience of time and space, but to debate how we wish to use technologies and other means to shape and create the time and space in which meaningful human social and political life is possible. Institutions of higher education should both serve as sites for public knowledge formation, and as contributors to such initiatives in civic society.","",""
"2000","Pedagogy in the Electronic English Classroom:  A Cluster","In the following cluster of papers, each author discusses her experience using technology in the """"classroom"""". All three papers are primarily concerned with pedagogy how classes changed when computers became an integral part of the course. All raise issues related to how computers change classroom dynamics and, most importantly, how the use of computers changes the structures of authority which exist in the traditional classroom.","",""
"2000","Plato as distance education pioneer: Status and quality threats of Internet education","Distance learning technology has always posed risks for undermining both established faculty-status prerogatives and the quality of student learning. This paper examines these risks in the context of three historical instances in the development of """"distance"""" education technology: the use of the written word to deliver course materials, the creation of the mass lecture hall, and the recent development of pre-packaged general education Web courses. These """"Web courselets"""" represent the most serious threats to the undergraduate learning experience and may undue many of the recent efforts to reform undergraduate education.","",""
"2000","Perspectives on lifelong learning: The view from a distance","This study explores the factors related to using distance learning to meet the continuing education needs of professionals in knowledge related fields. College programs and accreditation are discussed, as well as the needs for individual credentials, increasing knowledge, and personal development.","",""
"2000","Helpmate: A multimedia Web teaching framework","The Internet is an effective means of disseminating information to students within universities. It enables one to place documents on a Web server, which students can access on campus or remotely. We have developed a Web-based collaborative system, which enables students to work through lab-based tutorials with access to a lecturer at a remote location through a Web cam, e-mail and a chat room applet. The student also has access to other students through the chat room applet and can browse through the history to check whether questions have been previously answered. Remote control software allows the lecturer to take control of the students machine in order to troubleshoot problems. Currently, the system is in everyday use and here we demonstrate the many benefits of such a collaborative environment.","",""
"2000","Coping in a distance environment: Sitcoms, chocolate cake and dinner with a friend","Students entering distance education programs often find themselves adapting to new learning environments and new technologies. Part of this adaptation involves coping with unfamiliar technology and learning to manage its use within the group, helping them create the environment in which they will learn. Part of it involves developing personal relationships that will ease their work and learning, helping them cope with unfamiliarity and change. Examining suggestions from distance learning students on how to cope with this process yields three-fold results. First, it demonstrates how students, instructors and administrators need to work together to ease student's paths. Second, it helps us in advising distance learning students about what they can expect from distance learning, and how they can contribute to and benefit from their distance learning community. Finally, it provides recommendations to instructors and program directors on how better to help their students cope with this community building transition and distance learning environment.","",""
"2000","The Virtual University and college life: Some unintended consequences for democratic citizenship","Advocates of the Virtual University assume that the Internet can be used to replace the bricks and mortar campus. Even if the academic course work of higher education can be replicated online, what cannot are the organized extracurricular activities which have been a crucial component of a traditional college education. These activities create social capital, prepare students for civic engagement and combat the self-absorbed individualism which undermines democratic society. We would do well to think about their loss, and the unintended social consequences which flow from adopting the Virtual University as a model for higher education in the twenty-first century.","",""
"2000","Using the World Wide Web to enhance classroom instruction","The use of the World Wide Web (WWW) as an instructional tool is gaining momentum as more teachers, instructors, and trainers incorporate it into their repertoire. Grouped together, any instruction that makes use of a computer is called Computer Based Training (CBT), and those strategies that employ the Web as the repository for instructional information are known as Web-Based Instruction (WBI). WBI can be employed in a distance education model or as an adjunct to teacher-led classrooms.  Specifically, WBI can be used to meet the needs of a more diverse student group. Typical classes consist of students with varying abilities and previous knowledge, and WBI can help a teacher address these differences. WBI also allows students to work a pace that is more comfortable - some students work faster than their peers while others may wish to take longer. In addition, the use of WBI provides the opportunity for multiple grade levels to be accommodated in the same classroom at the same time.  From a teacher's perspective, SBI can help with many daily management tasks by reducing the paper flow required for paper-based instruction, allowing for quick and easy revisions to instructional materials, and ensuring that instructional materials are always available to students. In addition, because the bulk of instruction is delivered via the Web, the teacher is free to spend time working with individual students and small groups; less time is spent in whole-class instruction.  An added bonus of Web-Based Instruction is the fact that it can offer students a """"virtual teacher"""" because students can access the instructional materials anytime, anywhere. This allows students who were absent the opportunity to access instructional materials away from school, and even the possibility to accommodate students in a course when their schedule is full.","",""
"2000","ATEEL: The Advanced Technology Environmental Education Library","The field of environmental technology education is a rapidly changing, multifaceted field that requires students to have access to a rich, reliable, and up-to-date resource base of information. Nearly all 1,200 community colleges in the U.S. offer some type of environmental courses. Over 100 community colleges offer one-year certificate or two-year associate degree programs in environmental technology.  The constant change in federal, state, and local environmental, health, and safety regulations impacts and quickly dates the curricula in environmental programs. New regulations, discoveries, and emerging technologies change the nature of the knowledge and skills required of environmental technicians. Community college libraries have fixed budgets that may curtail purchasing the wide array of supplemental materials that are current with developments in the field. This problem is drawn into even sharper focus as increasing numbers of colleges offer environmental programs via distance learning. ATEEL is an innovative, online library designed to serve the specialized needs of community college environmental technology students, instructors, and workers throughout the nation.","",""
"2000","Hello, out there: A look at distance education in Alaska","This study examines the state of distance education in Alaska. Providing public education has offered long-standing challenges to educators and policy makers in the state since the indigenous peoples of Alaska were introduced to Western education. This is especially so at the secondary and post-secondary levels. Factors such as a low population density, isolated and remote villages, a high teacher attrition rate, a low number of Alaskans (particularly Alaska Natives) in the classroom as licensed teachers, and a challenging environment contribute to the situation.  The University of Alaska Fairbanks (UAF) has had a longstanding commitment to provide post-secondary education to students in rural Alaska. By surveying individuals involved in distance education in the state, this study found that distance education is primarily being delivered by audio conferencing and prepared curriculum modules. In an effort to meet the educational needs in rural Alaska at the post-secondary level, administrators and faculty are working to increase the number of courses delivered by distance education using asynchronous communication.  There were over 1,000 distance-delivered courses at the post-secondary level in Alaska delivered by the various campuses within the University of Alaska System during the 1999-2000 academic year. The typical distance education student in UA System is female, in her 30's, and likely to be White. Twenty-five percent of students taking distance education courses in various UA campuses were identified as Alaska Native, which is significant since they constitute 15 percent of the state population. Students taking distance education courses from any of the University of Alaska sites took an average of two courses per semester.  There is a need for greater coordination among the different sites delivering distance education courses and training for faculty in a more consistent manner. Information and access to course work should be made more readily available to all post-secondary students within and outside the state. Further research is necessary on gender disparity and on the relatively high number of Alaska Native students taking distance education courses.","",""
