"year","title","abstract","journal","doi"
"2016","The problem of future users: how constructing the DNS shaped internet governance","Before the emergence of internet governance bodies like the Internet Corporation for Assigned Names and Numbers (ICANN), early network designers learned how to govern the internet in their work building the Domain Name System (DNS). Using original archival research, this article follows conversations among network designers in their daily struggle to keep the Advanced Research Project Agency Network (ARPANET) and early internet in working order. Drawing from social constructivism and path dependence theory, this history helps to conceive """"internet governance"""" beyond its institutional focus, considering how the work of ordering the internet necessarily exceeds the parameters of governance authorities.","",""
"2016","Multistakeholder governance processes as production sites: enhanced cooperation """"in the making""""","The paper combines actor-network theory and interpretative policy analysis to conceptualise multistakeholder arrangements in internet governance as production sites in which heterogeneous actors engage in dynamic processes of social ordering such as shared meaning-making and coalition building. The paper draws on existing research that traces processes of social ordering at the intersection of multistakeholder settings and intergovernmental institutions, and on theoretical considerations of multistakeholder mechanisms in internet governance. By focusing on processes of discursive production, the paper adds a new perspective to the existing body of literature on science and technology studies and internet governance, and provides illustrations based on deliberations of the Working Group on Enhanced Cooperation.","",""
"2016","Doing internet governance: practices, controversies, infrastructures, and institutions","This special issue makes an argument for, and illustrates, the applicability of a science and technology studies (STS) informed approach to internet governance research. The conceptual framework put forward in this editorial and the articles composing this issue add to the mainstream internet governance scholarship by unpacking macro questions of politics and power. They do so through the analysis of the mundane and taken-for-granted practices and discourses that constitute the design, regulation, maintenance, and use of both technical and institutional arrangements of internet governance. Together, this body of work calls to rethink how we conceptualise both internet and governance.","",""
"2016","Disclosing and concealing: internet governance, information control and the management of visibility","The ubiquity of digital technologies and the datafication of many domains of social life raise important questions about governance. In the emergent field of internet governance studies, most work has explored novel governance arrangements, institutional developments and the effects of interactions among public and private actors in the emergence of the internet as a matter of concern in global politics. But the digital realm involves more subtle forms of governance and politics that also deserve attention. In this paper, I suggest that the 'ordering' effects of digital infrastructures also revolve around what I term the ‘management of visibilities’. Drawing on insights from science and technology studies and sociologies of visibility, the paper articulates how digital technologies afford and condition ordering through the production of visibilities and the guidance of attention. The basic tenet of the argument is that there is an intimate relationship between seeing, knowing and governing, and that digitalisation and datafication processes fundamentally shape how we make things visible or invisible, knowable or unknowable and governable or ungovernable. Having articulated this conceptual argument, the article offers a number of illustrations of such forms of ordering.","",""
"2016","Analysing internet policy as a field of struggle","This essay proposes an analytical approach that conceptualises internet policy as a field of struggle which emerges through processes of discursive institutionalisation. By combining field theory and selected Science and Technology Studies (STS) concepts, the essay highlights the performative function of discourses in the field. It does so by showing how actors entered the policy field through the creation of expertise and regulatory competences and uncovers key conflicts that have shaped internet policy. Drawing on interviews and document analysis, the essay illustrates the proposed research approach via three selected examples which demonstrate how international discourses materialised in internet-related organisational structures and regulatory competences in German ministries.","",""
"2016","Private ordering and the rise of terms of service as cyber-regulation",": Online communications and activities require the intermediation of numerous private entities that unilaterally define and implement their terms of service (ToS). The substantive provisions set in the ToS regulate the relationships between intermediaries and users with a binding force that may be even stronger than the one exercised by the law. Notably, we stress that internet intermediaries privately enforce their contractual regulation by shaping the architecture of the networks and platforms under their control. Such regulation and implementation do not need to rely on “traditional” public law-enforcement mechanisms and may apply in a transnational fashion. This paper argues that internet governance is witnessing the increasing centralisation of power in the hands of internet intermediaries defining private orderings. While acknowledging that ToS are an efficient and well-suited instrument to regulate the online world, we claim that ToS unilaterally impose rules, despite being presented as voluntarily accepted by the involved parties through the expression of free and informed consent. Based on empirical research, we highlight that ToS and their private implementation affect internet users’ capability to enjoy their human rights, with particular regard to freedom of expression (and innovation), the right to privacy and to due process. Lastly, we put forward some recommendations on internet intermediaries’ compliance with human rights standards.","",""
"2016","Governing the internet in the privacy arena",": The surveillance disclosures triggered by Snowden have fueled the public re-negotiation of privacy. To follow resulting controversies we present a methodology that links social worlds theory to approaches asking for the democratic governance character of issue-centred arenas. After having outlined this approach it is put to the test. We analyse and compare two cases: the Schengen/National Routing","",""
"2016","What we talk about when we talk about cybersecurity: security in internet governance debates",": At meetings of internet governance organisations, participants generally agree that improving security is an important goal, but these conversations rarely yield consensus around how to achieve this outcome. One reason security plays this paradoxical role—as both a universal point of agreement and a continued source of contention—in these debates is that it has significantly different meanings to different stakeholders involved in these governance forums. In this paper, we discuss how different stakeholders define and frame internet security issues in the context of governance debates and analyse how these conflicting notions of security continue to shape emerging controversies","",""
"2016","Internet governance as 'ideology in practice' – India's 'Free Basics' controversy","The paper examines the recent Free Basics controversy in India, which triggered a national level policy debate on the appropriate regulatory response to differential pricing of data services, employing the theoretical framework of 'ideology in practice'. Unpacking 'openness' in design, 'inclusion' in provisioning and 'empowerment' in use as contested concepts in the policy process, the paper demonstrates a paradoxical conflation of oppositional interpretations of access. Tracing the material-discursive practices of actors in the debate and scrutinising everyday practices of the internet for their moral claims, the paper examines if and how hegemonic discourses of economic globalisation are challenged, and alternative meanings of the internet etched in contemporary political agenda on internet governance in India.","",""
"2016","Internet control points as LGBT rights mediation","ABSTRACT Conflicts over lesbian, gay, bisexual, and transgender (LGBT) rights, similar to other social struggles, are increasingly materializing within technical functions of Internet governance and architecture rather than at the surface level of content. This paper examines how various functional areas of Internet governance, such as the assignment of domain names, the policy-making role of private information intermediaries, and intellectual property rights enforcement mechanisms serve as control points over LGBT speech, identity expression, and community formation. This turn to Internet governance control points to mediate LGBT rights has implications for public policy, for scholarship at the intersection of Internet governance and human rights, and for media companies and activists in their work of shaping infrastructures that can promote free expression and human rights.","",""
"2016","Alternative rules for alternative networks? Tort law meets wireless community networks","This paper analyses the existing rules on civil liability in order to test their applicability on wireless community networks (WCNs), with a focus on the European framework. In particular, the paper considers tort liability for three different actors: WCNs users, ISPs (in the case of shared Internet connection), and WCNs themselves; it describes the different situations to which civil liability should be applied in relation to the three mentioned actors. The analysis demonstrates that the structure of WCNs seems irreconcilable with the aims of current legal framework for tort law. The paper attempts to envision possible solutions through a multilayered approach based on social norms and contracts.","",""
"2017","Australian internet policy","This special issue focussing on internet policy in Australia provides a snapshot of developments on various topics (access, privacy, censorship) as a means of understanding better the state of play in Australia, and also how this compares to internet policy in other parts of the world, especially Europe and North America. Given changing geopolitics, the influence of internet policy in the rest of the Asia Pacific through vehicles such as the Regional Comprehensive Economic Partnership (RCEP) may become increasingly important in Australia in the coming years. This leaves Australia, and its internet policy, at a crossroads, which may reflect broader dynamics in internet policy internationally, and makes this an interesting time in which to explore what is happening in this particular country.","",""
"2017","Between coordination and regulation: Finding the governance in Internet governance"," Following recent theoretical contributions, this article suggests a new approach to finding the governance in Internet governance. Studies on Internet governance rely on contradictory notions of governance. The common understanding of governance as some form of deliberate steering or regulation clashes with equally common definitions of Internet governance as distributed modes of ordering. Drawing on controversies in the broader field of governance and regulation studies, we propose to resolve this conceptual conundrum by grounding governance in mundane activities of coordination. We define governance as reflexive coordination – focusing on those ‘critical moments’, when routine activities become problematic and need to be revised, thus, when regular coordination itself requires coordination. Regulation, in turn, can be understood as targeted public or private interventions aiming to influence the behaviour of others. With this distinction between governance and regulation, we offer a conceptual framework for empirical studies of doing Internet governance. ","",""
