"year","title","abstract","journal","doi"
"2020","FACELESS YOUTUBERS: HOW CONTENT CREATORS SHAPE AUDIENCE   EXPECTATIONS","YouTube's maturation as a platform can be seen through a collection of social norms, audience expectations, and politics, all of which weave themselves into the technosocial fabric of digital life. As such, certain practices that regulate the flow of information have become normalized across a certain subset of YouTube channels. This paper will look at this practice among YouTubers that are “faceless”—content creators who do not reveal their faces on camera while voluntarily revealing many other aspects of their identity. Specifically, a content analysis is performed on these channels: The Lockpicking Lawyer, AvE, SteadyCraftin, This Old Tony, bigclivedotcom, CGP Grey, and fastASMR. The wide range of categories these channels belong to (DIY, self help, science and technology, home crafting, electrical appliance teardown, and audio therapy) indicates that choosing to remain faceless is not a function of a certain type of material, but rather a salient trend that crosscuts YouTube genres. The channels analyzed suggest that these YouTubers feel empowered through remaining faceless, allowing for increased disclosure about the topic at hand. They also demonstrate that Faceless YouTubers selectively share information depending on a range of motivations, all of which revolve around imparting meaningful content to specific audiences while maintaining a specifically-constructed notion of privacy. As a platform that is continually evolving,this paper represents an advance in the study of YouTube.","",""
"2020","IT'S REWIND TIME, EVERYBODY: THE CONTESTATION OF PLATFORM CULTURE IN   YOUTUBE'S YEARLY REVIEW","YouTube Rewind, especially its controversial 2018 and 2019 offerings, surfaces contested and contradictory understandings of what YouTube culture is and who gets to speak for the platform. Adopting and morphing the idea of media events established by Dayan and Katz, I argue that Rewinds serve as $2 . Rewinds are moments of coming together around shared rituals, anthems, and cultural leaders. The violation of the formula for this ceremonial event in 2018 upset audiences and generated a mass, organized, and negative response. By tracing the flows of content creation, including the corporate-produced Rewind videos and critical response and reaction videos from YouTube creators, this project identifies competing visions and structuring tensions of platform culture. Focusing on the question of cultural development on YouTube via the social media event of Rewind videos forefronts the larger question of how researchers can talk about online culture on a globalized scale. From viewer-driven virality, to the establishment of microcelebrities, to the role of international cultural leaders on the platform, understandings of what it means to be a YouTuber emerge from more sectors than ever before. Is a singular Rewind possible for a platform that now encompasses over 100 countries and 80 languages? If corporate visions of what YouTube is and should be no longer generate popular excitement and backing, who then gets to speak for the platform? Focusing on YouTube’s premiere cultural event offers a starting point for understanding what YouTube $2 to those who structure their lives on and around the platform.","",""
"2020","MAPPING VALUE(S) IN AI: THE CASE OF YOUTUBE","This paper presents a multidisciplinary approach (media studies, computer science, and legal scholarship) for the analysis of systems that rely on AI components as central components of their design. Taking recommender systems more generally and the one built by YouTube more specifically, we develop a methodology for conceptualizing and studying the broad array of “ideas”, “norms”, or “values” such systems mobilize. Instead of limiting ourselves to a narrow understanding of these terms, we take into account, for example, translations from economic models, social theories, legal requirements, ethical principles, technical knowledge, experiential evaluations, or other constructs used to define and justify design goals and decisions that shape the production of technical objects and, consequently, the object themselves. In this paper we discuss three directions for analysis and present first results. Investigating technical knowledge includes the study of scholarly literature and experimentation with concrete objects such as LensKit for Python to understand the “ambient” knowledge and normativity engineers and designers draw on. Investigating local circumstances involves ethnographic analysis, but also the reconstruction of the business models and legal environment that weigh on YouTube’s design. Analyzing a system in use can draw on technical observation, via scraping or API data, of the actual dynamics of recommendation that emerge when users enter into the equation. Taken together, these three approaches can “encircle” the various moments where value(s) are shaped and put into work in the context of systems where direct access to specifications is improbable.","",""
"2020","Mapping YouTube","Over the past 15 years, YouTube has emerged as a large and dominant social media service, giving rise to a ‘platformed media system’ within its technical and regulatory infrastructures. This paper relies on a large-scale sample of channels (n=36M+) to explore this media system along three main lines. First, we investigate stratification and hierarchization in broadly quantitative terms, connecting to well-known tropes on structural hierarchies emerging in networked systems, where a small number of elite actors often dominate visibility. Second, we inquire into YouTube’s channel categories, their relationships, and their proportions as a means to better understand the topics on offer and their relative importance. Third, we analyze channels according to country affiliation to gain insights into the dynamics and fault lines that align with country and language. Throughout the paper, we emphasize the inductive character of this research, by highlighting the many follow-up questions that emerge from our findings.","",""
"2020","“Rewarding Good Creators”: Corporate Social Media Discourse on Monetization Schemes for Content Creators"," This discourse analytical article deals with the power relations between social media corporations and content creators in the context of monetization schemes of social media businesses, i.e., schemes that allow creators to monetize their social media content. Specifically, this study presents an analysis of discourse material pertaining to YouTube’s monetization scheme (the YouTube Partner Program [YPP]) to shed light on the broader point of how social media corporations position themselves in relation to creators who (seek to) earn money on social media. While some research on social media has focused on their potential to empower users/content creators, less optimistic scholars have addressed social media corporations generating massive profits by exploiting creators, for example, in the form of free digital labor. By comparison, there is a lack of research, especially empirical discourse analytical research, on creators’ paid digital labor and on how social media corporations conceptualize paid creators. This study redresses this gap regarding one of the oldest monetization schemes—the YPP. Using corpus linguistic tools to explore textual data from 46 YouTube sites detailing the YPP, this study homes in on references to content creators, YouTube, and how these players are connected to one another. The findings show that although the name YPP elicits the impression of cooperation on equal terms, YouTube represents itself as legislator, judge, and executive authority. This indicates that despite the ability of partnered content creators to share in the social media businesses’ profits, they do not inhabit a particularly empowered position. ","",""
"2020","YouTube’s Operational Logic: “The View” as Pervasive Category"," Launched in 2005 as a platform for user-generated content (UGC), YouTube is one of the most popular websites in the world. In this article, I focus on the site’s use of “the view,” which I argue serves as a pervasive category enacted through the platform, in its information regimes and beyond. The view supports a myth of viewer intentionality and satisfaction and serves as the operational logic of the platform as a whole. It is a category in Durkheim’s sense, ordering practices and naturalizing hierarchies and inequalities. These hierarchies concern, and impact on, participation, financial compensation, visibility, and popularity. In making my claims, I demonstrate how the celebratory discourse around YouTube as an empowering tool that levels the media playing field was positively misguided. I make a plea for a critical reading of the view, which can enhance our understanding of the platform and its culture. ","",""
"2021","“MY MINIMALIST JOURNEY:” NARRATIVE ANALYSIS OF YOUTUBE MINIMALISM         STORIES","The recent minimalist lifestyle is often claimed to be a way to         change your life by minimizing your spending, possessions, tasks, relationships, etc.         YouTube is an important venue where minimalist content is published and shared (Meissner,         2019). The current study focuses on “minimalist journey"""" narratives, where people tell their         stories of """"encountering"""" the minimalist lifestyle. I collected “minimalist journey"""" stories         from 40 YouTube videos with their comments and analyzed them using narrative analysis         methods, both thematic and structural (Labov &amp; Waletzky, 1997; Riessman, 2005). By         closely examining these narratives, this study sheds light on how people experience and make         sense of the minimalist lifestyle within the context of anti-consumerism and neoliberalism         in digital space. This study also contributes to digital culture studies by showcasing how         personal life narratives are constructed on video-sharing platforms like YouTube. Two themes         emerged in the analysis. In the “Hoarder to Minimalist” narrative, narrators were once         over-consuming hoarders and now minimalists. Minimalism facilitates discursive rejections         and behavior disruptions of consumerism. The """"transformational"""" stories, however,         reinforcing the neoliberal sense of self that needs constant improvement. In the “Always         been a Minimalist” narrative, narrators have always been frugal due to underprivileged         social status. Minimalism empowers them by providing a set of vocabulary for recreating         meanings. It, however, downplays the class divisions in capitalist society as merely an         issue of “framing”; the struggles of lower social class people just need to be beautified as         “minimalism.”","",""
"2021","Making Sweet Music Together: The Affordances of Networked Media for Building Performance Capital by YouTube Musicians"," Following Miller, who looked at offline performance capital for musicians and discovered important gender and genre impacts, we examined the role of gender and genre in the development of performance capital for YouTube top cover song artists. This case study suggests that online performance capital on YouTube is slightly different than offline performance capital, and benefits from the affordances of networked media, and specifically YouTube. While there is some gender-based homophily in channel linking behaviors, there are also connections between weakly tied individuals with respect to video category, meaning that musicians are linking to others outside of the music community and vice versa. While music video channels tend to link to other music video channels, and non-music channels tend to link to other non-music channels, the most popular videos tend to post from multiple categories including both music and non-music. Findings suggest that being a long-time poster and having a rich and diverse network are likely elements of building performance capital for YouTube musicians. ","",""
"2021","The Drama of Metrics: Status, Spectacle, and Resistance Among YouTube Drama Creators"," How does it feel to have one’s online worth and status be based almost exclusively on metrics? We examine this question through a qualitative study of YouTube “drama” channels. Drama creators cover the conflicts and scandals taking place among top YouTube celebrities. As producers of meta-commentary, they often rely on metrics as indicators of influence and celebrity on YouTube, thus constituting a relevant site to examine the connection between social media metrics and status. Based on interviews with English-speaking drama creators, we report three main findings. First, creators have a double orientation toward YouTube, which they understand as a site of both economic opportunities and tight-knit relationships. Second, the meanings that creators attach to metrics—their own and the ones of top YouTubers—reflect this double orientation: for them, metrics correlate with economic revenue and social status. Due to this central and multifaceted role of metrics, we find that traffic numbers can turn into a spectacle of their own for drama creators. Third, even in a context in which metrics are central, we identify several distancing strategies on the part of creators. We conclude by discussing whether—and why—resistance to metrics can be found everywhere. ","",""
"2022","How-to videos on YouTube: the role of the instructor","ABSTRACT How-to videos on YouTube have become a popular source for procedural learning. An important difference to traditional educational videos is that the instructor is often not a professional educator, but an amateur or peer. Building on work on social learning from models, this paper explores how instructor characteristics such as model-observer similarity, instructor credibility (expertise, trustworthiness, attractiveness), and conversational human voice influence choice and evaluation of a how-to video. A survey (n = 401) among active Internet users was conducted. Most respondents had used YouTube and had watched how-to videos on YouTube. Respondents preferred videos with instructors that they perceived as experts and trustworthy, and who talked in a conversational human voice. Instructors of the same gender as the viewer were also preferred, especially by males. The instructor variables explained variance in perceived usefulness and intention to use how-to videos above and beyond the technical and instructional quality of the video. However, only conversational human voice and same gender of the instructor turned out to be significant predictors of perceived usefulness and intention to use.","",""
"2022","Social media engagements of music videos on YouTube’s official artist channels"," As social platforms become essential in promoting songs, many artists create an official channel on YouTube and encourage their fans’ engagements. However, little is known about the effectiveness of official videos in generating fans’ media engagements. We conduct two empirical studies to investigate the relationship between official video attributes, media engagements and channel subscribers. First, we propose a model to explain how music video attributes facilitate the relative social media engagements of a video. Second, we test whether three types of social engagements are associated with an increase in official channel subscribers. To do so, we collect social media engagement data for the 2896 music videos uploaded between May 2016 and April 2019 by 105 artists who own their YouTube official artist channels. The empirical evidence shows that the official videos incorporating visual, performance and storytelling components can generate more positive engagement from the viewers, while audio-only videos exhibit lower overall engagement intensity. Furthermore, we find that active media engagement, such as leaving ‘comments’, contributes to the increase in channel subscribers beyond the effect of the number of registered videos. Our results suggest that highly involved music fans may show the active types of social engagements, such as leaving a comment on live and follow-up videos. In practice, our findings imply that YouTube creators need to incorporate visual-focused platform characteristics to stimulate in-depth social engagement. ","",""
"2022","Facework in Confessional Videos by YouTube Content Creators"," This article analyses the role of facework in the discourse of confessional YouTube videos by female fashion and beauty content creators, where they disclose personal problems, and offer viewers advice. It uses thematic analysis to identify discursive tactics that protect viewers’ face. The article argues that the parasocial nature of the connection that these videos attempt to establish with an audience that content creators know little about makes it important for them to reflexively adapt to these viewers’ needs for fellowship and autonomy. Their disclosures may be intended to create closeness, but at the same time they need to cater for distance and prepare the ground for this content to be received as well as possible. However, just like the connection that the videos seek to establish, the facework they contain is also parasocially situated: the videos speak to an imagined viewer’s need for inclusion and this viewer’s possible objections, as these are perceived by the content creator. The article contributes to a better understanding of the construction of closeness in this genre of mediated discourse. ","",""
"2023","Dissemination and reception of a functional tourette-like behavior via YouTube: a qualitative study with German patients","ABSTRACT With the emergence of such videos addressing Tourette syndrome on YouTube, in which affected persons present themselves, Tourette experts observe an increasing number of patients showing Tourette-like symptoms. Interviews show that they are not only familiar with these videos but have also dealt with them in different ways. Medical analyses combined with the evaluations of the interviews give reason to believe that the videos can be interpreted as triggers for certain groups of people. The evaluation of the data on the media use of the patients traces their subjective use of social media as well as their opinions on central content to get insight on how the use of the videos in question is integrated into their media activities. It becomes apparent that the trigger function of the videos cannot be explained by a consistent mode of reception. Further contextual variables must be taken into account to understand the phenomenon.","",""
"2023","The output imperative: productivity and precarity on YouTube","ABSTRACT Research into the video platform YouTube has argued that so-called creators are faced with difficult working circumstances, much like those in the rest of the cultural industries. Stories of ‘YouTuber burnout’ have circulated, indicating the consequences of trying to keep up with demands. This article demonstrates the existence of increasing pressures to produce fresh content on the platform, the output imperative, and offers tentative explanations. The article draws on analyses of the cultural industries, digital entrepreneurship, and organizational ecology to deliver a longitudinal analysis of the productivity of YouTube channels. Our sample contains data from app. 22,000 channels and their activities from 2008 to 2019. We focus on three productivity parameters, i.e., the number of videos uploaded, average video length, and total output produced. A series of quantitative analyses demonstrate both general and specific tendencies towards increased productivity during this period. Parts of the channel population saw relatively small changes, but some of the more productive strata of the population saw productivity increases above 800% over 10 years. We show that these developments have been driven primarily by new channels joining the platform and that existing channels tend to follow the benchmarks set by newcomers. This indicates the existence of steadily increasing demands for increased output to stay competitive. Our analyses thus demonstrate the existence of considerable production pressures on YouTube and we argue that this has exacerbated the already precarious position of creators on the video platform.","",""
"2023","Towards the engagement economy: interconnected processes of commodification on YouTube"," A dominant way for digital platforms to generate revenue has been through the sale of audiences to advertisers encapsulated by the idea of the attention economy. This model has been challenged in recent years due to competitive and political pressures on platforms. In this paper, we use YouTube as a case to understand how processes of commodification are changing on digital platforms. We demonstrate that YouTube furthers the commodification of content, audiences and creative labour by cultivating commercial interactions, standardising exchange mechanisms and constructing systems of trust. The platform enables producers and retailers to sell digital and physical goods to users, advertisers to capture audiences’ interest and brands to establish partnerships with producers. In sum, we show how YouTube not only monetises attention but commodifies all forms of engagement through its marketplaces with consequences for the precarity of users and producers on the platform. ","",""
"2023","MAKING A MEDIA CAREER ON AND BEYOND YOUTUBE: DIVERSITY IN PROFESSIONAL IDENTITIES OF YOUTUBE CREATORS","YouTube as part of a growing social media entertainment (SME) industry has taken various steps to professionalise, formalise and regulate the field of user-generated content and successfully integrated self-professionalised YouTube creators into an emerging creative workforce of SME. The industrialisation and professionalisation of YouTubing have created the assumption of a formalisation of professional identity as a YouTuber or a content creator in the SME industry. Contrary to this assumption, I argue that there is a divergence from fixed categories as it is not possible to fix permanently or define conclusively the professional identity as a YouTuber because conditions of content creator labour are precarious. In this paper, drawing upon qualitative data collected for my doctoral research, I investigate how creators who engage in self-governance as risk-bearing creative agents form their professional identities inside or outside YouTube careers and illuminate the diversity and ambivalence in their professional identities due to the precarious nature of their work. Despite being at different career stages and having a wide range of backgrounds, motivations, skills, and experiences, YouTube creators who participated in this project had something in common: They needed to be flexible in shifting between different professional identities and types of employment relations in order to make a media career on and beyond YouTube. This is because it is hard to imagine or maintain a single career path towards being a professional creator due to existing or future uncertainties.","",""
"2023","MANUFACTURING INFLUENCERS: THE REVOLUTIONARY ROLES OF MCNS (MULTI-CHANNEL NETWORKS) IN THE PLATFORM ECONOMY","This study examines how MCNs (Multi-Channel Networks) intervene in the platform economy by manufacturing influencers. Previous studies have explored the emergence of influencers and creators from various perspectives, including platformization, creative labor, and algorithmic power. However, little attention has been paid to another crucial player – MCNs which incubate and train influencers on an industrial scale. MCNs are firms and organizations that collaborate with influencers to facilitate the production, promotion, and monetization of creative content. They serve not only as incubators for micro-entrepreneurs and influencers looking to establish their businesses, but also as a key intermediary between influencers and other stakeholders on platforms. This study combines in-depth interviews with documented lawsuits to explore the role of MCNs in the platform economy, as well as their relationships with influencers. The findings suggest that MCNs significantly shape the platform economy through three strategies: manufacturing influencers, spreading industry lore, and exploiting creativity. On one hand, MCNs help established influencers maintain their success and reduce the risk of creativity while exploiting the labor of aspirants who struggle to enter the platform economy. As such, they constitute a power imbalance by providing business for successful influencers and increasing precarity for ordinary influencers. On the other hand, MCNs continue to expand their business scopes to meet the needs of various stakeholders, mainly platforms, advertisers, and brands. Consequently, MCNs have the ability to facilitate the relationship between these actors, industrialize aspiring influencers, and determine who can participate in creative labor.","",""
