"year","title","abstract","journal","doi"
"2012","User-Generated Warfare: A Case of Converging Wartime Information Networks and Coproductive Regulation on YouTube","User-generated content-sharing (UGC) platforms, such as YouTube, emerged as venues for competing wartime information and images among military, insurgent, and civilian user groups during the Iraq War. This article introduces user-generated warfare (UGW) as a theoretical concept to articulate this phenomenon and consider its implications for reshaping wartime information networks and flows outside of formal institutions. It is a variant of “netwar” that further locates this generative user activity within the sociotechnical infrastructure of the UGC platform. The present analysis examines an instance of UGW that highlights how user agency is configured through the coproduction of affordance and constraint via the YouTube platform and within a communicative context in which wartime user networks are converging outside formal channels.","",""
"2012","The institutionalization of YouTube: From user-generated content to professionally generated content"," This article explores the institutionalization of YouTube: its transformation from user-generated content (UGC) – oriented as a virtual village – into a professionally generated content (PGC) video site, especially after being purchased by Google. YouTube has influenced the traditional media environment, but at the same time this new medium imitates the rules of the old media, including legally managed distribution of broadcasting content and smooth links between content and commercials. YouTube constitutes an evolution of the present media milieu, rather than a revolution. On the other hand, the dominance of mainstream media is, to a degree, still compromised in UGC culture. The emancipatory dimension of UGC media (e.g. as democratic, creative outlet with high accessibility and online library potential) is discussed in the conclusion, not losing sight of the technological-economic limitations placed on its continuing promise. ","",""
"2015","YouTube pranking across cultures","Online pranking videos are common online and popular among middle-school students, teens and young adults. When we examined 200 YouTube examples of the Scary Maze Game prank, we explored the relationship between perpetrator, victim and witness, finding that while American children under age 12 were commonly featured as victims in Scary Maze Game prank videos, only rarely were German children represented as victims. U.S. videos also lingered on the pain of prank victims, even looping the emotional response of the victim to create an instant replay effect and using post-production techniques, including editing, music and title credits. As an expression of the schadenfreude that people experience when both enacting and viewing bad pranks, online pranking is a dimension of the dark side of participatory culture.","",""
"2015","Kids on YouTube: Technical identities and digital literacies","","",""
