"year","title","abstract","journal","doi"
"2000","Impact of the Internet on the politics of Cuba","In this paper, I examine the dramatic growth of the Internet and look at how this new communication paradigm has presented the government of Cuba with an opportunity to overcome the hegemony of the Western media and promote its own views on the world stage. I will also look at how the Internet is being used to promote Cuba as an upmarket tourist destination, tourism now being Cuba's most valuable source of foreign currency and, therefore, critical to its ailing economy.  Cuba's telecommunications infrastructure is poor and outdated which, when combined with the severe restrictions placed on the Cuban population, makes Internet access beyond the reach of most Cuban citizens. Cuban opposition groups, based mostly in the United States, do not face these barriers and, in the second part of this paper, I will examine how a number of these organisations are using the Internet to promote their anti-Government agendas and counter the state 'propaganda' machine.","",""
"2001","The Political Implications Of Digital Innovations: Trade-offs of democracy and liberty in the developed world","This paper addresses three issues: the potential trade-offs of democracy and liberty that the Internet may produce, the connection between real life and cyberspace, and the consequences for the conceptual apparatus of political science. It is argued that the Internet and real worlds are entwined, and thus classic political trade-offs remain pertinent. Important normative issues are addressed. It is established that the Internet is a nearly-neutral medium, so it is important how its development and effects are controlled. It is argued that a privately-controlled Internet would have negative implications for citizenship, political democracy and liberty.However, it is shown that existing Internet politics is significantly democratic, and if the 'net was used within a system similar to existing arrangements, i.e. with checks and balances, then one could optimistically foresee enhanced democracy. In this relatively unexplored but rapidly changing area of political life, this paper serves as a simple warning - public good, private bad - and justifies this in terms of the potential trade-offs of political citizenship versus market consumerism.","",""
"2001","The Internet and state control in authoritarian regimes: China, Cuba and the counterrevolution","","",""
"2002","ICANN and Internet Governance: Leveraging Technical Coordination to Realize Global Public Policy","The Internet Corporation for Assigned Names and Numbers (ICANN) was created in 1998 to perform technical coordination of the Internet. ICANN also lays the foundations for governance, creating capabilities for promulgating and enforcing global regulations on Internet use. ICANN leverages the capabilities in the Internet domain name system (DNS) to implement four mechanisms of governance: authority, law, sanctions, and jurisdictions. These governance-related features are embodied in seemingly technical features of ICANN's institutional design. Recognition of ICANN's governance mechanisms allows us to better understand the Internet's emerging regulatory regime.","",""
"2002","Digitisation and Its Asian Discontents: The Internet, Politics and Hacking in China and Indonesia"," Given its transnational character the Internet is often perceived as a technology that will challenge the frontiers of the nation-state. Asian governments, however, eagerly include the Internet in their policies, thereby inscribing this technology into the narrative of the nation-state. In this article I argue that such uses of the Internet to legitimise governments and their policies deserve as much attention as globalised movements that at times challenge such policies. More empirically grounded research - that moves beyond the utopian/dystopian, online/offline and virtual/real dichotomies - is important to grasp such contradictory uses of the Internet. Studies located outside the U.S. and Europe, the places that dominate Internet studies, will prove of crucial value in rethinking the roles of the Internet in society. ","",""
"2002","Keeping Out the Internet? Non-Democratic Legitimacy and Access to the Web","Non-democratic and democratic regimes alike have been attracted to the promise of the global information superhighway. However, the Internet contains a number of features which are potentially damaging to the legitimacy of incumbent non-democratic governments. The scope and ease of obtaining information on the World Wide Web provides the means for undermining one of the central pillars of non-democratic rule: centralized control over the domestic distribution of information and ideas. Furthermore, the communication capabilities available to Internet users assists in the creation of autonomous """"public spaces"""" which can threaten the political preeminence of non-democratic authorities.  Unfortunately for skittish regimes, designing solutions to the make cyberspace """"safe"""" for public use in order to preempt internal challenges to state authorities are hampered by the fact that the features which cause problems for non-democratic rulers are the same attributes which make the technology so attractive. I will examine several countries' history with the Internet, with particular attention paid to China, to illustrate the attractions of the Internet and the lengths to which officials have gone to make this technology politically reliable.","",""
"2003","Open Networks, Closed Regimes: The Impact of the Internet on Authoritarian Rule (Acknowledgements)"," None available ","",""
"2003","Open Networks, Closed Regimes: The Impact of the Internet on Authoritarian Rule (Table of Contents)"," None available ","",""
"2003","Open Networks, Closed Regimes: The Impact of the Internet on Authoritarian Rule (Chapter 1 The Conventional Wisdom: What Lies Beneath?)"," None available ","",""
"2003","Open Networks, Closed Regimes: The Impact of the Internet on Authoritarian Rule (Forward)"," None available ","",""
"2003","Mutiny on the bandwidth: the semiotics of statehood in the internet domain name registries of Pitcairn Island and Niue"," The internet has evolved to have a complex top-level domain name system, in which generic top-level domains such as .com and .org coexist with country-code top-level domains such as .UK and .JP. In this article, the history and significance of this hybrid naming system is examined, with specific attention directed to the manner in which it simultaneously reproduces claims to globalism, state sovereignty, and the presumption of United States hegemony. It is found that the domain name system affirms the centrality of the sovereign state while concurrently challenging its underlying basis in an idealized nexus of nation, government, and territory. These themes are explored through case studies of two Pacific island microstate domains: .PN (Pitcairn Island) and .NU (Niue). ","",""
"2004","The Sources of Laws: Policy Dynamics in a Digital and Terrorized World","We often assume that policy and laws are the outcome of national deliberative discourse. As we have seen with other domains such as intellectual property and trade, policies that influence privacy and civil liberties are increasingly resulting from international policy dynamics. This article presents a number of these policy mechanisms used to take advantage of international dimensions of our current environment. These mechanisms include policy laundering, modeling, and forum shifting. Using these mechanisms, policies are being developed outside of national deliberative forums and then adopted locally in the interests of national governments. A number of policy instances are presented, tracing the influence of national and international actors, and the implications for national discourse. The article concludes with discussion of some implications for an open society.","",""
"2004","Internet Governance in Transition: Who Is the Master of This Domain? by Daniel J. Pare. Lanham, MD: Rowman and Littlefield, 2003. 208 pp. $26.95 paper. ISBN 0-74251-846-9","It is accepted by many that the Internet world was a relatively closed community until the late 1980s, composed principally of computer scientists. Stakeholders were highly homogeneous and tightly knit. Their goals were similar: technological superiority and workability. Therefore, interpretative flexibility among stakeholders was very low; it was relatively easy to build consensus in the community. Users and developers tended to respect each other, in large part because they had dialogues continuously via e-mail and mailing list. Many users shared an understanding regarding how the network worked, where the major trade-offs were located, and what were its urgent problems. If this were the end of the story, the matter would be relatively simple: The Internet is an open, flexible network and no formal governance is necessary. However, due to the expansion in scale of the Internet, commercialization, and globalization during the 1990s, the number of stakeholders increased and heterogeneity among stakeholders widened. As a result, it has become much more difficult to reach consensus and enforce rules. The system seems to be losing its coordination capacity. The legal authority of informal governing body is questionable; many commercial interests are taking important seats in the IETF (Internet Engineering Task Force) and other Internet governance organizations. Domain name governance has not been an exception. Daniel Pare’s book Internet Governance in Transition: Who Is the Master of This Domain?, is about governance of the Internet and its institutional restructuring. The book analyzes the history of domain name governance, profiles the numerous social actors, exposes power struggles and behind-the-scene moves, and sheds light on the complex sociopolitical processes of decision making and policy formulation at both domestic and international levels. The purpose of the book, according to the author, is to describe what social actors actually do rather than what they should do. The book has seven chapters, each of which contributes to the revelation of the underlying dynamics of the institutional reconfiguration of domain name governance. After the introduction, which explains highlights the principal line of discussion, Chapter Two effectively brings the lay reader up to speed regarding the historical, technological, and political background of domain name governance. Pare first explains what the domain name system (DNS) is and how it works. Then he examines the underlying values that influenced the development of this hierarchical distributed architecture, and the administrative norms that evolved with it. Chapter Three sets out the theoretical basis for analyzing the Internet governance process. Pare divides previous literature on Internet governance into three approaches: (1) the commons school of thought, which regards “governance” as a means of top-down or hierarchical coordination mechanisms in order to meet regulatory ends; (2) the decentralized school of thought, which tends to espouse “governance” as a device to achieve a networkbased, decentralized coordination mechanism; and (3) the process-based approach, which primarily focuses on “the processes by which architecture may influence regulatory procedures and the types of social orders that may be promulgated” (p. 57). The author claims that all three approaches fail to appreciate the sociopolitical dynamics of governance processes. As an alternative analytical framework, Pare proposes the power-oriented approach, which is explicated as a three-tiered conceptual framework: (1) surface-tier politics, which imply day-to-day politics or negotiations between participants; (2) deep-structure politics, which “are seen to inform collective interpretive frames and the cognitive maps of the participants” (p. 61); and (3) metalevel politics, which are “the internetworking architecture","",""
"2004","Factors affecting Internet development: An Asian survey","This study examined the relationship between the Internet development and various social, economic and political factors that are hypothesized to affect the Internet growth. Using secondary data for 28 sampled Asian countries, this study tested seven hypotheses about the impact of various factors on Internet growth. The findings show that the Internet penetration is related to a country’s wealth, telecommunication infrastructure, urbanization and stability of the government, but not related to the literacy level, political freedom and English proficiency.","",""
"2004","Ideology and policy: Notes on the shaping of the Internet","This paper considers some of the ideologies that are shaping Internet policies. It addresses the priorities of international policy initiatives and identifies their discursive constructions. It takes stock of some of the most characteristic policy directions that seek to define the Internet and its uses within an agenda of predominant privatisation.","",""
"2005","Which Internet Policy? Assessing Regional Initiatives in Spain","We examine the effect of public policy on the growth of Internet use. Using a decentralized country—Spain—as an example, we compare the 17 Spanish regions to test different Internet policy designs, taking into account the quality and number of specific programs promoted by regional governments, as well as the presence or absence of strategic planning in each region. We treat the percentage of Internet users as a dependent variable to compare its diffusion in different territories. Our findings show that educational levels and economic differences explain about half of the variations observed. Furthermore, the regional policies play a significant role in explaining regional variations. We investigate which public policy instruments are more significant for the development of the Internet, and find that focused policy intervention and complex policy initiatives are more significant than other policy instruments in explaining the increase in the percentage of Internet users.","",""
"2005","The politics of the web: the case of one newsgroup"," The internet is often portrayed as a borderless liberal space of equal opportunities and unconstrained communication. By contrast, this article emphasizes the profoundly contested nature of the communication on ‘the web’. Based on a short period of close observation of one internet newsgroup, this study illuminates specific discursive strategies by means of which domination, cooption, resistance and exclusion enter the virtual space of internet communication. In addition, the liberal character of the internet is observed to be not so much due to the reign of liberal principles as due to the strategic advantage enjoyed by ‘liberal actors’ in newsgroup exchanges. Hence, the study illuminates major mechanisms of the ‘liberal domination’ in the net as well as the operations of power in contemporary liberal societies at large. ","",""
"2006","Internet governance in the UK"," Discussion of internet governance has been shaped by three myths: that the market can decide, that the Internet is different to 'legacy' media and that national governance is unimportant. The author challenges these three myths through an examination of internet governance in the UK in 2003/4 and argues that the internet is a layered, not vertically integrated, medium of communication, that three modes of governance prevail hierarchy, markets and networks (self-regulatory). The layers of the UK internet are examined, their governance identified and evaluated, and the conclusion drawn that network governance is a distinctive, but not universally present, characteristic of UK internet governance. Also, contemporary, well-functioning arrangements may be unstable, and stronger hierarchical governance may be required in the future. ","",""
"2006","The filtering matrix: Integrated mechanisms of information control and the demarcation of borders in cyberspace","Increasingly, states are adopting practices aimed at regulating and controlling the Internet as it passes through their borders. Seeking to assert information sovereignty over their cyber–territory, governments are implementing Internet content filtering technology at the national level. The implementation of national filtering is most often conducted in secrecy and lacks openness, transparency, and accountability. Policy–makers are seemingly unaware of significant unintended consequences, such as the blocking of content that was never intended to be blocked. Once a national filtering system is in place, governments may be tempted to use it as a tool of political censorship or as a technological “quick fix” to problems that stem from larger social and political issues. As non–transparent filtering practices meld into forms of censorship the effect on democratic practices and the open character of the Internet are discernible. States are increasingly using Internet filtering to control the environment of political speech in fundamental opposition to civil liberties, freedom of speech, and free expression. The consequences of political filtering directly impact democratic practices and can be considered a violation of human rights.","",""
"2006","Cultural diversity in cyberspace: The Catalan campaign to win the new .cat top level domain","In September 2005 ICANN approved the first top–level Internet domain to be dedicated to a particular human language and culture: ‘.cat’. This paper describes the history of the Catalan campaign to win the ‘.cat’ domain against political opposition from the former conservative Spanish government and the reluctance of some decision–makers within ICANN circles. While ‘.cat’ creates a precedent for greater use on the Internet of ‘minority languages’, there are significant hurdles for other candidates for language–based top–level domains. The paper discusses the concomitant factors needed to support the greater use of any minority language on the Internet.","",""
"2006","Who supports Internet censorship?","Censorship is the moral or legislative process by which society “agrees” to limit what an individual can do, say, think, or see. Recent attempts to regulate, i.e., censor, what is viewed on the Internet have polarized the general population. Unfortunately, beyond the anecdotal, the characteristics of those who support Internet censorship are unknown. In this study, the support for Internet censorship is empirically analyzed using survey data. Notwithstanding the potential limitations of survey data, the results indicate the characteristics of those who tend to favor and disfavor Internet censorship. Specifically, concerns over pornography and concerns over government regulation on the Internet are the two most polarizing elements of the relative support for censorship, which suggests that the debate over this issue will not be easily resolved.","",""
"2007","Democratic and Anti-Democratic Regulators of the Internet: A Framework","We employ Lessig's framework of regulation to conceptualize the relationship between the Internet and democracy. Lessig defines four classes of regulators, forces that control and define systems such as the Internet. They are markets, architectures, norms, and laws. We propose that a “democratic regulator” is a force that serves to enhance civil or political liberties. And we argue by example that there are democratic (and, indeed, anti-democratic) regulators that control aspects of cyberspace. Expressing the democratic effects of the Internet in this manner may prove useful for future comparisons across existing Internet and democracy theories, especially in the realm of quantitative analyses.","",""
"2007","The Internet and state control in authoritarian regimes: China, Cuba and the counterrevolution (originally published in August 2001)","It is widely believed that the Internet poses an insurmountable threat to authoritarian rule. But political science scholarship has provided little support for this conventional wisdom, and a number of case studies from around the world show that authoritarian regimes are finding ways to control and counter the political impact of Internet use. While the long-term political impact of the Internet remains an open question, we argue that these strategies for control may continue to be viable in the short to medium term.   Many authoritarian regimes translate a long and successful history of control over other information and communication technologies into strong control of Internet development within their borders. Potential challenges to the state may arise from Internet use in several areas: the mass public, civil society, the economy, and the international community. Authoritarian states will likely respond to these challenges with a variety of reactive measures: restricting Internet access, filtering content, monitoring online behavior, or even prohibiting Internet use entirely. In addition, such states seek to extend central control through proactive strategies, guiding the development of the medium to promote their own interests and priorities. Through a combination of reactive and proactive strategies, an authoritarian regime can counter the challenge posed by Internet use and even utilize the Internet to extend its reach and authority.   In this paper we illustrate how two authoritarian regimes, China and Cuba, are maintainng control over the Internet's political impact through different combinations of reactive and proactive strategies. These cases illustrate that, contrary to assumptions, different types of authoritarian regimes may be able to control and profit from the Internet. Examining the experiences of these two countries may help to shed light on other authoritarian regimes' strategies for Internet development, as well as help to develop generalizable conclusions about the impact of the Internet on authoritarian rule.","",""
"2007","Digitisation and Its Asian Discontents: The Internet, Politics and Hacking in China and Indonesia (originally published in September 2002)","  Given its transnational character the Internet is often perceived as a technology that will challenge the frontiers of the nation-state. Asian governments, however, eagerly include the Internet in their policies, thereby inscribing this technology into the narrative of the nation-state. In this article I argue that such uses of the Internet to legitimise governments and their policies deserve as much attention as globalised movements that at times challenge such policies. More empirically grounded research - that moves beyond the utopian/dystopian, online/offline and virtual/real dichotomies - is important to grasp such contradictory uses of the Internet. Studies located outside the U.S. and Europe, the places that dominate Internet studies, will prove of crucial value in rethinking the roles of the Internet in society.  ","",""
"2008","Welsh Without Frontiers? Use of the Community Metaphor in Wales's Sponsored Top-Level Domain Bid","This article assesses Wales's chance for winning the sponsored top-level domain (sTLD). cym through a comparison with Catalonia's .cat campaign. sTLDs are considered important promotional tools for regions like Wales and Catalonia because of perceived benefits for the online “language and culture community,” and as such, the community metaphor is employed extensively in both campaign. Although Wales has support comparable to Catalonia from government, individuals, and organizations, subtle differences in how dotCYM (the web site of Wales's campaign) promotes .cym's role in the Welsh online community may hinder the bid. Comparative discourse analysis suggests that dotCYM believes .cym will help define a potential Welsh online community, rather than one currently existing, and reveals confusion about who should be in this community. Finally, dotCYM is inconsistent in its use of the community metaphor, stating that .cym will help create “Welsh without frontiers,” a notion contradictory to some scholars' understanding of community.","",""
"2008","Hierarchy to homeostasis? Hierarchy, markets and networks in UK media and communications governance","The author considers propositions that market and network governance are supplanting hierarchical governance in contemporary UK media and communications, Liberalisation of media and communication markets, adoption of new public management in publicly owned bodies, “outsourcing” of regulation from statutory to self-regulatory bodies and “fourth way” co-ordination of Internet institutions suggest that the importance of markets and networks as potentially “homeostatic” modes of governance is growing. However, hierarchical governance remains important, the Communications Act 2003 prescribes more than 260 duties for the statutory regulator, Ofcom, and the BBC makes a major intervention in broadcasting markets. All three forms of governance fail in distinctive ways and the author argues both that the potential for network governance failure is less well recognised than are market and hierarchy failures and that the complexity of established governance arrangements itself constitutes a distinctive form of failure of governance.","",""
