"year","title","abstract","journal","doi"
"2016","The Tube on YouTube: TV Series, Media Strategies, and User Tactics in a Transmedia Environment","This study analyzes the traffic generated on YouTube around television series. We selected a sample of 314 short YouTube videos about 21 Spanish TV series that premiered in 2013 by Spain’s three most popular mainstream television networks (Telecinco, Antena 3, and La1). These videos, which together received more than 24 million views, were classified according to two key variables: the nature (official or nonofficial) of the YouTube channel on which they were located and the exclusivity of their content (already broadcast on TV or Web exclusive). The analysis allows us to characterize the strategies used by TV networks on YouTube and the activity of fans as well as their efforts in the construction of a transmedia narrative universe around TV series.","",""
"2016","The video bubble"," Multichannel networks (MCNs) are intermediary companies that sell advertising, cross-promote affiliated YouTube channels, and develop video brands. They have often been criticized as driving YouTube’s commercialization, a seemingly recent phenomenon that sees hithertho informal practices of video making and sharing being increasingly formalized. This article challenges such beliefs about YouTube’s sudden makeover, based on archival evidence that allows to reconstruct YouTube’s long commercial history and on fresh field study data relating to one specific MCN and its content providers. Debunking the myth of ‘cocreation’, the article uses simple analogies – market, infrastructure, and franchise – to describe how MCNs contribute to establish asymmetrical relations between users and emergent industry systems online. It demonstrates how MCNs since 2006 have streamlined and standardized production inputs, reorganized cost per mille–based ad sales, and redefined the value of video in line with a more general financialization of media markets. The methodological framework for this empirical inquiry into YouTube’s first decade is based on economic sociology and infrastructure studies, and the argument itself framed by critical research on ‘connected viewing’, a larger trend across the media industries to integrate digital technology and socially networked communication with traditional screen media practices. ","",""
"2016","YouTube, multichannel networks and the accelerated evolution of the new screen ecology"," In attempting to break with a ‘fall from grace’ narrative that may structure analysis of the rapid professionalization and monetization of previously amateur online video content on the main global platform, YouTube, this article outlines histories of key institutions in the new screen ecology as outcomes of the increased interpenetration of very different, often clashing industry cultures. Google/YouTube, Apple’s iTunes, Netflix, Amazon, Yahoo! and Facebook (‘NoCal’) are largely Internet ‘pure-play’ companies, whilst Hollywood’s incumbents (‘SoCal’) practice time-honoured mass media and premium content strategies. The ‘history of the present’ of the new screen ecology is the history of the clash of these cultures. The less than 10-year history of Google’s YouTube can be written as a history of Google seeking to come to terms with the conditions of possibility for entertainment, content and talent development from its base as an IT company dedicated to scale, automation, permanent beta, rapid prototyping and iteration. These efforts reflect both continuities and contestations with traditional media models, particularly business models. As emerging intermediaries in the middle of the convergent space between NoCal and SoCal, multichannel networks’ (MCNs’) placement sees them needing to innovate on both the NoCal and SoCal side. On the former side, MCNs are attempting to provide value-added services superior to basic YouTube analytics, with programmatics and pioneering attempts at management of scale and volume. On the latter side, they are managing a quite different class of entry- to mid-level talent, who bring successful audience development and clear ideas about the roots of their success with them. The new screen ecology is a space of unimagined scale and scope of flourishing online creativity and culture, which is at the same time turbulent and precarious for creators and MCNs alike. ","",""
"2016","The cultural logic of digital intermediaries"," How has YouTube evolved as a cultural and commercial infrastructure? What institutional forms has it produced? The present article takes up these questions through a discussion of multichannel networks (MCNs) and their role within the digital video system. MCNs are a new breed of intermediary firm that link entrepreneurial YouTubers with the advertising, marketing and screen production industries. This article considers the functions of MCNs vis-à-vis the existing constellation of screen industry professions, including talent agents, managers and media buyers, who perform similar functions offline. Combining structural analysis of the MCN industry with an assessment of its cultural impacts, I show how Google’s decision to open the YouTube back-end to third-party intermediaries is subtly changing the digital video ecology. ","",""
"2016","DIY videos on YouTube: Identity and possibility in the age of algorithms","This paper analyzes interviews with individuals discussing their experiences of searching for and watching DIY videos on YouTube. By exploring the entanglement of individuals’ search practices and the algorithmic underpinnings of the platform, this paper examines how experiences on Web 2.0 platforms can work to narrow, rather than widen, information worlds. Contributing to ongoing conversations in critical algorithm studies, this paper illustrates how even mundane practices like watching home repair videos on YouTube can play a role in identity-making and the shaping of modern subjectivities.","",""
"2016","The socio-technical architecture of digital labor: Converting play into YouTube money"," This article uses the case of video game commentators and examples from research to highlight implications for conceptualizing the concept of “architectures of digital labor.” The concept draws attention not only to the social practices that position activities straddling labor/leisure into a commercial framework but also to the technological platforms that make that possible in a seemingly invisible fashion. The main analytical lens is that of “affordances.” It is used to map how technological features designed into YouTube create a set of probable uses/meanings/practices for users while serving YouTube’s business interests. The analysis is transferable to other social web platforms whose central business model focuses on user-generated content (UGC). ","",""
"2017","Being an online celebrity: Norms and expectations of YouTube’s beauty community","This paper is based on 22 months of online fieldwork examining YouTube’s beauty community, specifically the beauty guru Bubz, her uploaded content, and user comments. We aim to conceptualize central community-specific dynamics and practices, particularly those related to self-presentation and identity management and their affordances for legitimized online popularity. We explain how the guru’s successful online persona is based on a performative blend of relatable, down-to-earth values paired with a more aspirational and worthy of emulation side. Being an “ordinary-user-turned-famous” is seemingly an advantage given the high relevance of authenticity when judging online celebrities. However, her inherent ordinariness also increases expectations of trustworthiness and honesty, precisely because she is, and continuous to perform daily, a regular user.","",""
"2017","A case for digital squirrels: Using and preserving YouTube for popular culture research","YouTube users around the globe upload 400 hours of content every 60 seconds, a quantity that leads to descriptions of the platform as “the world’s largest archive of moving images.” We look at how the myth of YouTube as an archive arises and evaluate sources that show its shortcomings in this respect. These discussions ground our recommendations for developing new practices for archiving YouTube content to support scholarly research, a recommendation that starts with a squirrel.","",""
"2017","Evoking presence in vlogging: A case study of U. K. beauty blogger Zoe Sugg","In this paper, we explore how video blogs (vlogs) evoke the sense of “presence”, by examining famous U. K. video blogger (vlogger) Zoe Sugg’s “Haul” videos. As a result of this analysis, we argue that vlogs could evoke presence through two main elements: sensory and social elements. Sensory elements refer to colour, camera usage, video image and sound qualities. Social elements are eye contact, facial expression, conversation and gesture. Past studies have rarely applied “presence” theory to vlogging. As vlogs have become a popular format on the Internet, this study could provide new directions for research into the experiences of vlog viewers. It also offers video bloggers initial understandings of how their content could affect their popularity by altering audiences’ feelings of presence.","",""
"2017","Classroom Instruments and Carpool Karaoke: Ritual and Collaboration in Late Night’s YouTube Era"," This article uses two recurring late-night talk show segments, “Classroom Instruments” (NBC’s The Tonight Show Starring Jimmy Fallon) and “Carpool Karaoke” (CBS’s The Late Late Show with James Corden), to explore how programming strategies are changing in response to late night’s adoption of YouTube as a distribution platform. Through close analysis of these segments, the series’ YouTube presences, and industry perspective, the article explores how late night’s digital turn has embraced historical qualities of late-night programming that have proven compatible with YouTube as a platform, with these segments prioritizing collaboration common in the YouTube community at large. It goes on to analyze how this content is being “re-ritualized” for online audiences, disconnecting the segments from their linear broadcast context and reframing them for nonlinear audiences in light of this once secondary space of distribution increasingly becoming the primary space of consumption in late-night talk’s “YouTube era.” ","",""
"2018","YouTube channels, uploads and views"," To this date, it is difficult to find high-level statistics on YouTube that paint a fair picture of the platform in its entirety. This study attempts to provide an overall characterization of YouTube, based on a random sample of channel and video data, by showing how video provision and consumption evolved over the course of the past 10 years. It demonstrates stark contrasts between video genres in terms of channels, uploads and views, and that a vast majority of on average 85% of all views goes to a small minority of 3% of all channels. The analytical results give evidence that older channels have a significantly higher probability to garner a large viewership, but also show that there has always been a small chance for young channels to become successful quickly, depending on whether they choose their genre wisely. ","",""
"2018","Exposing convergence: YouTube, fan labour, and anxiety of cultural production in <i>Lonelygirl15</i>"," As one of the first social media franchises, Lonelygirl15 (LG15) played a surprisingly important role in transforming YouTube into a legitimate storytelling platform and a site of cultural production worthy of commercial attention. While LG15 has been hailed as one of the first community-based storytelling initiatives that harnessed the power of participatory culture, the anxiety of creating an economically sustainable story led to the careful management of fan efforts and the strict definition of the boundaries of the LG15 canon. In this article, I argue that LG15 demonstrates one of the most worrisome aspects of YouTube’s monetization strategies, the commodification of labour in which advertisers and media companies exploit users for profit. This exploitation does not necessarily come in the form of loss of monetary value but through the alienation of fans from their productive labour. As such, the production of LG15 presents a powerful critique of convergence culture. It demonstrates that the movement of fans to the centre of cultural production does not necessarily mean empowerment but may also suggest exploitation. ","",""
"2018","Researching YouTube","As famously known, YouTube was founded in February 2005 by three PayPal employees. Less than 2 years later, Google acquired YouTube for a fee of $1.65 billion, at a point when the major significance of a raft of new websites based on user-generated content, such as Wikipedia, Myspace and Facebook, was becoming increasingly apparent. The cover of Time magazine duly announced ‘You’ as the winner of their Person of the Year Award for 2006, alongside a reflective mirror within a YouTube style of computer screen interface (Time, 2006). While many social media proved to be ephemeral, YouTube continues to rapidly expand and has become the second most visited website in the world. It has thereby established a unique role as a repository of popular culture, creating a diachronic archive over time as well as synchronically expanding in its scope. In his paper on ‘YouTube Channels, uploads and views’ published in this special issue, Matthias Bärtl estimates that by 2016 the total number of videos hosted on the site was around four billion. Showing how the quantity of content uploaded on YouTube has expanded exponentially over the years, Bärtl also demonstrates the waning probability of being in the top 3% of the most watched videos, which attract 85% of views. Fifty percent of videos uploaded in 2016, attracted 89 views or fewer. Even so, some new channels were able to attract a lot of attention with videos in the Comedy, Entertainment, Gaming, how to and style categories having an above-average chance of reaching the top 3%. But this distribution has changed over time. Entertainment has been the most popular category only since 2013, while the popularity of News and Politics fluctuates, with peaks occurring during the political upheavals of 2008 and 2016 as well as in response to shorter news cycles. The majority of newly created channels since 2010 have been in the People and Blogs category, reaching close to 75% in 2016. Despite the attention these channels have attracted from journalists and academics fascinated by the development of a new","",""
"2018","Social Media Sellout: The Increasing Role of Product Promotion on YouTube"," Since its foundation in 2005, YouTube, which is considered to be the largest video sharing site, has undergone substantial changes. Over the last decade, the platform developed into a leading marketing tool used for product promotion by social media influencers. Past research indicates that these influencers are regarded as opinion leaders and cooperate with brands to market products on YouTube through electronic-word-of-mouth mechanisms. However, surprisingly little is known about the magnitude of this phenomenon. In our article, we make a first attempt to quantify product promotion and use an original dataset of 139,475 videos created by German YouTube channels between 2009 and 2017. Applying methods for automated content analysis, we find that YouTube users indeed are confronted with an ever-growing share of product promotion, particularly in the beauty and fashion sector. Our findings fuel concerns regarding the social and economic impact of influencers, especially on younger target groups. ","",""
"2019","Jean Burgess and Joshua Green, YouTube: Online Video and Participatory Culture (Second Edition)","","",""
"2019","LEVERAGING TRUST: YOUTUBE ENTERTAINERS AND THE ROLE OF PROBLEM-SOLVING IN ENGENDERING TRUST.","This paper aims to better understand the role that problem-solving plays in building the trust necessary to sustain online fan audiences, and so support the careers of influential social media entertainers. Problem-solving in this context means a video, where the theme deals with the problems of modern life experienced by young fans. A mixed methods approach – in this case in-depth interviews, discourse analysis and participant observation at YouTube Creator Day events – is used to better leverage the strengths of each method and triangulate results. Sample size is at least 20 YouTubers at the most culturally significant, artistic end of the spectrum with an average of at least 1mn subscribers, established TV producers and Multi-Channel Network leaders. Preliminary results suggest that leading YouTube creators – including A-listers – use a conscious strategy of identifying the problems fans experience, so establishing trust and building audiences for their videos around their own solutions. Moreover, trust is engendered through two main means say these Australian YouTubers: first, the considerable time creators spend listening to their fans across creators’ YouTube, Twitter, Facebook and Patreon channels; and second, via online and analogue interactions with fans that open their lifeworld’s to the creator, and in turn shape the themes of their short video products. This phenomenon of collaborative problem-solving, independent of traditional state, school or family structures, represents an important shift with significant potential for youth agency in an emergent public sphere.","",""
"2019","Product placement on YouTube: An explorative study on YouTube creators’ experiences with advertisers"," During its process of diffusion, YouTube has become increasingly attractive for advertisers, not only in terms of classical commercials (like pre-roll ads) but also in terms of product placement opportunities. This article aims to explore the processes between YouTube creators and advertisers concerning product placement enquiries. For this purpose, YouTube creators from Germany ( n = 57) answered an online survey about their experiences with advertisers. The creators covered a wide range of YouTube channel genres (beauty, fashion, comedy, gaming, cooking) and differed in number of subscribers. Some creators who took part in the survey had less than 20,000 subscribers, others had between 20,000 and 500,000 subscribers and still others had more than 500,000 subscribers. How often do YouTube creators use product placement? Is paid-for placement an important source of finance for them? How professional are the relations and processes between YouTube creators and advertisers? Before presenting and discussing the results of the empirical survey of the current use of product placement, a brief history of how YouTube has become a marketing space for advertisers is provided. ","",""
"2019","YouTube, ageing and PJ Harvey: An ‘everyday’ story of the erasure of age"," Ageing is starting to matter in popular cultural studies but the matter of ageing within YouTube is, at present, unwritten. This article is an attempt to start that process. YouTube hosts the music video for PJ Harvey’s single release The Community of Hope (2016) . Shot by Seamus Murphy, it shares screen space with official music videos from Harvey’s 23-year career. Raising questions about the relationship between her past and present, this article examines the link between YouTube and ageing through two concepts, repetitive circularity and the flat archive. These rely and inform each other in a process that prioritizes the presence of youthfulness through the absenting of age, whereby the ageing body is erased from a popular cultural forum. YouTube’s ‘wallpaper of the past’ has a nagging impact on how we might read the body’s progress through time, in particular, how it ages. Tackling the paucity of work on ageing as it surfaces within the changing topographies of popular music encounters, the article considers how ageing is presented within a digital environment such as YouTube and concludes that the story is one of age erasure. ","",""
"2019","The case of the top Spanish YouTubers: Emerging media subjects and discourse practices in the new media ecology"," The objective of this article is to propose a first exploratory analysis of the Spanish YouTubers’ main productions and practices. Following the description of the emergence of YouTube in the context of media ecology, the article presents a general overview of the top 10 Spanish YouTubers’ production based on quantitative data. The study continues with a semiotic/discursive analysis of their audio-visual production’s main distinctive traits. As traditional television is imitating nowadays these new media expressions, this article also addresses the aesthetics and grammar of Yutubers, a TV program produced by Comedy Central that simulates the Spanish YouTubers channels’ aesthetics and language. The analysis concludes with a discussion on the study’s findings and a series of questions about these new media subjects. ","",""
"2019","YouTube: Online video and participatory culture","","",""
"2019","Negotiating Collaborations: BookTubers, The Publishing Industry, and YouTube’s Ecosystem"," BookTubers (from the acronym book + YouTuber) have become key players for the publishing industry, given their influence on children and teens to promote reading and book consumption. Based on an 18-month digital ethnography that combines direct observation, digital interactions on YouTube channels, and other social media and semistructured interviews with 17 Spanish-speaking BookTubers, this study uses Pierre Bourdieu’s concepts of field and capital to analyze how BookTubers negotiate their practices with other agents of the publishing world. This article characterizes the challenges the Spanish-language publishing industry is facing in the context of digitalization to attract readers; describes the position that BookTubers have within the YouTube ecosystem, and how they relate with the platform’s actors, politics, and affordances; and analyzes the exchanges that BookTubers establish with publishers—often referred as collaborations—and their implications for their autonomy. This case study helps to understand how platformization allows new agents to transfer capital gained in social media to other cultural industries. ","",""
"2020","Jean Burgess and Joshua Green, YouTube: Online Video and Participatory Culture (2nd edition)","","",""
"2020","Louise Ha (Ed.), The Audience and Business of YouTube and Online Videos","","",""
"2020","YouTube: Online Video and Participatory Culture","The second edition of YouTube: Online Video and Participatory Culture by Burgess and Green is an updated version of their 2007 study that was released just two years after YouTube was founded. Whil...","",""
"2020","Gaining trust: the articulation of transparency by You Tube fashion and beauty content creators"," This article proposes a new typology of transparency markers in fashion and beauty You Tube videos. It looks at how online content creators disclose the process of selecting and featuring products in their videos and analyses their discursive performance of transparency. It argues that these content creators employ a mix of routines of transparency, authenticity and independence, which they perform simultaneously, constructing themselves as trustworthy. The article suggests that, although restricted in both their extent and regularity, these tactics are complex and offer a glimpse on some of the processes that shape content in beauty and fashion media, which are not normally acknowledged in the magazine press. The article contributes to a better understanding of the manifestation of transparency in new media forms. ","",""
"2020","FOLLOW THE MONEY: A LARGE-SCALE INVESTIGATION OF MONETIZATION AND   OPTIMIZATION ON YOUTUBE","While YouTube has become a dominant actor in the global media system, the relationship between platform, advertisers, and content creators has seen a series of conflicts around the question of monetization. Our paper draws on a critical media industries perspective to investigate the relationship between YouTube’s evolving platform strategies on the one side and content creators’ tactical adaptations on the other. This concerns the search for alternative revenue streams as well as content and referencing optimization seeking to grow audiences and algorithmic visibility. Drawing on an exhaustive sample (n=153.770) of “elite” channels (more than 100.000 subscribers) and their full video history (n=138.340.337), we parse links in video descriptions to investigate the appearance and spread of crowdfunding platforms like Patreon, but also of affiliate links, merchandise stores, or e-commerce websites like Etsy. We analyze the evolution of video length and posting frequency in response to platform policy as well as visibility tactics such as metadata and category optimization, keyword stuffing, or title phrasing. Taken together, these elements provide a broad picture of “industrialization” on YouTube, that is, of the ways creators seek to develop their channels into media businesses. While this contribution cannot replace more qualitative, in-depth research into particular channels or channel groups, we hope to provide a representative picture of YouTube’s elite channels and their quest for visibility and success from their beginnings up to early 2020.","",""
