"year","title","abstract","journal","doi"
"2018","Authoritarian Practices in the Digital Age| Blocking the Bottleneck: Internet Shutdowns and Ownership at Election Times in Sub-Saharan Africa","The Internet is often portrayed as offering new communication and information channels resistant to state control because of its decentralization. At the same time, the Internet relies on a hierarchical physical infrastructure that, connecting the individual customer to the Internet, provides states with control opportunities. We argue that ownership of the Internet infrastructure, in particular Internet service providers (ISPs), is critical to understanding state Internet control because most direct forms of control require ISPs to comply with government requests. Using qualitative comparative analysis, we systematically link documented Internet shutdowns in sub-Sahara African countries to configurations of ISP state majority ownership, regime type, and election violence. The results support a positive relationship between a temporary halt of Internet provision and ISP majority ownership by authoritarian states when facing election-related violence. Our study underlines the importance of varying ownership structures in explaining political effects of Internet penetration, including its role in challenging authoritarian rule.","",""
"2018","Authoritarian Practices in the Digital Age| Understanding Internet Shutdowns: A Case Study from Pakistan","This article provides an overview of Internet shutdowns in Pakistan, which have become an increasingly common phenomenon, with 41 occurring between 2012 and 2017. It argues that to understand how shutdowns became normalized in Pakistan, it is necessary to look at the specific dynamics of how the shutdowns take place. In doing so, the concept of communicative ruptures develops to better understand intentional government shutdowns of communications. The article argues that strategic prevention of mobilization is key for short-term shutdowns, whereas long-term shutdowns can be better explained by looking at disciplinary mechanisms and denying the existence of “others.” The article then discusses Internet shutdowns in the wider context of authoritarian practices before concluding with the urgent need for further research on this topic, both in Pakistan and beyond.","",""
"2018","Can the Internet Aid Democratic Consolidation? Online News and Legitimacy in Central and Eastern Europe","Since the fall of communism in 1989, many formerly communist countries in Central and Eastern Europe have undergone a tremendous amount of social, political, and economic change. In the nearly 30 years after communism, these countries have become democratic and integrated into the European Union. Despite these changes, the consolidation of democracy is in question as citizen trust in government remains low and nationalist populism has risen. Given that other studies have shown that online media can affect attitudes toward government and that a massive technological revolution has occurred alongside democratization, it is imperative to better understand whether the Internet can aid consolidation by making citizens more supportive of democratic governance. This study uses Eurobarometer data to evaluate this question empirically and finds that online news consumption leads to more positive evaluations of government in the region.","",""
"2018","Authoritarian Practices in the Digital Age| Information, Security, and Authoritarian Stability: Internet Policy Diffusion and Coordination in the Former Soviet Region","This article examines Internet policies across the former Soviet region, showing that many of the region’s nondemocratic regimes have adopted similar approaches to control Internet content and use within their territories. The implication that specific control practices are diffusing or being coordinated on within the region is substantiated by close examination of particular approaches and their origins. While these states have made relatively limited use of static content censorship, alternative, less overt controls have spread across the region. Tracing the roles of diffusion and coordination mechanisms, the article demonstrates how, even as overall Internet repression levels have increased, the particular legal frameworks, technical systems, and other control practices used have been deeply influenced by complex regional interdependencies.","",""
"2018","The once and future internet: infrastructural tragedy and ambiguity in the case of IPv6","ABSTRACT The Internet as we currently recognise it was institutionally established in 1983 when all hosts connected to the then ARPANET were required to have adopted the relatively new Transmission Control Protocol/Internet Protocol (TCP/IP) technologies. Thirteen years later, in 1996, a replacement standard was established for the IP protocol, to resolve key anticipated technical problems. More than 20 years later, those technical problems have indeed arisen, and yet the “new” protocol, IPv6, is still not widely deployed. This paper explores technical and institutional aspects of this case in order to examine how the evolving contexts of infrastructure use may turn technological solutions into infrastructural problems.","",""
"2018","Can the Internet Strengthen Democracy?","","",""
"2018","Framing human rights: exploring storytelling within internet companies","ABSTRACT This article explores human rights storytelling within two of the dominant internet companies, Google and Facebook. Based on interview with company staff as well as analysis of publicly available statements, the article examines how human rights are framed, made sense of and translated into company norms, products, and governance structures. The paper argues that the companies’ framing in many respects resembles that of the United States’ online freedom agenda, celebrating the liberating power of the internet and perceiving human rights as primarily safeguards against repressive governments. The companies see freedom of expression as part of their DNA and do not perceive any contradiction between this standard and business practices that may impact negatively on users’ freedom of expression, such as terms of service enforcement. Likewise, there is no sense of conflict between the online business model and their users’ right to privacy.","",""
"2018","Deliberative polling for multistakeholder internet governance: considered judgments on access for the next billion","ABSTRACT Multistakeholder Internet governance aspires to fulfill democratic values in a process of dialogue producing results that can be considered for possible action. How can these goals be accomplished when the participants in these processes come from entities as varied as corporations, governments, civil society and academia drawn from countries all over the world? How can such a multistakeholder process embody democratic values? How can it be based on dialogue? What kinds of results can it produce? This article applies Deliberative Polling as a possible solution to this problem by using a stratified random sample of netizens, citizens of the Internet, drawn from all the relevant stakeholders of the Internet Governance Forum, engaged together in dialogue and with opinions collected in confidential questionnaires before and after deliberation. This pilot application focused on the topic of Internet access ‒ policy proposals to increase access for the next billion users. We believe it demonstrates the possibility that deliberators drawn from all these sectors can participate in substantive dialogue weighing the merits of issues and coming to specific conclusions. The pilot was limited in its duration and scale but produced, nevertheless, results that strongly support the conclusion that this approach to multistakeholder Internet governance is promising.","",""
"2018","<i>The Turn to Infrastructure in Internet Governance</i>","This book, a comprehensive response to Laura DeNardis’ own 2014 study, The Global War for Internet Governance, arrives at a complicated time for global governance. For the Internet, there is pressu...","",""
"2018","Proteus online"," Scholarship on digital identity has historically reflected a Protean discourse, framing arguments in terms of fluidity and constraint. After explicating the Protean discourse that has framed critical approaches to digital identity, this article exposes how the Internet Corporation for Assigned Names and Numbers (ICANN), in order to justify its centralized authority of the Domain Name System, itself mobilizes a Protean discourse, representing digital identity as a finite supply of water in need of proper management. From its formation in 1998 until 2009, when the US Department of Commerce effectively released the corporation from its official supervision, ICANN assembled a regime for the management of digital identity, which is itself an infrastructure for a global identity industry. By adopting an infrastructural disposition, this article situates global Internet governance in relation to the academic corpus on digital identity, interrogating the discursive conditions by which we have come to understand ourselves in relation to the Internet’s most basic addressing schema, the enclosures within which all virtual communities congregate. ","",""
"2018","The politicization of the Internet’s Domain Name System: Implications for Internet security, universality, and freedom"," One of the most contentious and longstanding debates in Internet governance involves the question of oversight of the Domain Name System (DNS). DNS administration is sometimes described as a “clerical” or “merely technical” task, but it also implicates a number of public policy concerns such as trademark disputes, infrastructure stability and security, resource allocation, and freedom of speech. A parallel phenomenon involves governmental and private forces increasingly altering or co-opting the DNS for political and economic purposes distinct from its core function of resolving Internet names into numbers. This article examines both the intrinsic politics of the DNS in its operation and specific examples and techniques of co-opting or altering DNS’ technical infrastructure as a new tool of global power. The article concludes with an analysis of the implications of this infrastructure-mediated governance on network security, architectural stability, and the efficacy of the Internet governance ecosystem. ","",""
"2018","Internet governance as joint effort: (Re)ordering search engines at the intersection of global and local cultures"," In this article, I investigate Internet governance in practice by focusing on search engines, Google in particular. Building on science and technology studies–grounded Internet governance research, I ask how different stakeholders interpret governing by algorithms, the governing of algorithms, and the limits of various governing modes when considering local specificities. To answer these questions, I conducted 18 qualitative interviews with key experts involved in search engine governance from four distinct societal domains: policy, law, civil society, and the IT sector (from Austria and/or the European level). In this analysis, I show that perceptions of search engine governance are shaped not only in specific cultural contexts but also within particular social groups and their situated knowledges. I further elaborate how joint efforts are imagined as a means to challenge powerful search engines and their governing abilities cutting through different societal arenas and areas of expertise. Finally, I discuss implications of this analysis regarding the complex relationship between global technology and local cultures. ","",""
"2018","Discursive Legitimation in the Cultures of Internet Policymaking","","",""
"2018","Draft Once; Deploy Everywhere? Contextualizing Digital Law and Brazil’s <i>Marco Civil da Internet</i>"," On Congressional approval in 2014, Brazil’s charter of civil rights for the Internet, the Marco Civil da Internet, was widely acclaimed as a template for national Internet policy elsewhere in the world. This was the result of a phenomenon I dub “draft once; deploy everywhere,” a pervasive belief in the universality of Internet law. This presumption underpins multiple charters of Internet rights drafted by digital rights organizations and policymakers. By showing how the Marco Civil was bitterly contested by blocks of powerful actors, the role played by Brazil’s recent history of dictatorship as well as its status at the margins of the global digital economy, I problematize the Marco Civil’s status as a global blueprint. This matters because without proper contextualization, the effective transfer of Internet law across national jurisdictions will be harder to realize, and their democratic virtues will prove more elusive. ","",""
"2019","‘Free country, free internet’: the symbolic power of technology in the Hungarian internet tax protests"," In 2014, the Hungarian government announced the introduction of a tax on internet usage. The proposal generated large protests, which led to its eventual withdrawal. In this article, I investigate the puzzling success of the ‘internet tax’ protests: how could a small tax on internet consumption generate so much contestation? I argue that the internet tax was able to give way to a broader mobilization against the government, because of the symbolic power of the idea of ‘the internet’, to which different political meanings can be attached. Through interviews with Hungarian activists, I reconstruct how the internet was associated with a mobilizing discourse that I term ‘mundane modernity’, which reproduces tropes of Western modernity about the equalizing properties of technology, progress, and rationality, while grounding them in the everyday practices of internet use. I then discuss the types of freedom embedded in mundane modernity and assess its political limitations. ","",""
"2019","LASTING IMPACTS OF 1990S ON INTERNET GOVERNANCE","Over the past few years, Facebook has found itself mired in out controversy after the next. During the 2016 U.S. presidential election, the company received criticism when it was revealed that Russian groups had created fraudulent social media accounts on their site in order to interfere with the elections – creating anti-Hillary groups, groups stoking fears of minority populations, and materials accusing the Democratic Party of voter fraud in an attempt to discourage voter turn-out. The question is, how did we get to this point; the point where foreign entities are affecting political outcomes in other countries through a website created by a private American corporation on a media platform wherein the lines between the cultures and legal systems of different countries is sometimes difficult to draw? To answer this, I look to the policies written by the U.S. Government in the 1990s on the issue of internet governance. I argue that the focus on including commercial interests in these early governance structures has had a lasting impact on the ways in which the internet operates to this day. In considering recent controversies that stem from the blurring lines of online sovereignty, wherein commercial and governmental interests become interwoven without a clear sense of who bears the responsibility when the system operates against the interests of its users, it becomes essential to consider the historical foundations which may have led to this moment.","",""
"2019","ERGM approach to press freedom, regime type, and Internet connectedness","We investigate homophily in the tie structure of the global Internet by estimating Exponential Random Graph (ERG) models. Specifically, we analyze the extent to which different variables including Gross National Income, geographic proximity, political regime type, and press freedom rating account for the pattern of direct country-to-country Internet connections. Results show that for 2011–2014, but not before, press freedom homophily is significantly predictive of the presence (or absence) of country-to-country Internet connections even when controlling for geographic proximity, bandwidth, and whether or not a country is democratic. The regime type variable was a significant predictor in 2002–2004 but not after. The findings provide insights into changes in press freedom around the world and the global Internet structure. The ERG approach used in this study should be useful for future research in related areas.","",""
"2020","Deliberation or Manipulation? The Issue of Governmental Information in Sweden, 1969–1973","abstract:As the first nation in the world to introduce a freedom of information policy, Sweden has attracted relatively little attention in the historiography of information. This article analyzes conflicting ideas of governmental information in public discussions in Sweden between 1969 and 1973. The purpose is to highlight alternative ideas that challenged the government's notion of governmental information. Findings show that the main conflict concerned the interpretation of the desired level of citizen participation and the degree of equality between bureaucracy and citizen, which also caused differing opinions of goals and methods related to governmental information.","",""
"2020","A Spectrum of Shutdowns: Reframing Internet Shutdowns From Africa","","",""
"2020","Internet Shutdowns in Africa| State-Ordered Internet Shutdowns and Digital Authoritarianism in Zimbabwe","This study critically reflects on why and how private telecommunications operators in a militarized authoritarian state comply with government orders to shut down the Internet. It argues that state-ordered Internet shutdowns must be conceptualized as a form of digital authoritarianism. It demonstrates that between 2016 and 2019, the government in Zimbabwe added state-ordered Internet shutdowns to its ever-expanding authoritarian toolkit, thereby negatively impacting the financial sustainability of telecommunications operators. Deploying the critical political economy approach and the metaphor of lawfare, the study demonstrates that the responses of private telecommunications operators to government orders must be understood within the broader context of sociopolitical and economic factors. Although private companies such as Econet Wireless Zimbabwe and Liquid Telecom control a huge chunk of the telecommunications infrastructure, the government often deploys political, regulatory, and lawfare strategies to force through state-ordered Internet shutdowns. The study argues that private telecommunications operators comply with government partly to abide by their licensing obligations, for fear of political harassment and victimization and threats of arbitrary imprisonment.","",""
"2020","Internet Shutdowns in Africa | Internet Shutdowns and the Limits of Law","Internet shutdowns are on the rise. In the past few years, an escalation of this blunt censoring practice has affected different regions of the world, particularly Africa and Asia. Scholars and advocates have proposed no substantive solutions to effectively address Internet shutdowns, and analysis has largely been limited to examining the negative effects through data about their frequency, duration, and economic costs. This article attempts to move beyond the polarized debate between “keep it on” and “shut it off” to explore how there can be more transparency around decision-making processes behind Internet shutdowns. We also discuss the limits of law when it comes to the imposition and implementation of shutdowns. Shutdowns tend to be imposed somewhat arbitrarily with little process. Bringing back legal arguments into the exploration of the justifications around shutdowns may make the use of shutdowns less frequent and more limited, when they do occur.","",""
"2020","Laying the foundation for a commercialized internet: international internet governance in the 1990s","Abstract In the current era, the commercial nature of the internet seems like a foregone conclusion. However, during the administration of U.S. President Bill Clinton, the structures and guidelines for how this global system would operate were unresolved. Clinton took direct steps to ensure the commercialization of the internet and made a deliberate effort to gain agreement with public and private interest groups both in the United States and abroad. This article examines those efforts, focusing on three key questions present in the global discourse: First, where does oversight for internet structures come from, both in terms of country of origin, but also in terms of public versus private sectors? Second, how do traditional economic concerns translate to this new system? And finally, what protections are prioritized in this system? In looking at the patterns in that discourse, I argue that the Clinton Administration’s leadership in the area of internet governance projected a concern for an open, global internet while in actuality, the Administration pursued a U.S.-centric approach to governance that prioritized commercial interests. Given the continued importance of national sovereignty in debates around internet governance, the decisions being made in the 1990s demand further consideration.","",""
"2020","The efficacy of civil society in global internet governance","Abstract Civil society plays a critical role in the multistakeholder approach adopted in Internet governance. However, little is known about the dynamics within that stakeholder group. Besides the struggle and contestation for recognition, civil society actors face less well-known challenges such as managing the diversity among them while striving to arrive at decisions when they participate in global multistakeholder processes as a group. This article investigates the effort of and the challenges faced by civil society in managing its diverse entities to participate while aiming to be influential in watershed multistakeholder fora, namely in the World Summit on the Information Society (WSIS) I and II, Internet Governance Forum (IGF), and the 2014 Global Multistakeholder Meeting on the Future of Internet Governance (NETmundial). Using observational data, documents, and mailing-list messages, this study found that the coordination struggles within civil society affected their goals when they participated in multistakeholder processes. This study suggests that civil society actors need to manage their short- and long-term goals in Internet governance in order to strengthen the legitimacy and efficacy of their participation as a group in Internet-related multistakeholder policy-making processes.","",""
"2020","The crucial and contested global public good: principles and goals in global internet governance","Demands for a more democratic, transparent and accountable management of the internet were strong when preparing for the World Summit on the Information Society Review (WSIS Review), held in 2015. Partly in response to criticism, the United States initiated a process for transferring responsibility for domain names from the United States to the Internet Corporation for Assigned Names and Numbers (ICANN). Increased accountability was among the key motivations for this change. ICANN practices what have subsequently been termed multi-stakeholder governance. This article finds that this form of governance is preferable to an intergovernmental governance model both in terms of transparency and accountability.","",""
"2020","Digital media, political authoritarianism, and Internet controls in Southeast Asia"," A sharp rise in the use of digital media in Southeast Asia in recent years has raised questions about the impact of these digitally networked technologies on the prospect for democratization in a region known for its authoritarian resilience. In the absence of a regional uprising as witnessed in the Middle East through the Arab Spring, Southeast Asian authoritarian states have maintained their durability despite a massive surge in online political activities and in some cases, digitally mediated large-scale mobilization of opposition groups. What explains authoritarian resilience in Southeast Asia in the face of rising opportunities for online political opposition? This article argues that while digital media has emerged as an important repertoire of activism, particularly for political opposition groups, a deft combination of political authoritarianism and increasing Internet controls have stunted democratic pressure in society and hampered future prospect for democratization. It also offers a comparative analysis of how the Internet more generally and digital media in particular has affected state-society relations in Southeast Asia in recent years. In order for digitally mediated political opposition to meaningfully challenge the existing authoritarian incumbents, sufficient opening in the political system is needed. This means, authoritarian states with competitive, routinized elections which have recently experienced large-scale or sustained mobilization by opposition groups are most likely to be susceptible to breakdown than closed regimes. ","",""
